Harbor Restaurant,http://www.opentable.com/harbor-restaurant?scpref=110&tab=2,3.7,"210 Stearns Wharf Santa Barbara, CA  93101 ",42,Seafood,$30 and under,Santa Barbara,http://www.harborsb.com,management@harborsb.com,(805) 963-3311,3.7 / 5,"Notable wine list, but very expensive. We are locals and noticed it was all tourists in the restaurant. Need local specials!",8/28/12,http://www.pickgrapevine.com/wantmore3/harbor-restaurant,harbor-restaurantState Street Wine Bistro,http://www.opentable.com/state-street-wine-bistro?scpref=110&tab=2,4,"516 State St. Santa Barbara, CA  93101 ",17,Contemporary American,$30 and under,Santa Barbara,http://www.pierrelafond.com,manager@pierrelafond.com,(805) 962-1455,4.0 / 5,"The strawberry and Pixie tangerine shortcake with basil syrup was so spectacular that I will assume the restaurant was just having an off night otherwise. Our first courses were not the sum of their parts. The yellowing argula didn't help my wife's salad any. Fortunately my dessert could overcome the tepid coffee served with it. The wine list- SPOILER ALERT, hope you like Lafond!- was abbreviated, but more international than many other choices in the area. On the plus side, mark ups are minimal with Lafond wines priced at almost exactly what they sell for in the tasting room. Service seemed indifferent, so like a good South Park, I randomly inserted the word ""marklar"" into some sentences with the waitress. No one seemed to notice.",8/18/12,http://www.pickgrapevine.com/wantmore3/state-street-wine-bistro,state-street-wine-bistroMarisol at the Cliffs Resort,http://www.opentable.com/marisol-at-the-cliffs-resort?scpref=110&tab=2,4,"2757 Shell Beach Rd Pismo Beach, CA  93449 ",45,Contemporary American,$30 and under,Pismo Beach,http://www.cliffsresort.com,marisol@cliffsresort.com,(805) 773-2511,4.0 / 5,"Like so many hotel, and ""view"" restaurants (can't beat the gorgeous view of the Pacific Ocean and Pismo/Avila Bay, especially from the outdoor patio!), the food (and sometimes service) seems to take a ""back seat"" here! The servers really SEEM to try to do a good job, but our food came out slowly, for the most part, and some things were better than others. I've eaten here a few times before, sometimes with better success than at this dinner. But for example, having had breakfast there, too (earlier the same day), they brought out my Eggs Benedict with NO MEAT on it! Granted, they corrected the problem quickly, and BOTH versions (which I got to eat!) were very tasty, but that's pretty basic!I can recommend, but with limited expectations!",9/1/12,http://www.pickgrapevine.com/wantmore3/marisol-at-the-cliffs-resort,marisol-at-the-cliffs-resortMexItalian,http://www.opentable.com/mexitalian?scpref=110&tab=2,3.3,"503 Water Street Santa Cruz, CA  95060 ",3,Italian,$30 and under,Santa Cruz,http://MexItalianSantaCruz.com,mexitaliansc@gmail.com,(831) 425-1213,3.3 / 5,"Unusual fusion of Mexican & Italian cuisine. The dishes were very good, having a number of the smaller plates in order to sample, could not get enough. Menus was extensive, all fresh ingredients. The calamari & chorizo pizza were just two that were fabulous, must visit & experience.",5/6/12,http://www.pickgrapevine.com/wantmore3/mexitalian,mexitalianFar Western Tavern,http://www.opentable.com/far-western-tavern?scpref=110&tab=2,4.1,"899 Guadalupe St Guadalupe, CA  93434 ",54,Steakhouse,$31 to $50,Santa Barbara,http://www.farwesterntavern.com,MichaelC@Farwesterntavern.com,(805) 343-2211,4.1 / 5,we had a long dinner ticket time and the bar did not have strawberrys for drinks,9/6/12,http://www.pickgrapevine.com/wantmore3/far-western-tavern,far-western-tavernMiro at Bacara Resort,http://www.opentable.com/miro-at-bacara-resort?scpref=110&tab=2,4.4,"8301 Hollister Ave. Goleta, CA  93117 ",20,Contemporary American,$31 to $50,Santa Barbara,http://www.bacararesort.com,miro@bacararesort.com,(805) 571-4204,4.3 / 5,"This restaurant was very romantic and perfect for our special occasion. The food was good, but the portions were very small. We enjoyed the service and beautiful views, but we were still hungry when we left. I would recommend this restaurant for special occasions but plan on small portions of food.",8/8/12,http://www.pickgrapevine.com/wantmore3/miro-at-bacara-resort,miro-at-bacara-resortLodge Restaurant at Carmel Valley Ranch,http://www.opentable.com/lodge-restaurant-at-carmel-valley-ranch?scpref=110&tab=2,4.1,"1 Old Ranch Road Carmel, CA  93923 ",46,Contemporary American,$31 to $50,Carmel,http://www.carmelvalleyranch.com,mshapiro@carmelvalleyranch.com,(831) 625-9500 x545,4.1 / 5,Chef Tim Wood knows his products and he will prepare you a once in a lifettime food experience!,9/4/12,http://www.pickgrapevine.com/wantmore3/lodge-restaurant-at-carmel-valley-ranch,lodge-restaurant-at-carmel-valley-ranchMontecito Wine Bistro,http://www.opentable.com/montecito-wine-bistro?scpref=110&tab=2,3.5,"516 San Ysidro Road Montecito, CA  93108 ",22,Contemporary American,$30 and under,Montecito,http://www.pierrelafond.com,mwb@pierrelafond.com,(805) 969-7520,3.5 / 5,They are having a rough start. They have changed the menu and have added Saturday and Sunday brunch which is nice. My husband and I like to go in the late afternoon for our favorite pizza.. and bottle of local Santa Barbara chardonnay. Highly recommend the pizza's if you go. It's nice to sit by the fireplace inside.. or outside on the patio.,9/3/12,http://www.pickgrapevine.com/wantmore3/montecito-wine-bistro,montecito-wine-bistroMama's Meatball,http://www.opentable.com/mamas-meatball?scpref=110&tab=2,4.6,"570 Higuera St. Suite 130 San Luis Obispo, CA  93401 ",76,Italian,$30 and under,San Luis Obispo,http://www.mamasmeatball.com,nicola@mamasmeatball.com,(805) 544-0861,4.6 / 5,"Always good, always meets our expectations. We had a server on his first night, and he was great! No mistakes, well trained. Good job!",9/5/12,http://www.pickgrapevine.com/wantmore3/mamas-meatball,mamas-meatballMaravilla - Ojai Valley Inn & Spa,http://www.opentable.com/maravilla-ojai-valley-inn-and-spa?scpref=110&tab=2,4.2,"905 Country Club Rd. Ojai, CA  93012 ",33,Californian,$31 to $50,Ojai,http://www.ojairesort.com,noanswer@ojairesort.com,(805) 640-2100,4.2 / 5,"You won't be disappointed, try to eat around sunset and ask for the patio if the weather is nice. The food was great, service was to.",8/17/12,http://www.pickgrapevine.com/wantmore3/maravilla-ojai-valley-inn-and-spa,maravilla-ojai-valley-inn-and-spaNovo Restaurant,http://www.opentable.com/novo-restaurant?scpref=110&tab=2,4.4,"726 Higuera Street San Luis Obispo, CA  93401 ",194,"Global, International",$30 and under,San Luis Obispo,http://novorestaurant.com,novo@novorestaurant.com,(805) 543-3986,4.4 / 5,"A really great place to go to impress a date, boss, in-laws. Funky fresh without being stuffy.",8/16/12,http://www.pickgrapevine.com/wantmore3/novo-restaurant,novo-restaurantOak Tree Ristorante,http://www.opentable.com/oak-tree-ristorante?scpref=110&tab=2,3.7,"5447 Highway 9 Felton, CA  95018 ",7,Italian,$30 and under,Santa Cruz,http://www.oaktreeristorante.com/,oaktreeristorante@gmail.com,(831) 335-5551,3.7 / 5,"Really good food, from appetizers to entrees to desserts. Great bread with olive oil/garlic dips (two different kinds of each). Good quiet relaxed service.",9/1/12,http://www.pickgrapevine.com/wantmore3/oak-tree-ristorante,oak-tree-ristoranteMontrio Bistro,http://www.opentable.com/montrio-bistro?scpref=110&tab=2,4.3,"414 Calle Principal Monterey, CA  93940 ",193,Californian,$31 to $50,Monterey,http://www.montrio.com,office@montrio.com,(831) 648-8880,4.3 / 5,Took my girlfriend here for her birthday and we both absolutely loved it. The food was incredible and the place was very classy. Loved the whole experience.,9/3/12,http://www.pickgrapevine.com/wantmore3/montrio-bistro,montrio-bistroShadowbrook Restaurant Capitola,http://www.opentable.com/shadowbrook-restaurant?scpref=110&tab=2,4.5,"1750 Wharf Rd. Capitola, CA  95010 ",592,American,$30 and under,Capitola,http://www.shadowbrook-capitola.com,office@shadowbrook-capitola.com,(831) 475-1511,4.5 / 5,Shadowbrook has been a long time favorite of ours for the special occasion. The service and food were excellent with a very nice menu selection and specials. Both of our entrees were exceptional and very satisfying. The pricing was also very reasonable especially for the quality of the food and service.,9/7/12,http://www.pickgrapevine.com/wantmore3/shadowbrook-restaurant,shadowbrook-restaurantEpsilon,http://www.opentable.com/epsilon?scpref=110&tab=2,4,"422 Tyler Street Monterey, CA  93940 ",8,Greek,$30 and under,Monterey,http://www.epsilonrestaurant.com,petros@epsilonrestaurant.com,(831) 655-8108,4.0 / 5,"Staff was friendly. Food was very good, I enjoyed watching my son's eye light up when they flambí©ed the dish called The Olympic Touch table side. It was my wife birthday, she enjoyed it very much.",8/17/12,http://www.pickgrapevine.com/wantmore3/epsilon,epsilonEdgar's - Quail Lodge,http://www.opentable.com/edgars-quail-lodge?scpref=110&tab=2,3.8,"8000 Valley Greens Drive Carmel, CA  93923 ",16,Californian,$30 and under,Carmel,http://quaillodge.com/edgars.cfm,qlreservations@quaillodge.com,(831) 620-8910,3.8 / 5,"I have eaten in a good many restaurants over the past four decades and it is always disappointing when the front of the house does not do justice to the kitchen. Edgar's suffers from this affliction. The food was very good, nice layering of flavors, perfect temperature, and decent variety. This is the reason that I would go back.",9/1/12,http://www.pickgrapevine.com/wantmore3/edgars-quail-lodge,edgars-quail-lodgeBistro 1111 at Hyatt Santa Barbara,http://www.opentable.com/bistro-1111-at-hyatt-santa-barbara?scpref=110&tab=2,3.5,"1111 E. Cabrillo Rd. Santa Barbara, CA  93103 ",12,Californian,$30 and under,Santa Barbara,http://www.santabarbara.hyatt.com,quality.sbars@hyatt.com,(805) 730-1111,3.5 / 5,Shrimp appetizer was good. Only 3 shrimps for $15. The chicken tortilla soup could have used more kick. The soup has plenty of nice chicken in it,8/31/12,http://www.pickgrapevine.com/wantmore3/bistro-1111-at-hyatt-santa-barbara,bistro-1111-at-hyatt-santa-barbaraAubergine at L'Auberge Carmel,http://www.opentable.com/aubergine-at-lauberge-carmel?scpref=110&tab=2,4.5,"Monte Verde &amp; 7th Ave. Carmel, CA  93921 ",52,Californian,$50 and over,Carmel,http://www.auberginecarmel.com,reservations@laubergecarmel.com,(831) 624-8578,4.5 / 5,"The whole experience was AMAZING! I've eaten in many fine restaurants all over the world. THIS WAS THE MOST AMAZING DINNER I'VE EVER EATEN! Chef and staff, 10 star!",8/22/12,http://www.pickgrapevine.com/wantmore3/aubergine-at-lauberge-carmel,aubergine-at-lauberge-carmelWillows at Chumash Casino,http://www.opentable.com/willows-at-chumash-casino?scpref=110&tab=2,4.2,"3400 E. Hwy 246 Santa Ynez, CA  93460 ",22,Contemporary American,$31 to $50,Santa Ynez Valley,http://www.chumashcasino.com,richard.hollowell@chumashcasino.com,(805) 686-3800,4.2 / 5,"Excellent food and service. We wanted to eat outside but smoking is allowed and that was a turn off. Someone was smoking at the time and it does smell up the whole patio, so they seated us back inside again.",8/29/12,http://www.pickgrapevine.com/wantmore3/willows-at-chumash-casino,willows-at-chumash-casinoRobin's,http://www.opentable.com/robins?scpref=110&tab=2,4.3,"4095 Burton Dr. Cambria, CA  93428 ",117,International,$30 and under,Cambria,http://www.robinsrestaurant.com,robins@robinsrestaurant.com,(805) 927-5007,4.3 / 5,"Robin's is a ""must"" in Cambria!",9/4/12,http://www.pickgrapevine.com/wantmore3/robins,robinsRoy,http://www.opentable.com/roy?scpref=110&tab=2,4.2,"7 W. Carrillo St. Santa Barbara, CA  93101 ",26,Contemporary American,$30 and under,Santa Barbara,http://www.restaurantroy.com,roy@restaurantroy.com,(805) 899-3458,4.1 / 5,"After reading so many great reviews, decided to try Roy for a birthday celebration. In addition to ordering two other satisfactory though unexceptional entrees (caprese salad and salmon), we ordered their Harris Ranch filet mignon; this turned out to be tough and almost inedible. Returned the steak to server with explanation of same. Server offered to have another steak prepared in its place. However, concerned that the quality might be similarly low, we declined. Expected to receive a credit on our bill instead, but after leaving restaurant, in checking with the member of our party who had treated everyone, learned that our server had not deducted anything from bill. Not very professional or customer friendly.",9/3/12,http://www.pickgrapevine.com/wantmore3/roy,royRoy,http://www.opentable.com/roy?scpref=110&tab=2,4.2,"7 W. Carrillo St. Santa Barbara, CA  93101 ",26,Contemporary American,$30 and under,Santa Barbara,http://www.restaurantroy.com,pcondon@rackspace.com,(805) 899-3458,4.1 / 5,"After reading so many great reviews, decided to try Roy for a birthday celebration. In addition to ordering two other satisfactory though unexceptional entrees (caprese salad and salmon), we ordered their Harris Ranch filet mignon; this turned out to be tough and almost inedible. Returned the steak to server with explanation of same. Server offered to have another steak prepared in its place. However, concerned that the quality might be similarly low, we declined. Expected to receive a credit on our bill instead, but after leaving restaurant, in checking with the member of our party who had treated everyone, learned that our server had not deducted anything from bill. Not very professional or customer friendly.",9/3/12,http://www.pickgrapevine.com/wantmore3/roy,roySandbar Mexican Restaurant,http://www.opentable.com/sandbar-mexican-restaurant?scpref=110&tab=2,3.9,"514 State Street Santa Barbara, CA  93101 ",14,Mexican,$30 and under,Santa Barbara,http://www.SandbarSB.com,sandbarpromo@sharkeez.net,(805) 252-5409,3.9 / 5,"We sat outdoors, overlying a pleasant streetscape in downtown Santa Barbara. The tables had oilcloth and the menus were worn. However, the food was excellent. I had the seafood enchiladas with tomatillo sauce. Other entrees at our table were fish tacos and a beef burrito. The margaritas were excellent as well.",8/27/12,http://www.pickgrapevine.com/wantmore3/sandbar-mexican-restaurant,sandbar-mexican-restaurantMarmalade Cafe - Santa Barbara,http://www.opentable.com/marmalade-cafe-santa-barbara?scpref=110&tab=2,3.7,"3825 State St Santa Barbara, CA  93105 ",21,Californian,$30 and under,Santa Barbara,http://www.marmaladecafe.com,santabarbara@marmaladecafe.com,(805) 682-5246,3.8 / 5,Enjoyable dinner with family and friends. Surf and turf great. Service good.,8/25/12,http://www.pickgrapevine.com/wantmore3/marmalade-cafe-santa-barbara,marmalade-cafe-santa-barbaraLouieäó»s Cajun Kitchen and Bourbon Bar,http://www.opentable.com/louies-cajun-kitchen-and-bourbon-bar?scpref=110&tab=2,4.3,"110 Church St Santa Cruz, CA  95060 ",3,American,$30 and under,Santa Cruz,http://www.cloudsdowntown.com,santacloud@aol.com,(831) 429-2000,4.3 / 5,"The food was delicious. we were there on a Tuesday night and it was pretty quiet sans for a few tables, and some guys watching sports at the bar. Large drink list (I got a delicious cucumber cocktail). The waiter allowed my aunt to add fish to the portabella mushroom dish and modified it to make it even more delicious. I had swordfish that was flavored and cooked perfectly. If you are looking for a nicer meal in a more casual town like Santa Cruz, this is a great place!",6/12/12,http://www.pickgrapevine.com/wantmore3/louies-cajun-kitchen-and-bourbon-bar,louies-cajun-kitchen-and-bourbon-barSides Hardware and Shoes - A Brothers Restaurant,http://www.opentable.com/sides-hardware-and-shoes-a-brothers-restaurant?scpref=110&tab=2,4.5,"2375 Alamo Pintado Avenue Los Olivos, CA  93441 ",135,American,$30 and under,Santa Ynez Valley,http://www.brothersrestaurant.com,sidesrestaurant@gmail.com,(805) 688-4820 x103,4.5 / 5,Sides is like having an Ad Hoc in the Santa Ynez Valley. Food is inventive and always well prepared and presented. Lisa is a terrific server. Only shortcoming is that they do not keep white wine cool enough before bringing to the table. Has to chill some before opening.,8/31/12,http://www.pickgrapevine.com/wantmore3/sides-hardware-and-shoes-a-brothers-restaurant,sides-hardware-and-shoes-a-brothers-restaurantSierra Mar - Post Ranch Inn,http://www.opentable.com/sierra-mar-post-ranch-inn?scpref=110&tab=2,4.8,"Highway One Big Sur, CA  93920 ",37,Organic,$50 and over,Big Sur,http://postranchinn.com,sierramar@postranchinn.com,(831) 667-2800,4.7 / 5,"This is more than a 'scenic' view. This is one of the most breathtaking views on earth. The service was excellent, we arrived early for our reservation, and they seated us as soon as dinner service started. While waiting, we sat in the outdoor area by the bar and watched dolphins and whales through binoculars they provided. The restaurant seems to hang off a cliff overlooking the ocean. The food was excellent also, and very well presented.",9/4/12,http://www.pickgrapevine.com/wantmore3/sierra-mar-post-ranch-inn,sierra-mar-post-ranch-innSea Venture,http://www.opentable.com/sea-venture?scpref=110&tab=2,4,"100 Ocean View Ave. Pismo Beach, CA  93449 ",60,Contemporary American,$30 and under,Pismo Beach,http://seaventurerestaurant.com,simon@seaventure.com,(805) 773-3463,4.0 / 5,"Very nice view, nice atomosphere. The food, not so great, as follows: I ordered the pork chop, it was OK,, but a little tough. My nephew ordered the salmon, it was good. My wife and my nephew's wife ordered the pan fried ""snapper"". My wife is from a country that lives on fish. They were very disappointed. There was no way it was snapper. It was not tilapa (Red Lobster tries this all the time), but it was NOT snapper. Cod possibly. It was very similar to the fish you would find in a fast food sandwich. Both of them left over half the fish uneaten. They would not let me complain, they believe it is not polite (cultural issue).",8/24/12,http://www.pickgrapevine.com/wantmore3/sea-venture,sea-ventureStonehouse at San Ysidro Ranch,http://www.opentable.com/stonehouse-at-san-ysidro-ranch?scpref=110&tab=2,4.5,"900 San Ysidro Lane Santa Barbara, CA  93108 ",119,Contemporary American,$31 to $50,Santa Barbara,http://www.sanysidroranch.com,stonehouse@sanysidroranch.com,(805) 565-1700,4.5 / 5,"The Stonehouse restaurant is located in the San Ysidro Ranch Hotel. The best thing about the Stonehouse is the outdoor patio dining, the ambiance and the service.",9/4/12,http://www.pickgrapevine.com/wantmore3/stonehouse-at-san-ysidro-ranch,stonehouse-at-san-ysidro-ranchGardens of Avila Restaurant,http://www.opentable.com/gardens-of-avila-restaurant?scpref=110&tab=2,3.8,"1215 Avila Beach Dr. San Luis Obispo, CA  93405 ",32,Contemporary American,$30 and under,San Luis Obispo,http://www.sycamoresprings.com/taste/,tborgardt@smsr.com,(805) 595-7302,3.9 / 5,"This was our first visit and we will return---we ate in the bar area which was both romantic and cozy. The full menu was available there as well as a bar menu. The staff was attentive, friendly, and knowledgeable. My wife had breast of chicken which was both generous and moist. I had a pasta dish, tagliatelle with vegetables that was excellent. For the full menu, except to pay in the mid 20 to low 30 dollar range but for a nice/special dinner, it was well worth it.",8/30/12,http://www.pickgrapevine.com/wantmore3/gardens-of-avila-restaurant,gardens-of-avila-restaurantBistro at Bacara Resort,http://www.opentable.com/bistro-at-bacara-resort?scpref=110&tab=2,4,"8301 Hollister Ave. Goleta, CA  93117 ",9,Californian,$30 and under,Santa Barbara,http://www.bacararesort.com,thebistro@bacaresort.com,(805) 571-3277,4.0 / 5,Excellent food for both dinner/lunch! Great views and the margarita's are awesome!,7/24/12,http://www.pickgrapevine.com/wantmore3/bistro-at-bacara-resort,bistro-at-bacara-resortThomas Hill Organics,http://www.opentable.com/thomas-hill-organics?scpref=110&tab=2,4.4,"1305 Park St Paso Robles, CA  93446 ",127,American,$30 and under,Paso Robles,http://www.thomashillorganics.com,thomashillfarms@earthlink.net,(805) 226-5888,4.4 / 5,"All the flavors and food combinations I would never prepare at home because they just don't seem to blend, UNTIL you put it in your mouth! OMG the taste of everything is amazing! A must every time I'm in Paso!",9/6/12,http://www.pickgrapevine.com/wantmore3/thomas-hill-organics,thomas-hill-organicsThe Restaurant at Ventana,http://www.opentable.com/the-restaurant-at-ventana?scpref=110&tab=2,4.4,"48123 California One Big Sur, CA  93920 ",88,Californian,$31 to $50,Big Sur,http://www.ventanainn.com/dining.aspx,tjones@jdvhotels.com,(831) 667-4242,4.4 / 5,Had an amazing meal at Ventana Inn. Service was excellent and the food was delicious as was the incredible wine selection. Sit outside and enjoy!,8/27/12,http://www.pickgrapevine.com/wantmore3/the-restaurant-at-ventana,the-restaurant-at-ventanaLopez Restaurante y Cantina,http://www.opentable.com/lopez-restaurante-y-cantina?scpref=110&tab=2,3.5,"635 Cass St. Monterey, CA  93940 ",4,Mexican,$30 and under,Monterey,http://www.lopezrestaurante.com,tolteca23@yahoo.com,(831) 324-4260,3.5 / 5,"OK Mexican food, but nothing to write home about. The hostess was clueless about OpenTable, so the reservation was pointless. Fortunately, they had room for us. The dining room was dark and windowless; the fajitas ordered by a large group smoked up the whole room: there was poor air circulation. The server was friendly.",7/7/12,http://www.pickgrapevine.com/wantmore3/lopez-restaurante-y-cantina,lopez-restaurante-y-cantinaTre Lune,http://www.opentable.com/tre-lune?scpref=110&tab=2,4.1,"1151 Coast Village Rd. Santa Barbara, CA  93108 ",45,Italian,$31 to $50,Montecito,http://www.trelunesb.com/,tre_lune@yahoo.com,(805) 969-2646,4.1 / 5,We went on a Sunday expecting lunch however they only serve breakfast on Sundays. It was yummy!,8/12/12,http://www.pickgrapevine.com/wantmore3/tre-lune,tre-luneTusCA Ristorante,http://www.opentable.com/tusca-ristorante?scpref=110&tab=2,3.8,"1 Old Golf Course Road Monterey, CA  93940 ",13,Italian,$30 and under,Monterey,http://www.tuscaristorante.com,TusCA@hyatt.com,(831) 657-6675,3.8 / 5,It was just okay. Good hotel restaurant. I would not seek them out for any occasion. Food just okay. It was surprisingly pricey.,6/11/12,http://www.pickgrapevine.com/wantmore3/tusca-ristorante,tusca-ristoranteIl Cortile Ristorante,http://www.opentable.com/il-cortile-ristorante?scpref=110&tab=2,4.4,"608 12th St. Paso Robles, CA  93446 ",111,Italian,$31 to $50,Paso Robles,http://www.ilcortileristorante.com,vinnie40@earthlink.net,(805) 226-0300,4.4 / 5,"Many thanks again, Il Cortile, for great service, always delicious food. Thank you also for making us very welcomed. We will be back. That's for sure.",9/3/12,http://www.pickgrapevine.com/wantmore3/il-cortile-ristorante,il-cortile-ristoranteWills Fargo,http://www.opentable.com/wills-fargo?scpref=110&tab=2,3.3,"19 East Carmel Valley Rd Carmel Valley, CA  93924-9703 ",23,Steakhouse,$30 and under,Carmel,http://www.bernardus.com/lodge/restaurants/,willsfargo@redshift.com,(831) 659-2774,3.3 / 5,"We had an awful experience....starting with our waiter being 15 min late for his shift. We sat there unattended and ready to leave when he showed up.The hostess took our drink order and, again, it took about 15 minutes just to get a glass of wine.In addition, the fish was ok but the sauce for it was bland. My husband did not receive any condiments for his baked potatoe. He would have asked for something if we had ever seen our waiter.Next, my husband asked for another glass of wine with dinner, and never received it.I have found the service to be awful from the day Bernardus took it over.I'm telling all my friends what a terrible experience it was and to beware if they go there.Barbara",9/1/12,http://www.pickgrapevine.com/wantmore3/wills-fargo,wills-fargo1862 David Walley's Restaurant and Saloon,http://www.opentable.com/1862-david-walleys-restaurant-and-saloon?scpref=110&tab=2,3.9,"2001 Foothill Road Genoa, NV  89411 ",9,American,$31 to $50,South Shore,http://www.1862davidwalleysrestaurantandsaloon.com,1862DavidWalleys@summerwindsresorts.com,(888) 737-1862,3.9 / 5,"Unusual locale cuisine items, ample portions, great presentation, very well prepared and delicious, perhaps a bit pricey. Service was great without being fawning.",7/4/12,http://www.pickgrapevine.com/wantmore3/1862-david-walleys-restaurant-and-saloon,1862-david-walleys-restaurant-and-saloonThe Ahwahnee Hotel Dining Room - Ahwahnee Hotel,http://www.opentable.com/the-ahwahnee-hotel-dining-room-ahwahnee-hotel?scpref=110&tab=2,4.1,"1 Ahwahnee Road Yosemite Village, CA  95389 ",711,Californian,$31 to $50,Yosemite,http://www.yosemitepark.com,khill@dncinc.com,(209) 372-1489,4.2 / 5,Especially good service. A most delightful dining experience. Food was excellent.,9/5/12,http://www.pickgrapevine.com/wantmore3/the-ahwahnee-hotel-dining-room-ahwahnee-hotel,the-ahwahnee-hotel-dining-room-ahwahnee-hotelPlumpJack Cafe Squaw Valley,http://www.opentable.com/plumpjack-cafe-squaw-valley?scpref=110&tab=2,4.1,"1920 Squaw Valley Road Olympic Valley, CA  96146 ",43,American,$30 and under,Squaw Valley,http://www.plumpjackcafe.com,svi@plumpjack.com,(530) 583-1578,4.1 / 5,"made a reservation for jakes in tahoe city for Aug 30 at 7 pm. made the reservation before noon the 30th. When we arrived, they had no record of our reservation? They were able to seat us so worked out anyway.",8/31/12,http://www.pickgrapevine.com/wantmore3/plumpjack-cafe-squaw-valley,plumpjack-cafe-squaw-valley