Gennaro's Grill & Garden,http://www.opentable.com/gennaros-grill-and-garden?scpref=110&tab=2,4.3,"450 Marsh Street San Luis Obispo, CA  93401 ",22,Italian,$30 and under,San Luis Obispo,http://gennarosgrillandgarden.com,gennaro@gennarosgrillandgarden.com,(805) 782-9999,4.3 / 5,"A very nice Italian restaurant in a old Victorian house. They were not busy on the week night we dined and the noise level was low so be could enjoy our friends without shouting. The patio was very nice, heated and out of the wind so it was very comfortable outside. Our food was good but not exceptional. Our party of 4 had three different items so we got a good sampling of menu items. We had recently dined at Gina's in Arroyo Grande and found the food to be better than Gennaro's.",8/16/12,http://www.pickgrapevine.com/wantmore3/gennaros-grill-and-garden,gennaros-grill-and-gardenParadise Beach Grille,http://www.opentable.com/paradise-beach-grille?scpref=110&tab=2,4.4,"215 Esplanade Capitola, CA  95010 ",12,American,$30 and under,Capitola,http://www.paradisebeachgrille.com,gm@paradisebeachgrille.com,(831) 476-4900,4.4 / 5,The service is fir for a foodie and also for a kid. There The food is very memorable fresh and always generous portions. Right after the beach it's a great place to go on a date with and for a first date all dressed up.,8/22/12,http://www.pickgrapevine.com/wantmore3/paradise-beach-grille,paradise-beach-grilleMarinus - Bernardus Lodge,http://www.opentable.com/marinus-bernardus-lodge?scpref=110&tab=2,4.7,"415 West Carmel Valley Rd Carmel Valley, CA  93924 ",42,Californian,$50 and over,Carmel,http://www.bernardus.com,gmartin@bernardus.com,(831) 658-3400,4.7 / 5,"While in Carmel we always look forward to dining at Marinus. The menu has changed since we were here last Christmas and so has the decor in the dining room. However, the food continues to be delicious and beautifully presented by a courteous and coordinated staff.",9/5/12,http://www.pickgrapevine.com/wantmore3/marinus-bernardus-lodge,marinus-bernardus-lodgeWickets Bistro - Bernardus Lodge,http://www.opentable.com/wickets-bistro-bernardus-lodge?scpref=110&tab=2,4.6,"415 Carmel Valley Rd Carmel Valley, CA  93924 ",27,Californian,$31 to $50,Carmel,http://www.bernardus.com,gmartin@bernardus.com,(831) 658-3400,4.6 / 5,"Small but good menu, gourmet pizzas, steaks, seafood and chicken. Something for everyone. too bad patio was closed for private party, but we hung out until they left and enjoyed a bottle of wine by the fire. Recommend this spot!",8/17/12,http://www.pickgrapevine.com/wantmore3/wickets-bistro-bernardus-lodge,wickets-bistro-bernardus-lodgeArtisan,http://www.opentable.com/artisan?scpref=110&tab=2,4.5,"1401 Park St. Paso Robles, CA  93446 ",252,Contemporary American,$31 to $50,Paso Robles,http://www.artisanpasorobles.com,info@artisanpasorobles.com,(805) 237-8084,4.5 / 5,"The food is absolutely outstanding - both the quality of the ingredients and the preparation/plating. Very knowledgable wait staff.The restaurant is too noisy for our liking. However, when we were moved to the back room the noise level became tolerable and we could once again hear each other speak.",9/6/12,http://www.pickgrapevine.com/wantmore3/artisan,artisanBig Sur River Inn,http://www.opentable.com/big-sur-river-inn?scpref=110&tab=2,4.1,"46840 Highway 1 Highway One at Pheneger Creek Big Sur, CA  93920",10,Californian,$30 and under,Big Sur,http://www.BIGSURRIVERINN.COM,info@bigsurriverinn.com,(831) 667-2700,4.1 / 5,Big Sur River Inn is one of our very favorite places. Sunday afternoon there is live jazz on the patio....you can bring a blanket and relax on the lawn or there are chairs in the river that flows....kids can play in the shallow river. This place is magical. It is truly a hidden gem----you would never guess about its beauty if you are just driving by the front of the establishment.,8/19/12,http://www.pickgrapevine.com/wantmore3/big-sur-river-inn,big-sur-river-innBouchon - Santa Barbara,http://www.opentable.com/bouchon-santa-barbara?scpref=110&tab=2,4.6,"9 West Victoria St. Santa Barbara, CA  93101 ",303,Californian,$31 to $50,Santa Barbara,http://www.bouchonsantabarbara.com,info@bouchonsantabarbara.com,(805) 730-1160,4.6 / 5,"top notch food, great service, great place for special occasions, I went there for my 2 year wedding anniversary and my wife and I both enjoy it.",9/2/12,http://www.pickgrapevine.com/wantmore3/bouchon-santa-barbara,bouchon-santa-barbaraLos Olivos Wine Merchant & Cafe,http://www.opentable.com/los-olivos-wine-merchant-and-cafe?scpref=110&tab=2,4.3,"2879 Grand Avenue Los Olivos, CA  93441 ",144,Californian,$30 and under,Santa Ynez Valley,http://www.losolivoscafe.com,info@buysantabarbarawine.com,(805) 688-7265,4.3 / 5,Wonderful food and happy to help with gluten free dining! Will definitely come back.,8/16/12,http://www.pickgrapevine.com/wantmore3/los-olivos-wine-merchant-and-cafe,los-olivos-wine-merchant-and-cafeCafe Roma,http://www.opentable.com/cafe-roma?scpref=110&tab=2,4.3,"1020 Railroad Ave San Luis Obispo, CA  93401 ",44,Italian,$30 and under,San Luis Obispo,http://www.caferomaslo.com,info@caferomaslo.com,(805) 541-6800,4.3 / 5,Always the number one choice for bringing guests and for quality dining.,9/6/12,http://www.pickgrapevine.com/wantmore3/cafe-roma,cafe-romaCannery Row Brewing Company,http://www.opentable.com/cannery-row-brewing-company?scpref=110&tab=2,3.6,"95 Prescott Avenue Monterey, CA  93940 ",35,American,$30 and under,Monterey,http://www.canneryrowbrewingcompany.com,info@canneryrowbrewingcompany.com,(831) 643-2722,3.6 / 5,"Ok food, great beer list and location",9/1/12,http://www.pickgrapevine.com/wantmore3/cannery-row-brewing-company,cannery-row-brewing-companyCantinetta Luca,http://www.opentable.com/cantinetta-luca?scpref=110&tab=2,4.1,"Dolores St. between Ocean and 7th Carmel, CA  93921 ",145,Italian,$30 and under,Carmel,http://www.cantinettaluca.com,info@cantinettaluca.com,(831) 625-6500,4.1 / 5,slightly expensive but overall a good valuevery good foodnice atmosphere butway too loud--can't hear person across the tableexcellent professional staffglad I ate there and would do it again,8/18/12,http://www.pickgrapevine.com/wantmore3/cantinetta-luca,cantinetta-lucaCava Restaurant,http://www.opentable.com/cava-restaurant?scpref=110&tab=2,3.9,"1212 Coast Village Road Santa Barbara, CA  93108 ",39,Latin / Spanish,$30 and under,Montecito,http://www.cavarestaurant.com,info@cavarestaurant.com,(805) 969-8500,3.9 / 5,Consistently enjoyable meals and atmosphere.,8/16/12,http://www.pickgrapevine.com/wantmore3/cava-restaurant,cava-restaurantCielito Restaurant,http://www.opentable.com/cielito-restaurant?scpref=110&tab=2,4.1,"1114 State St. Santa Barbara, CA  93101 ",34,Mexican,$30 and under,Santa Barbara,http://www.cielitorestaurant.com,info@cielitorestaurant.com,(805) 965-4770,4.1 / 5,This was our third visit to Cielito and the upscale and authtentic Mexican food keeps us coming back for more.,8/18/12,http://www.pickgrapevine.com/wantmore3/cielito-restaurant,cielito-restaurantGrasing's,http://www.opentable.com/grasings?scpref=110&tab=2,4.3,"NW Corner of 6th &amp; Mission Ave. Carmel, CA  93921 ",104,Californian,$31 to $50,Carmel,http://www.grasings.com,info@grasings.com,(831) 624-6562,4.3 / 5,"The last time we were at Grasings the service was terrible...the maitre d was unfriendly and not at all wecoming. We had a good brunch, but don't know that we'll go back with so many other friendly,good restaurants in Carmel.",8/18/12,http://www.pickgrapevine.com/wantmore3/grasings,grasingsJohnny's Harborside,http://www.opentable.com/johnnys-harborside?scpref=110&tab=2,4.1,"493 Lake Avenue Santa Cruz, CA  95060 ",84,Seafood,$30 and under,Santa Cruz,http://www.johnnysharborside.com,info@johnnysharborside.com,(831) 479-3430,4.1 / 5,The fish of the day with the barbeque is funky. They did not have our table for the right time and wanted to sit us 30 min later even though it was not busy. Might go back.,8/16/12,http://www.pickgrapevine.com/wantmore3/johnnys-harborside,johnnys-harborsideLaili,http://www.opentable.com/laili?scpref=110&tab=2,4.4,"101B Cooper St Santa Cruz, CA  95060 ",159,Mediterranean,$30 and under,Santa Cruz,http://www.lailirestaurant.com,info@lailirestaurant.com,(831) 423-4545,4.4 / 5,"I have come here many times, both with my boyfriend or with the addition of another couple as well. We have received good service in the past, but the past trip was off. When we got there we were checked in, as we are obviously hoping to be checked in and not be penalized by opentable, and we were seated immediately. Our server came over and told us some specials and then ignored us for 15-20 minutes. When she came back over and I made a note of this, not only were they out of what my boyfriend wanted to order then, she became combative with me, I was the problem apparently. She then went and checked the computer after we ordered and came back and said ""for the record it was 15 minutes since you came in""... wow. Love the food, but wow.",8/17/12,http://www.pickgrapevine.com/wantmore3/laili,lailiLucky's,http://www.opentable.com/luckys?scpref=110&tab=2,4.5,"1279 Coast Village Road Santa Barbara, CA  93108 ",74,Steakhouse,$50 and over,Montecito,http://www.luckys-steakhouse.com,info@luckys-steakhouse.com,(805) 565-7540,4.5 / 5,"We kept passing this restaurant and wanted to try it, even though our hotel didn't recommend it. It's definitely a local hangout. Great bar and service, but that's where the compliments end. Steak is king, and looking at the prices we expected an experience similar to the Palm. I had a sliced steak salad for $24. It was literally a lump of bland steak cut in four pieces on a bed of mixed greens absolutely drowning in balsamic. Partner's dish was equally disappointing. Only food worth mentioning was the broccolini. $120 for steak salad, glass of wine, turkey burger, side dish and a diet coke!",9/2/12,http://www.pickgrapevine.com/wantmore3/luckys,luckysLuna Red,http://www.opentable.com/luna-red?scpref=110&tab=2,4.2,"1023 Chorro Street San Luis Obispo, CA  93401 ",86,International,$30 and under,San Luis Obispo,http://www.lunaredslo.com/,info@lunaredslo.com,(805) 540-5243,4.1 / 5,"We have been meaning to try Luna Red since they first opened at their old location, finally made it down to their new location at the mission. Their patio is a great dining location and the staff was all very friendly and helpful. They have a great farm to table philosophy and their drinks are quite good. The Tapas thing I'm not really a fan of, but they have great food. Many interesting fusions of different cultures but they make it work so well! I must say, we tried many items from their menu and I don't think you can go wrong with anything they offer.",8/15/12,http://www.pickgrapevine.com/wantmore3/luna-red,luna-redMadonna Inn - Alex Madonna's Gold Rush Steak House,http://www.opentable.com/madonna-inn-alex-madonnas-gold-rush-steak-house?scpref=110&tab=2,4.3,"100 Madonna Road San Luis Obispo, CA  93405 ",128,Steakhouse,$31 to $50,San Luis Obispo,http://www.madonnainn.com,info@madonnainn.com,(805) 543-3000,4.3 / 5,We enjoyed our evening. We had stayed at the Madonna Inn on our honeymoon 37 years ago and this was our first time back. I'm sure we will return.,9/6/12,http://www.pickgrapevine.com/wantmore3/madonna-inn-alex-madonnas-gold-rush-steak-house,madonna-inn-alex-madonnas-gold-rush-steak-houseMichael's on Main,http://www.opentable.com/michaels-on-main?scpref=110&tab=2,3.7,"2591 Main Street Soquel, CA  95073 ",11,Comfort Food,$30 and under,Soquel,http://www.michaelsonmain.net,info@michaelsonmain.net,(831) 479-9777,3.7 / 5,"Service was very poor. We were a group of 6 and we sat outside and felt we were forgotten all night. Had to request for everything utensils, bread etc. Four of the six meals came out together and the other two came late. I was celebrating my birthday and my dish was one of the ones that was served late. When my meal did arrive it was cold and unappetizing. Also there heat lamps were not working. Unfortunately we were sat by the heat lamp that didn't work. Michael's was hosting a high school reunion that night and it was a busy night and perhaps that is why the service was so poor. However, I believe they should have planned for the extra business.",7/21/12,http://www.pickgrapevine.com/wantmore3/michaels-on-main,michaels-on-mainPanolivo,http://www.opentable.com/panolivo?scpref=110&tab=2,4,"1344 Park St. Paso Robles, CA  93446 ",42,Contemporary French,$30 and under,Paso Robles,http://www.panolivo.com,info@panolivo.com,(805) 239-3366,4.0 / 5,"Great food - every dish was cooked perfectly and the ambiance was quaint and relaxed, but classy. LOVED the champagne-and-kir drink. The menu has a much-welcome variety: plenty of vegetarian options as well as meat entrees. The rigatoni and ravioli were great, and even simpler items like the ""delicious salad"" were something a little special. Attentive service, and we much enjoyed the outdoor seating for an early dinner.",8/25/12,http://www.pickgrapevine.com/wantmore3/panolivo,panolivoPassionfish,http://www.opentable.com/passionfish-pacific-grove?scpref=110&tab=2,4.4,"701 Lighthouse Avenue Pacific Grove, CA  93950 ",287,Seafood,$30 and under,Pacific Grove,http://www.passionfish.net/,info@passionfish.net,(831) 655-3311,4.4 / 5,"We were expecting a lot based reviews. However, Passionfish in our opinion failed to live up to these reviews. While the menu is different and very interesting we felt everything was just ok. We had the roasted beet salad. It was again ok. Nothing special. Also we had the starter, Salmon Ceviche..again..ok. For dinner we both ordered the scallops, which everyone raves about in the reviews. We both found the scallops (at least the larger ones) undercooked. That really didn't sit well with us. IF I ever went back, which I wouldn't, I certainly would not order this dish again. For dessert we shared the Banana bread pudding and the lemon creme brulee. YUM. Sorry Passionfish we really wanted to like you. Maybe just go for dessert.",9/4/12,http://www.pickgrapevine.com/wantmore3/passionfish-pacific-grove,passionfish-pacific-groveRocky Point Restaurant,http://www.opentable.com/rocky-point-restaurant?scpref=110&tab=2,3.7,"36700 Hwy 1 Carmel, CA  93923 ",58,Steakhouse,$30 and under,Carmel,http://www.rocky-point.com,info@rocky-point.com,(831) 624-2933,3.7 / 5,A great spot to have a brunch on the way to Big Sur. Quite pricey but the view and the ambiance is worth.,8/19/12,http://www.pickgrapevine.com/wantmore3/rocky-point-restaurant,rocky-point-restaurantSardine Factory,http://www.opentable.com/sardine-factory?scpref=110&tab=2,4.6,"701 Wave Street Monterey, CA  93940 ",194,Seafood,$31 to $50,Monterey,http://www.sardinefactory.com,info@sardinefactory.com,(831) 373-3775,4.6 / 5,The scampi pasta was amazing! Great service,9/5/12,http://www.pickgrapevine.com/wantmore3/sardine-factory,sardine-factorySchooners Coastal Kitchen & Bar äóñ Monterey Plaza Hotel & Spa,http://www.opentable.com/schooners-coastal-kitchen-and-bar-monterey-plaza-hotel-and-spa?scpref=110&tab=2,4.3,"400 Cannery Row Monterey, CA  93940 ",130,Seafood,$31 to $50,Monterey,http://www.schoonersmonterey.com/,info@schoonersmonterey.com,(831) 372-2628,4.3 / 5,"Our dinner was the highlight of our trip, driving up the coast through Sonoma county. Had filet for 2, window table where we got to watch sea otters, excellent wine and fantastic service. Thanks for making our 27th anniversary so special.",9/2/12,http://www.pickgrapevine.com/wantmore3/schooners-coastal-kitchen-and-bar-monterey-plaza-hotel-and-spa,schooners-coastal-kitchen-and-bar-monterey-plaza-hotel-and-spaSeagrass Restaurant,http://www.opentable.com/seagrass-restaurant?scpref=110&tab=2,4.4,"30 E. Ortega St. Santa Barbara, CA  93101 ",109,Contemporary American,$31 to $50,Santa Barbara,http://www.seagrassrestaurant.com/,info@seagrassrestaurant.com,(805) 618-1136,4.4 / 5,"Food was excellent, thoroughly enjoyedthe experience. Looking forward to eating there again.",9/6/12,http://www.pickgrapevine.com/wantmore3/seagrass-restaurant,seagrass-restaurantSly's,http://www.opentable.com/slys?scpref=110&tab=2,4.4,"686 Linden Ave Carpinteria, CA  93013 ",57,Steak,$31 to $50,Santa Barbara,http://slysonline.com,info@slysonline.com,(805) 684-6666,4.4 / 5,"Great food, with some smaller dishes for smaller appetites.",9/5/12,http://www.pickgrapevine.com/wantmore3/slys,slysSoif Wine Bar Restaurant,http://www.opentable.com/soif-wine-bar-restaurant?scpref=110&tab=2,4.2,"105 Walnut Avenue Santa Cruz, CA  95060 ",48,Contemporary American,$31 to $50,Santa Cruz,http://www.soifwine.com,info@soifwine.com,(831) 423-2020,4.2 / 5,Nice food / wine pairings. Staff is very knowledgeable. Iespecially Monday night's hot jazz live music.,8/20/12,http://www.pickgrapevine.com/wantmore3/soif-wine-bar-restaurant,soif-wine-bar-restaurantSuzanne's Cuisine,http://www.opentable.com/suzannes-cuisine?scpref=110&tab=2,4.4,"502 W. Ojai Ave. Ojai, CA  93023 ",108,Contemporary European,$31 to $50,Ojai,http://www.suzannescuisine.com,info@suzannescuisine.com,(805) 640-1961,4.4 / 5,Some tables too close together. Makes for crosstalk and lack of privacy for a special event.,8/25/12,http://www.pickgrapevine.com/wantmore3/suzannes-cuisine,suzannes-cuisineVieni Vai Trattoria,http://www.opentable.com/vieni-vai-trattoria?scpref=110&tab=2,4.1,"690 Higuera St. San Luis Obispo, CA  93401 ",17,Italian,$30 and under,San Luis Obispo,http://www.vienivai.com,info@vienivai.com,(805) 544-5282,3.9 / 5,We had rehersal dinner for 22 people on a Saturday night....was very nice...no problems....staff very happy....,8/10/12,http://www.pickgrapevine.com/wantmore3/vieni-vai-trattoria,vieni-vai-trattoriaThe Hungry Cat - Santa Barbara,http://www.opentable.com/the-hungry-cat-santa-barbara?scpref=110&tab=2,4.2,"1134 Chapala St. Santa Barbara, CA  93101 ",93,Seafood,$30 and under,Santa Barbara,http://www.thehungrycat.com/home-1162.php?loc=sb,infosantabarbara@thehungrycat.com,(805) 884-4701,4.2 / 5,"Delicious food and great, lively atmosphere, but the service was so bad I don't think I could go back. Really, really slow to respond to simple requests, servers didn't seem to care and would even try to avoid/ignore signals that we had questions/needed help, and food took forever (and we were there on a quiet Sunday night).",8/19/12,http://www.pickgrapevine.com/wantmore3/the-hungry-cat-santa-barbara,the-hungry-cat-santa-barbaraThe Ballard Inn,http://www.opentable.com/the-ballard-inn?scpref=110&tab=2,4.5,"2436 Baseline Ave. Ballard, CA  93463 ",76,Californian,$31 to $50,Santa Ynez Valley,http://www.ballardinn.com,innkeeper@ballardinn.com,(800) 638-2466,4.5 / 5,"This was our 2nd visit to Restaurant at the Ballard Inn. Same as last time, we were not disappointed at all. With exception of the duck dish, we ordered entirely different items from last time. Lamp chop is still delicious but cooked in different way w/ different ingredient from our 1st visit. Filet Mignon was tender like butter - melted in our mouth. And for someone who doesn't usually like sorbet, I just love the homemade sorbet from the Ballard Inn Restaurant - texture was thick, creamy, and refreshing. Can't wait for our next visit! Each time we go, my husband collects the nicely printed ""menu of the day"" w/ Chef Kazali's autograph! ;)",9/2/12,http://www.pickgrapevine.com/wantmore3/the-ballard-inn,the-ballard-innThe Restaurant at JUSTIN Vineyards & Winery,http://www.opentable.com/the-restaurant-at-justin-vineyards-and-winery?scpref=110&tab=2,4.8,"11680 Chimney Rock Paso Robles, CA  93446 ",24,Contemporary American,$50 and over,Paso Robles,http://www.justinwine.com/visit_deborahs_dining.php,innkeeper@justinwine.com,(805) 238-6932 x3224,4.7 / 5,"I had a lovely lunch at the Restaurant at Justin Winery! It was a beautiful day to sit outside and have lunch while enjoying the great view of the vines. I had the White Wine flight and the Orrechiette Pasta with Sausage and Mushrooms. The entrees took a long time to come out, but luckily it was nice out it wasn't a big deal. The food was amazing and the wine was delightful!",9/1/12,http://www.pickgrapevine.com/wantmore3/the-restaurant-at-justin-vineyards-and-winery,the-restaurant-at-justin-vineyards-and-wineryJacks - Portola Hotel & Spa,http://www.opentable.com/jacks-portola-hotel-and-spa?scpref=110&tab=2,4.1,"Two Portola Plaza Monterey, CA  93940 ",43,Californian,$30 and under,Monterey,http://www.portolahotel.com/dining/jacks.php,jacks@portolahotel.com,(831) 649-2698,4.0 / 5,"Thought we were lucky to get a reservation in downtown Monterey during the auctions, races, etc. for a party of six. And this was at the Portola Hotel where the RM auction was being held. The resturant was pretty empty when we arrived and I guess I know why now. The service was horrible and the food was fair. Some of our party liked their entry and some did not, saying it was nothing special. Too bad because this is a great location. Will not return.",8/17/12,http://www.pickgrapevine.com/wantmore3/jacks-portola-hotel-and-spa,jacks-portola-hotel-and-spaFish Hopper,http://www.opentable.com/fish-hopper-monterey?scpref=110&tab=2,4.1,"700 Cannery Row Monterey, CA  93940 ",121,Seafood,$30 and under,Monterey,http://fishhopper.com/monterey/,joanne@fishhopper.com,(831) 372-8543,4.1 / 5,The Fish Hopper has some of the best clam chowder my husband and I have ever had. The restaurant has great views of the bay and the staff is friendly. I had the Parmesan crusted Sea Bass special and my husband had the maple soy glazed skirt steak. Both dishes were delicious. It's a good place to grab lunch or have a nice dinner.,9/1/12,http://www.pickgrapevine.com/wantmore3/fish-hopper-monterey,fish-hopper-montereyla Posta,http://www.opentable.com/la-posta?scpref=110&tab=2,4.4,"538 Seabright Avenue Santa Cruz, CA  95062 ",120,Italian,$30 and under,Santa Cruz,http://laPostaRestaurant.com,lapostarestaurant@gmail.com,(831) 457-2782,4.4 / 5,"Unprepossesing place in modest surroundings, but the food and service are highly commendable.",8/17/12,http://www.pickgrapevine.com/wantmore3/la-posta,la-postaLe Cigare Volant,http://www.opentable.com/le-cigare-volant?scpref=110&tab=2,4.1,"328 Ingalls St Santa Cruz, CA  95060 ",143,Contemporary American,$31 to $50,Santa Cruz,http://www.lecigarevolant.com,lecigarevolant@bonnydoonvineyard.com,(831) 425-6771,4.1 / 5,"Cigare Volant is a paragon of contemporary cuisine in an unassuming location. Next to gigantic barrels, you enter a converted warehouse now used for wine making, tasting, and beer brewing, right across from railroad tracks. The inside hasn't changed since it was the Tasting Room and still consists of exquisite transformations of wine-making detritus. However. the food is quite a bit different. Dishes are smaller and more naturally shared, and techniques such as foams and shells created from liquid nitrogen fit in. The tastes are still the best in Santa Cruz, and as expected there's still the commitment to local farms and fresh, in-season ingredient.s",8/9/12,http://www.pickgrapevine.com/wantmore3/le-cigare-volant,le-cigare-volantTrattoria Grappolo,http://www.opentable.com/trattoria-grappolo?scpref=110&tab=2,4.2,"3687 Sagunto Street, #C Santa Ynez, CA  93460 ",129,Italian,$30 and under,Santa Ynez Valley,http://www.trattoriagrappolo.com,leonardo@trattoriagrappolo.com,(805) 688-6899,4.2 / 5,Excellent Italian choices. Very busy restaurant.,8/16/12,http://www.pickgrapevine.com/wantmore3/trattoria-grappolo,trattoria-grappoloLido Restaurant @ Dolphin Bay Resort & Spa,http://www.opentable.com/lido-restaurant-at-dolphin-bay-resort-and-spa?scpref=110&tab=2,4.3,"2727 Shell Beach Road Pismo Beach, CA  93449 ",46,Californian,$31 to $50,San Luis Obispo,http://www.TheDolphinBay.com,lido@thedolphinbay.com,(805) 773-8900,4.3 / 5,Very good food despite misunderstanding from waitress when ordering food. Received a free dessert for the inconvenience which was much appreciated for the extra waiting time. Very professional service and a great place in the area.,9/7/12,http://www.pickgrapevine.com/wantmore3/lido-restaurant-at-dolphin-bay-resort-and-spa,lido-restaurant-at-dolphin-bay-resort-and-spaArts & Letters Cafe,http://www.opentable.com/arts-and-letters-cafe?scpref=110&tab=2,4.3,"7 East Anapamu Street Santa Barbara, CA  93101 ",27,Californian,$30 and under,Santa Barbara,http://www.sullivangoss.com/cafe/cafe.asp,lisan@sullivangoss.com,(805) 730-1463,4.3 / 5,"We enjoyed delicious food and attentive service. By coming a little on the early side we avoided the noise once the restaurant filled up. The setting was lovely, with a beautiful fountain centerpiece. Thank you!",8/23/12,http://www.pickgrapevine.com/wantmore3/arts-and-letters-cafe,arts-and-letters-cafeLugano Swiss Bistro,http://www.opentable.com/lugano-swiss-bistro?scpref=110&tab=2,4.3,"3670 The Barnyard Carmel, CA  93926 ",27,Swiss,$30 and under,Carmel,http://www.swissbistro.com,lugano@swissbistro.com,(831) 626-3779,4.3 / 5,"Such a pleasant location for a meal. All staff very attentive, friendly and ready to accomodate. Service was attentive, ready to please. A real feel good place. If you want to treat yourself, I would highly recommend this restaurant.",9/2/12,http://www.pickgrapevine.com/wantmore3/lugano-swiss-bistro,lugano-swiss-bistroMain Street Garden & Cafe,http://www.opentable.com/main-street-garden-and-cafe?scpref=110&tab=2,4.4,"3101 N. Main St Soquel, CA  95073 ",60,Italian,$30 and under,Soquel,http://www.mainstreetgardencafe.com/,mainstreetgarden@gmail.com,(831) 477-9265,4.4 / 5,Food and service were great as usual.,9/2/12,http://www.pickgrapevine.com/wantmore3/main-street-garden-and-cafe,main-street-garden-and-cafe