10 Degrees South,http://www.opentable.com/10-degrees-south?scpref=110&tab=2,4.3,"4183 Roswell Road Atlanta, GA  30342 ",146,"Global, International",$30 and under,Buckhead,http://www.10degreessouth.com,info@10degreessouth.com,(404) 705-8870,2.0 out of 5,"I heard of the restaurant when I first came to town 10 years ago, but visited for the first time recently. The restaurant is beautiful inside, and has at least two seating areas. It was busy, but the noise level was fine. Service was erratic, with a waiter that may have been overworked. Water and drink orders took a long time to come out, but the hostess did a great job coming by to check on our table. The food was mediocre at best. Sides seem dated (vegetable medley and mashed potatoes), and the medium rare ostrich came very overcooked. The flavor of the curry was fine, but came with an odd assortment of vegetables and bananas. For the price point, there are much better restaurants in Sandy Springs, let alone all of Atlanta. I",11/2/12,http://www.pickgrapevine.com/wantmore8/10-degrees-south,10-degrees-south17Hundred90 Inn and Restaurant,http://www.opentable.com/17hundred90-inn-and-restaurant?scpref=110&tab=2,4.4,"307 East President St. Savannah, GA  31401 ",98,Continental,$30 and under,Savannah,http://17hundred90.com,1790.coo@gmail.com,(912) 236-7122,5.0 out of 5,We loved the setting - very nice historical building. Restaurant is in the basement with fire places and the original stone floor. We ate early so it was not busy and the room was quiet. Would be a bit noisier if full. The bar is in a separate area so the noise did not bleed into the restaurant. Food was wonderful - my husband really enjoyed the Shrimp and Scallop Scampi and I loved the Boursin Chicken. Service ranked as one of the best experiences I have had anywhere. Stephen was wonderful!,11/7/12,http://www.pickgrapevine.com/wantmore8/17hundred90-inn-and-restaurant,17hundred90-inn-and-restaurant4th & Swift,http://www.opentable.com/4th-and-swift?scpref=110&tab=2,4.4,"621 North Avenue NE Atlanta, GA  30308 ",309,Contemporary American,$31 to $50,Midtown,http://www.4thandswift.com,info@4thandswift.com,(678) 904-0160,5.0 out of 5,"Located in the heart of the Old 4th Ward just east of Midtown/Downtown on North Avenue, 4th & Swift is consistently one of Atlanta's top five restaurants. Chef owned and operated, inspired by local and southern ingredients, 4th & Swift is one of the places that makes Atlanta's restaurant scene special.",11/4/12,http://www.pickgrapevine.com/wantmore8/4th-and-swift,4th-and-swift700 Drayton,http://www.opentable.com/700-drayton?scpref=110&tab=2,4.3,"700 Drayton St. Savannah, GA  31401 ",95,Contemporary American,$30 and under,Savannah,http://www.700drayton.com,700drayton@mansiononforsythpark.com,(912) 721-5002,5.0 out of 5,Got engaged at 700 Drayton and the whole staff was incredible. They made it a very memorable evening. We will definitely be going back there the next time we are in Savannah!,11/3/12,http://www.pickgrapevine.com/wantmore8/700-drayton,700-draytonA.lure Savannah,http://www.opentable.com/alure-savannah?scpref=110&tab=2,4.4,"309 West Congress St. Savannah, GA  31401 ",89,Contemporary American,$31 to $50,Savannah,http://aluresavannah.com,gm@aluresavannah.com,(912) 233-2111,3.0 out of 5,"I would not recommend it right now. I did not dis-like it, it just didn't ""wow"" me enough to recommend it. I liked the menu, but I think I would like to try a few more things before passing judgment. The appetizers were great (Blue Cheese fondue chips and lobster macaroni). The main courses needed a little work. The biscuit and gravy (really a seafood gravy) sounded great but didn't quite blend well. The steak and fries was over cooked but tased well. We were too close to the people around us and they the couple next to us were just miserable people and it put a damper on the evening. Like I said, I loved the menu and want to give it another try before making recommendations.",11/2/12,http://www.pickgrapevine.com/wantmore8/alure-savannah,alure-savannahAbattoir,http://www.opentable.com/abattoir?scpref=110&tab=2,4.3,"1170 Howell Mill Road Atlanta, GA  30318 ",120,Organic,$30 and under,Downtown,http://www.starprovisions.com,abattoir@eatoutoften.net,(404) 892-3335,4.0 out of 5,The food was absolutely out of this world. Everything was perfectly seasoned and the food was playful and fun. The only issue I had was that I would've liked the food coursed out instead of a barrage all at once. Next time I'll just order one thing at a time. Overall it was great though.,11/1/12,http://www.pickgrapevine.com/wantmore8/abattoir,abattoirAcoustix Jazz Restaurant & Lounge,http://www.opentable.com/acoustix-jazz-restaurant-and-lounge?scpref=110&tab=2,3.7,"840 Marietta Street NW Atlanta, GA  30318 ",24,Contemporary American,$30 and under,Downtown,http://www.AcoustixJazz.com,taylordstaff@gmail.com,(404) 861-8002,4.0 out of 5,"I must say that I enjoyed myself. The service, music, & scene was inviting.",11/3/12,http://www.pickgrapevine.com/wantmore8/acoustix-jazz-restaurant-and-lounge,acoustix-jazz-restaurant-and-loungeAdam's American Mediterranean Restaurant and Piano Bar,http://www.opentable.com/adams-american-mediterranean-restaurant-and-piano-bar?scpref=110&tab=2,4.5,"15 East Main Street Buford, GA  30518 ",35,American,$30 and under,Buford,http://www.adamsrestaurantandpianobar.com,adamsrestaurant@yahoo.com,(678) 745-0379,5.0 out of 5,"On the Continental scene, salads are served after the main course. In the U.S. they will precede. Well, Adam has several salads, and to repeat what a son-in-law said after he devoured Adam's Wedge, ""That was the BEST salad I ever had!"" I totally agree and urge you to partake of pure joy as I did last visit. The imagination on the menu and with the specialities abound here. Enjoy them.",10/26/12,http://www.pickgrapevine.com/wantmore8/adams-american-mediterranean-restaurant-and-piano-bar,adams-american-mediterranean-restaurant-and-piano-barAilsa's,http://www.opentable.com/ailsas?scpref=110&tab=2,3.3,"10010 B Ford Ave Richmond Hill, GA  31324 ",3,Contemporary American,$30 and under,Savannah,http://ailsasrichmondhill.com,info@ailsasrichmondhill.com,(912) 445-5987,4.0 out of 5,"Ailsa's is sort of tucked away and off of the main road, but it is a great local place for residents of Richmond Hill who don't want to drive all the way into Savannah for a great dinner. The food was excellent and we will definitely be back to try the other items we didn't choose this time. The table we were seated at was a bit too small and the staff seem like they could use a little more practice, but were very accomodating and helpful. There is karaoke on Friday nights, which is odd since there were approximately 5 patrons in the restaurant by the time they started it, but the piano player that played before that during dinner set a great mood. But overall, a great experience we plan on having again!",8/31/12,http://www.pickgrapevine.com/wantmore8/ailsas,ailsasAJA - Atlanta,http://www.opentable.com/aja-atlanta?scpref=110&tab=2,3.9,"3500 Lenox Rd Atlanta, GA  30326 ",114,Asian,$30 and under,Buckhead,http://www.h2sr.com/aja,Jim.Davis@h2sr.com,(404) 231-0001,3.0 out of 5,This was my first time dining at Aja. It was a good experience. The staff was friendly and helpful.,11/2/12,http://www.pickgrapevine.com/wantmore8/aja-atlanta,aja-atlantaAlligator Soul,http://www.opentable.com/alligator-soul?scpref=110&tab=2,4.5,"114 Barnard Street Savannah, GA  33127 ",198,Creole / Cajun / Southern,$31 to $50,Savannah,http://www.alligatorsoul.com,dining@alligatorsoul.com,(912) 232-7899,5.0 out of 5,"We moved to savannah two months ago and have heard of Aligator Soul from several individuals as well as on Paula Deen's show. My husband and I booked a reservation for our anniversary and it was the perfect place. The food was amazing and very seasonal. Our experience overall was exceptional, I would recommend this restaurant anyway and we will definitely return.",11/4/12,http://www.pickgrapevine.com/wantmore8/alligator-soul,alligator-soulAlma Cocina,http://www.opentable.com/alma-cocina?scpref=110&tab=2,4,"191 Peachtree Street NE Atlanta, GA  30303 ",179,Latin American,$30 and under,Downtown,http://alma-atlanta.com,alma@fifthgroup.com,(404) 968-9662,5.0 out of 5,"All around highly recommended. Chicken Tinga Tostadas, Wagu Enchiladas, Summer Breeze drink and the Chicken Fajitas like no other! Excellent meal.",11/3/12,http://www.pickgrapevine.com/wantmore8/alma-cocina,alma-cocinaAltobeli's Restaurant and Piano Bar,http://www.opentable.com/altobelis-restaurant-and-piano-bar?scpref=110&tab=2,4.3,"3000 Old Alabama Road Alpharetta, GA  30022 ",65,Italian,$30 and under,Alpharetta,http://www.altobelis.com,altobeli_s@hotmail.com,(770) 664-8055,2.0 out of 5,"food mediorcre. staff needs to learn to smile more and patience. place use to be alot better. just my opinion, they might have just had an off night.",11/5/12,http://www.pickgrapevine.com/wantmore8/altobelis-restaurant-and-piano-bar,altobelis-restaurant-and-piano-barAnis Cafe and Bistro,http://www.opentable.com/anis-cafe-and-bistro?scpref=110&tab=2,4.5,"2974 Grandview Ave NE Atlanta, GA  30305 ",259,French,$30 and under,Buckhead,http://www.anisbistro.com,info@anisbistro.com,(404) 233-9889,5.0 out of 5,"If you like a very French atmosphere, great service and great food, you'll love this place. I rarely go anywhere twice because there are so many great restaurants in Atlanta. That said, this is where I bring all my out of town friends and family and I keep bringing them and they all love it. Everything is delicious. Duck Con fit, Escargot, Chicken, Trout, Osso Buco, Profiteroles. Enjoyed by all.",11/2/12,http://www.pickgrapevine.com/wantmore8/anis-cafe-and-bistro,anis-cafe-and-bistroAntebellum,http://www.opentable.com/antebellum?scpref=110&tab=2,4.7,"5510 Church St Flowery Branch, GA  30542 ",47,Southern,$30 and under,Flowery Branch,http://antebellumrestaurant.com/,nicholas@antebellumrestaurant.com,(770) 965-8100,5.0 out of 5,Antebellum was a great dining experience. I was happy to find this restaurant 30+ miles north of the city. For appetizers we had the Fried Green Tomatoes and Andouille Sausage and they were scrumptious. For entrees we had the Duck Special and the Rib-eye Steak and the portions were generous and they were both made perfectly to order. Lastly for dessert we had the Red Velvet Cake and the Chocolate Flour-less cake and they were really good. Our server Karis was so friendly and sweet. We were seated right next to the gentleman playing the guitar and it created such a relaxing mood. We really love our experience and we will definitely back.,11/3/12,http://www.pickgrapevine.com/wantmore8/antebellum,antebellumAntica Posta,http://www.opentable.com/antica-posta?scpref=110&tab=2,3.9,"519 East Paces Ferry Road Atlanta, GA  30305 ",80,Italian,$31 to $50,Buckhead,http://www.anticaposta.com,posta@bellsouth.net,(404) 262-7112,4.0 out of 5,"A very good menu with excellent execution. We especially liked the ability to order small plates so that we could mix and match the flavors of this fine restaurant. We could have used a little less ""sell up"" by our waiter, however. We ended up with two extra dishes that we didn't need and a $44 bottle of olive oil. Nevertheless, we will come back and will be more knowledgeable next time.",11/4/12,http://www.pickgrapevine.com/wantmore8/antica-posta,antica-postaAqua Star at The Westin Savannah Golf Resort & Spa,http://www.opentable.com/aqua-star-at-the-westin-savannah-golf-resort-and-spa?scpref=110&tab=2,4.3,"1 Resort Drive Savannah, GA  31421 ",28,Seafood,$31 to $50,Savannah,http://www.westinsavannah.com/aquastar,aquastar@westin.com,(912) 201-2085,5.0 out of 5,Took my son to Aqua Star for his birthday. We had a wonderful time. Food was outstanding! Enjoyed the live music. Definitely a hit!,11/3/12,http://www.pickgrapevine.com/wantmore8/aqua-star-at-the-westin-savannah-golf-resort-and-spa,aqua-star-at-the-westin-savannah-golf-resort-and-spaAria,http://www.opentable.com/aria-atlanta?scpref=110&tab=2,4.5,"490 E. Paces Ferry Rd. Atlanta, GA  30305 ",248,American,$31 to $50,Buckhead,http://www.aria-atl.com,info@aria-atl.com,(404) 233-7673,4.0 out of 5,"Simple yet elegant decor, , Aria has just the right light and brightnes, unlike the usual dark rooms you find in fine dining restaurants.Friendly and professional staff.Food was wonderful. Will come back.",11/5/12,http://www.pickgrapevine.com/wantmore8/aria-atlanta,aria-atlantaAspen Signature Steak,http://www.opentable.com/aspen-signature-steak?scpref=110&tab=2,4.3,"2942 Shallowford Road NE Marietta, GA  30066 ",164,Steak,$30 and under,Marietta,http://www.sedgwickrestaurantgroup.com,aspenseastcobb@hotmail.com,(678) 236-1400,5.0 out of 5,"We drove by Aspens for years and never went. Finally decided to give it a try and we have really enjoyed it. It is our new ""special occasion"" place. Tuesday's visit was for our 13th anniversary. Staff is awesome, ambiance is nice and laid back. They even brought out a special treat to recognize our anniversary. Great place. Nice menu. Really solid options that are always very well prepared and nicely presented. I tried a random glass of pinot and it was excellent. I would go back here anytime.",11/6/12,http://www.pickgrapevine.com/wantmore8/aspen-signature-steak,aspen-signature-steakAspen West Cobb,http://www.opentable.com/aspen-west-cobb?scpref=110&tab=2,4.3,"3625 Dallas Hwy, Ste. 645 Marietta, GA  30064 ",117,American,$30 and under,Marietta,http://www.sedgwickrestaurantgroup.com,aspenswestcobb@hotmail.com,(770) 419-1744,5.0 out of 5,Awesome food and service! Will Definitely be back!,11/5/12,http://www.pickgrapevine.com/wantmore8/aspen-west-cobb,aspen-west-cobbAstor's Court,http://www.opentable.com/paces-88?scpref=110&tab=2,4.5,"88 West Paces Ferry Road Atlanta, GA  30305 ",28,American,$30 and under,Buckhead,http://www.stregisatlanta.com/paces88?EM=DWR_SR_PACES88.COM_1714,wassim.takriti@stregis.com,(404) 563-7910,5.0 out of 5,We celebrated my birthday and it was just a wonderful evening.,11/2/12,http://www.pickgrapevine.com/wantmore8/paces-88,paces-88Atkins Park Tavern - Smyrna,http://www.opentable.com/atkins-park-tavern?scpref=110&tab=2,4.1,"2840 Atlanta Road Smyrna, GA  30080 ",21,American,$30 and under,Smyrna,http://www.atkinspark.com,atavern@bellsouth.net,(770) 435-1887,5.0 out of 5,"First visit and we were treated special! Began with fried green tomato appetizer (classic and good!), then enjoyed the ribeye topped with 'bacon jam' and boursin accompanied by brussell sprouts (steak melted in your mouth and brussell sprouts were worth a return trip in themselves!). My husband had the New York Strip special. Steak was a bit tough but cooked to perfect temperature, and the root vegetables were perfect.Had the beignets....not comparable to Cafe Du Monde's but tasty.We'll be back!",11/2/12,http://www.pickgrapevine.com/wantmore8/atkins-park-tavern,atkins-park-tavernAtkins Park Tavern - Virginia Highlands,http://www.opentable.com/atkins-park-tavern-virginia-highlands?scpref=110&tab=2,3.8,"794 N. Highland Ave. NE Atlanta, GA  30306 ",22,American,$30 and under,Virginia Highland,http://www.atkinspark.com,info@atkinspark.com,(404) 876-7249,4.0 out of 5,My boyfriend had a great time. Great food and drinks. The ambiance is very casual and the menu had so much yummy goodness to choose from. We will return.,9/22/12,http://www.pickgrapevine.com/wantmore8/atkins-park-tavern-virginia-highlands,atkins-park-tavern-virginia-highlandsAtlantic Seafood Company,http://www.opentable.com/atlantic-seafood-company?scpref=110&tab=2,4.2,"2345 Mansell Road Alpharetta, GA  30022 ",78,Seafood,$30 and under,Alpharetta,http://www.atlanticseafoodco.com,ncarpenter@atlanticseafoodco.com,(770) 640-0488,5.0 out of 5,We were allowed plenty of time to visit with our friends before ordering and after eating as well. Attentive service but not hovering. Food was nicely presented and very flavorful.,11/3/12,http://www.pickgrapevine.com/wantmore8/atlantic-seafood-company,atlantic-seafood-companyAtmosphere Bistro,http://www.opentable.com/atmosphere-bistro?scpref=110&tab=2,4.3,"1620 Piedmont Ave Atlanta, GA  30324 ",116,French,$31 to $50,Midtown,http://www.atmospherebistro.com,info@atmospherebistro.com,(678) 702-1620,3.0 out of 5,"We had lunch here, a friend and I, as part of the Midtown Restaurant Week. I had heard the food is always very good here so wanted to sample it. Pretty much the food was wonderful, nothing really unique (sort of stereotypical French fare), but very well done. I was disappointed they had run out of the creme brulee by the time I came to order my dessert (a French restaurant that runs out of Creme Brulee, really?) but the french vanilla ice cream dessert I ordered instead was delicious.Our server was very friendly and offered me a top wine recommendation, based on what I had told her. I found we waited a little long in between courses (I mean it was a 1.5 hour lunch) but the food more than made up for any shortfall. Nice ""atmosphere"" too",9/9/12,http://www.pickgrapevine.com/wantmore8/atmosphere-bistro,atmosphere-bistroAugustino's at the Augusta Marriott,http://www.opentable.com/augustinos-at-the-augusta-marriott?scpref=110&tab=2,4.4,"2 10th Street Augusta, GA  30901 ",11,Italian,$31 to $50,Augusta,http://www.augustinos.net,augustino@augustamarriott.com,(706) 823-6521,5.0 out of 5,My boyfriend went Sunday for an early romantic dinner. We had a reservation and were seated quickly. We had a wonderful time and the food was excellent! We will be going back.,10/14/12,http://www.pickgrapevine.com/wantmore8/augustinos-at-the-augusta-marriott,augustinos-at-the-augusta-marriottAzio Downtown,http://www.opentable.com/azio-downtown?scpref=110&tab=2,3.9,"229 Peachtree St. Atlanta, GA  30303 ",67,Italian,$30 and under,Downtown,http://www.aziodowntown.com,kevin@aziodowntown.com,(404) 222-0808,5.0 out of 5,"Great service, nice wine selection. Food was very fresh and well prepared. Would definitely return.",11/2/12,http://www.pickgrapevine.com/wantmore8/azio-downtown,azio-downtownAzul Agave Restaurant & Bar,http://www.opentable.com/azul-agave-restaurant-and-bar?scpref=110&tab=2,3.6,"4120 Old Milton Parkway Alpharetta, GA  30004 ",44,Mexican / Southwestern,$30 and under,Alpharetta,http://www.azulagaverestaurant.com,info@azulagaverestaurant.com,(678) 566-0169,4.0 out of 5,"We had a nice meal at Azul Agave. All of the food was very good to excellent -- guacamole made at the table, various tacos and other main courses were delicious except the carne asada tacos, which were a bit dry. Our waitress had a few too many tables to deal with, but she did a great job considering the crowd, had a nice personality and we were not in a rush. Best margarita I have had in the Alpharetta area and beautiful interior to the restaurant. We liked it a lot and will return.",11/3/12,http://www.pickgrapevine.com/wantmore8/azul-agave-restaurant-and-bar,azul-agave-restaurant-and-barB Matthews Eatery,http://www.opentable.com/b-matthews-eatery?scpref=110&tab=2,4.4,"325 E Bay St Savannah, GA  31401 ",49,American,$30 and under,Savannah,http://bmatthewseatery.com,info@bmatthewseatery.com,(912) 233-1319,4.0 out of 5,The shrimp and grits app was really good. The ribeye was amazing. Great selection of specialty cocktails. Great service. We really enjoyed the keyboard player. Many of the restaurants around town were booked so we tried B Mathews and were very impressed and recommend.,11/3/12,http://www.pickgrapevine.com/wantmore8/b-matthews-eatery,b-matthews-eateryBabette's Cafe,http://www.opentable.com/babettes-cafe?scpref=110&tab=2,4.7,"573 North Highland Avenue NE Atlanta, GA  30307 ",278,French,$30 and under,Inman Park,http://www.babettescafe.com,marla@babettescafe.com,(404) 523-9121,5.0 out of 5,"Babette's Cafe is my wife's and my favorite neighborhood restaurant. The food is always excellent, the people are wonderful, and the place is classic Virginia Highlands charm. It is always a treat, and a favorite for special occasions.",11/3/12,http://www.pickgrapevine.com/wantmore8/babettes-cafe,babettes-cafeBacchanalia,http://www.opentable.com/bacchanalia?scpref=110&tab=2,4.8,"1198 Howell Mill Road Atlanta, GA  30318 ",157,Contemporary American,$50 and over,West Midtown,http://www.starprovisions.com,aquatrano@eatoutoften.net,(404) 365-0410 x22,5.0 out of 5,"Very good food, but GREAT service. Lively atomosphere in a well-planned space.",11/2/12,http://www.pickgrapevine.com/wantmore8/bacchanalia,bacchanaliabar ONE,http://www.opentable.com/bar-one?scpref=110&tab=2,3.1,"687 Memorial Drive Atlanta, GA  30316 ",15,Caribbean,$30 and under,Downtown,http://www.barONEAtl.com,info@barONEAtl.com,(404) 522-0999,4.0 out of 5,"They were out of many items on the night we attended, which definitely didn't go over well with the group.But the ambiance was nice, I think it's a great place for drinks and happy hour!",11/6/12,http://www.pickgrapevine.com/wantmore8/bar-one,bar-oneBasil's,http://www.opentable.com/basils-atlanta?scpref=110&tab=2,4.2,"2985 Grandview Avenue Atlanta, GA  30305 ",64,Mediterranean,$30 and under,Buckhead,http://www.basils.net,reservations@basilsinbuckhead.com,(404) 233-9755,5.0 out of 5,"Set apart from Buckhead busy street traffic this setting blends a most unique combination of outdoor/patio natural views and inward rooms dressed with rich colors and tastefully appealing art-- live music by a gifted Brazilian musician caresses the ambiance of the entire space that serves all. The menu choices have always complemented all flavors youhope to experience from tapas and appetizers, entrees and desert. Love their house pinot noir. And they will accommodate most any combo of menu choices to self-style a creative flair desire. All for modest costs.Very romantic special place with the best personal service you could want.Always a favorite due to the cordial staff's effort to make every aspect of dininga multi-sense jo",11/3/12,http://www.pickgrapevine.com/wantmore8/basils-atlanta,basils-atlantaThe Bee's Knees,http://www.opentable.com/the-bees-knees?scpref=110&tab=2,4.3,"211 10th St. Augusta, GA  30901 ",42,Tapas / Small Plates,$30 and under,Augusta,http://www.beeskneestapas.com,info@beeskneestapas.com,(706) 828-3600,2.0 out of 5,"We used to go to the Bees Knees a lot, and hadn't been in a while. Since we've been, it seems that they are trying to save money by doing their menu items differently. Some of the menu items were still good, but others were greatly different. The Avocado Chop Chop is now made with shrimp instead of crab and the Japanese aoli was almost non-existent. It really was disappointing. The Panang curry was much drier than it has been before also- it just overall was disappointing.",11/2/12,http://www.pickgrapevine.com/wantmore8/the-bees-knees,the-bees-kneesBelford's Savannah,http://www.opentable.com/belfords?scpref=110&tab=2,3.9,"315 W. St. Julian Street Savannah, GA  31401 ",51,Seafood,$31 to $50,Savannah,http://www.BelfordsSavannah.com,reservations@BelfordsSavannah.com,(912) 233-2626,4.0 out of 5,Excellent menu and food was delicious. Staff was friendly and knowledgable.,11/2/12,http://www.pickgrapevine.com/wantmore8/belfords,belfordsBella Italia Cuisine,http://www.opentable.com/bella-italia-cuisine?scpref=110&tab=2,4,"880 Marietta Hwy Suite 600 Roswell, GA  30075",6,Italian,$30 and under,Roswell,http://www.bellaitaliacuisine.com,bellaitalia880@gmail.com,(770) 640-8000,5.0 out of 5,"I found this restaurant to be great, the food, all of it was excellent, service was great, looking forward to going back",9/22/12,http://www.pickgrapevine.com/wantmore8/bella-italia-cuisine,bella-italia-cuisineBenihana - Alpharetta,http://www.opentable.com/benihana-alpharetta?scpref=110&tab=2,4.1,"2365 Mansell Rd Alpharetta, GA  30022 ",38,Japanese,$30 and under,Alpharetta,http://www.benihana.com/locations/alpharetta-ga-al,alpharetta@benihana.com,(678) 461-8440,5.0 out of 5,We are a group of 4 adults and 4 kids and always go out together. Benihana is one of our favorite places and our kids definitely love it. I like the fact that the cooks have so much patience and are nice with them answering all their questions and not only making it fun for us but for for them as well.,10/9/12,http://www.pickgrapevine.com/wantmore8/benihana-alpharetta,benihana-alpharettaBenihana - Atlanta - Buckhead,http://www.opentable.com/benihana-atlanta-buckhead?scpref=110&tab=2,3.7,"2143 Peachtree Rd NE Atlanta, GA  30309 ",93,Japanese,$30 and under,Buckhead,http://www.benihana.com/locations/atlanta-ga-at1,atlanta1@benihana.com,(404) 355-8565,5.0 out of 5,That was the Best Birthday ever and the service was great.,11/5/12,http://www.pickgrapevine.com/wantmore8/benihana-atlanta-buckhead,benihana-atlanta-buckheadBenihana - Atlanta - Downtown,http://www.opentable.com/benihana-atlanta-downtown?scpref=110&tab=2,3.8,"229 Peachtree St NE Atlanta, GA  30303 ",45,Japanese,$30 and under,Downtown,http://www.benihana.com/locations/atlanta-ga-aa,atlanta2@benihana.com,(404) 522-9629,3.0 out of 5,It's great to see your food prepared right in front of you. This is fun especially when you have a group of 10 people to fill up a table.,11/3/12,http://www.pickgrapevine.com/wantmore8/benihana-atlanta-downtown,benihana-atlanta-downtown