The Melting Pot - Savannah,http://www.opentable.com/the-melting-pot-savannah?scpref=110&tab=2,4.6,"232 East Broughton Street Savannah, GA  31401 ",73,Fondue,$31 to $50,Savannah,http://www.meltingpot.com/savannah,savannahmeltingpot@gmail.com,(912) 349-5676,5.0 out of 5,We never fail to have a wonderful time when we come here,11/3/12,http://www.pickgrapevine.com/wantmore8/the-melting-pot-savannah,the-melting-pot-savannahMeritage Cafe,http://www.opentable.com/meritage-cafe?scpref=110&tab=2,4.1,"1350 13th Street Columbus, GA  31901 ",15,Contemporary American,$31 to $50,Columbus,http://www.meritagecafe.net/,Info@meritagecafe.net,(706) 327-0707,5.0 out of 5,"My wife and I had a fantastic date night at the Meritage. In Columbus, ""fine dining"" is usually used to describe the Olive Garden or some other massive chain restaurant. The Meritage actually is fine dining. Delicious food, great service and an amazing wine list. This place ranks in my top 5 dining experiences and I have eaten at great restaurants all over the US. We will definitely be going back!",8/18/12,http://www.pickgrapevine.com/wantmore8/meritage-cafe,meritage-cafeMiller Union,http://www.opentable.com/miller-union?scpref=110&tab=2,4.3,"999 Brady Ave Suite 106 Atlanta, GA  30318 ",243,American,$30 and under,West Midtown,http://www.millerunion.com,info@millerunion.com,(678) 733-8550,5.0 out of 5,"Fabulous food and Mark was a delightful server. Also, Daniel stopped by to help us with the wine selection. The staff at Miller Union is truly knowledgeable about the food, including preparation nuances. All of this is done with grace and no ""attitude"". Very refreshing!",11/3/12,http://www.pickgrapevine.com/wantmore8/miller-union,miller-unionMilton's Cuisine and Cocktails,http://www.opentable.com/miltons-cuisine-and-cocktails?scpref=110&tab=2,4.5,"800 Mayfield Rd Alpharetta, GA  30004 ",299,American,$30 and under,Alpharetta,http://www.miltonscuisine.com,heather@miltonscuisine.com,(770) 817-0161,4.0 out of 5,"Our recent experience was certainly better than the previous visit. At least we were served with a bread basket this time. Service generally was improved, the appetisers were good, as were our entrees. But something is still lacking - it's just not the 'special place' it once was.",10/30/12,http://www.pickgrapevine.com/wantmore8/miltons-cuisine-and-cocktails,miltons-cuisine-and-cocktailsMirage Persian Cuisine,http://www.opentable.com/mirage-persian-cuisine?scpref=110&tab=2,4.4,"6631 Roswell Road Sandy Springs, GA  30328 ",28,Persian,$30 and under,Sandy Springs,http://www.miragepersiancuisine.com,mirageatlanta@gmail.com,(404) 843-8300,4.0 out of 5,It was really good..Service was excellent and people are so friendly..Server actually explained us the whole menu..also the Persian ice cream is so yummy..,10/23/12,http://www.pickgrapevine.com/wantmore8/mirage-persian-cuisine,mirage-persian-cuisineMirko Pasta - Buckhead,http://www.opentable.com/mirko-pasta-buckhead?scpref=110&tab=2,4.2,"4233 Roswell Rd. NE Atlanta, GA  30342 ",13,Italian,$30 and under,Buckhead,http://www.mirkopasta.com,support@mirkopasta.com,(404) 303-2110,4.0 out of 5,Wonderful staff! So pleasant and helpful.,10/12/12,http://www.pickgrapevine.com/wantmore8/mirko-pasta-buckhead,mirko-pasta-buckheadMirko Pasta- Marietta,http://www.opentable.com/mirko-pasta-marietta?scpref=110&tab=2,4.1,"1281 Johnson Ferry Rd. Marietta, GA  30068 ",7,Italian,$30 and under,Marietta,http://www.mirkopasta.com/about-mirko,courtfutrell@mirkopasta.com,(770) 977-3030,5.0 out of 5,"The name may make you think it's a Japanese restaurant but it's definitely Italian! It was well worth the drive from Atlanta. Each of the four sauces that we tried were superb as were the hand-made pastas, especially the apple, sage and sausage ravioli.",11/5/12,http://www.pickgrapevine.com/wantmore8/mirko-pasta-marietta,mirko-pasta-mariettaMoon River Brewing Company,http://www.opentable.com/moon-river-brewing-company?scpref=110&tab=2,3.8,"21 West Bay Street Savannah, GA  31401 ",89,American,$30 and under,Savannah,http://www.moonriverbrewing.com,info@moonriverbrewing.com,(912) 447-0943,3.0 out of 5,"Visited Moon River Brewing Company while in town for the Rock N Roll Savannah Marathon and chose the restaurant based upon the ""vegan friendly"" reviews. Unfortunately, we found that the restaurant was operating on a limited menu which did not include vegan options. Our superb server did help the 2 veg people in our party to cobble together a couple of options, but I have to say that I was looking forward to having a few real choices.FYI: Runners do eat a lot, but some of us like to eat lots of non-dairy, non-meat options.The omnivores in our party thoroughly enjoyed their meals!",11/4/12,http://www.pickgrapevine.com/wantmore8/moon-river-brewing-company,moon-river-brewing-companyMorton's The Steakhouse - Atlanta - Downtown,http://www.opentable.com/mortons-the-steakhouse-downtown-atlanta?scpref=110&tab=2,4.3,"303 Peachtree Center Avenue SunTrust Plaza Building Atlanta, GA  30308",99,Steak,$50 and over,Downtown,http://mortons.com,cm.mat@mortons.com,(404) 577-4366,3.0 out of 5,"The Kitchen was Very Slow that night. Our waiter was OUTSTANDING, and the steaks were just a little above average.I have cut meat my whole life and it appeared to me my 22oz Ribeye was cut a little short on the weight. One of the Gentlemen with me had a grisel in his steak he could not even cut through with the knife provided.I have been to several of the top Steak House's in the Atlanta area and I was not impressed with my Vist to Morton's. I am sorry, but you asked!",11/4/12,http://www.pickgrapevine.com/wantmore8/mortons-the-steakhouse-downtown-atlanta,mortons-the-steakhouse-downtown-atlantaMosaic,http://www.opentable.com/mosaic-atlanta?scpref=110&tab=2,3.9,"3097 Maple Drive Atlanta, GA  30305 ",52,American,$30 and under,Buckhead,http://www.mosaicatl.com,info@mosaicatl.com,(404) 846-5722,5.0 out of 5,This was my second time dining her but my boyfriends first. We used our scoutmob coupon and was thrilled with the service and food.,11/3/12,http://www.pickgrapevine.com/wantmore8/mosaic-atlanta,mosaic-atlantaMurphy's,http://www.opentable.com/murphys?scpref=110&tab=2,4.3,"997 Virginia Ave NE Atlanta, GA  30306 ",292,American,$30 and under,Virginia Highland,http://www.murphys-atlanta-restaurant.com,turin@murphysvh.com,(404) 872-0904,4.0 out of 5,Enjoyed our business lunch and service. Recommend.,10/29/12,http://www.pickgrapevine.com/wantmore8/murphys,murphysMuss & Turner's,http://www.opentable.com/muss-and-turners?scpref=110&tab=2,4.3,"1675 Cumberland Parkway, Suite 309 Smyrna, GA  30080 ",109,Contemporary American,$30 and under,Vinings,http://www.mussandturners.com,chris@mussandturners.com,(770) 434-1114,3.0 out of 5,"My favorite menu items are no longer available and the expansipn is a real disappointment. The ""speakeasy"" format is nothing more than a gimmick and is too dark to easily read the menu. I think they missed a great opportunity to simply enlarge the old format. I have no idea why they spent so much money on cooler doors and one way mirrors... Maybe they were trying to impress their friends in the business, but it sure doesn't impress me or my friends.",11/3/12,http://www.pickgrapevine.com/wantmore8/muss-and-turners,muss-and-turnersMykonos Taverna,http://www.opentable.com/mykonos-taverna?scpref=110&tab=2,4.3,"2901 Clairmont Rd NE Atlanta, GA  30329 ",21,Greek,$30 and under,Druid Hills / Emory,http://www.mykonostavernaatlanta.com,mykonostavernatl@live.com,(404) 638-6770,5.0 out of 5,Friendly staff and excellent service. Variety of delicious entrees and desserts! Cheesecake Baklava is the best!!!,10/26/12,http://www.pickgrapevine.com/wantmore8/mykonos-taverna,mykonos-tavernaNahm Thai Cuisine,http://www.opentable.com/nahm-thai-cuisine?scpref=110&tab=2,4.5,"5310 Windward Pkwy, Ste.C Alpharetta, GA  30004 ",65,Thai,$31 to $50,Alpharetta,http://www.nahmthaicuisine.com,nahm@nahmthaicuisine.com,(678) 762-1818,5.0 out of 5,"Atlanta has a few really good Thai restaurants, but we do not think any are better than Nahm. The food is always fresh, creative, and excellent. The room is handsome and the atmosphere is warm, largely because all the people who work at Nahm are so incredibly nice. When Chef Nahm is there she personally welcomes each table at some point during the evening, and even on the rare occasions she is not there, the rest of her staff make you feel as though you are guests in their home. Highly recommended.",11/2/12,http://www.pickgrapevine.com/wantmore8/nahm-thai-cuisine,nahm-thai-cuisineNakato Japanese Restaurant - Hibachi Grill,http://www.opentable.com/nakato-japanese-restaurant-hibachi-grill?scpref=110&tab=2,4.2,"1776 Cheshire Bridge Road Atlanta, GA  30324 ",25,Japanese,$30 and under,Buckhead,http://www.nakatorestaurant.com,sachi@nakatorestaurant.com,(404) 873-6583,5.0 out of 5,"Came on first date, food and service was very good and would definitely come back.",11/3/12,http://www.pickgrapevine.com/wantmore8/nakato-japanese-restaurant-hibachi-grill,nakato-japanese-restaurant-hibachi-grillNakato Japanese Restaurant - Traditional Dining and Sushi Bar,http://www.opentable.com/nakato-japanese-restaurant-traditional-dining-and-sushi-bar?scpref=110&tab=2,4.3,"1776 Cheshire Bridge Road Atlanta, GA  30324 ",21,Sushi,$30 and under,Midtown,http://www.nakatorestaurant.com,sachi@nakatorestaurant.com,(404) 873-6583,5.0 out of 5,Always excellent Sushi and Sashimi,11/2/12,http://www.pickgrapevine.com/wantmore8/nakato-japanese-restaurant-traditional-dining-and-sushi-bar,nakato-japanese-restaurant-traditional-dining-and-sushi-barNan Thai Fine Dining,http://www.opentable.com/nan-thai-fine-dining?scpref=110&tab=2,4.5,"1350 Spring Street NW Atlanta, GA  30309 ",119,Thai,$31 to $50,Midtown,http://www.nanfinedining.com,tikki@nanfinedining.com,(404) 870-9933,5.0 out of 5,This is a marvelous high-end Thai restaurant with dishes you won't find anywhere else. Service was excellent on our recent visit -- attentive but not intrusive. Good wine list and cocktails as well.,10/27/12,http://www.pickgrapevine.com/wantmore8/nan-thai-fine-dining,nan-thai-fine-diningNew York Prime Steakhouse - Buckhead,http://www.opentable.com/new-york-prime-steakhouse-buckhead?scpref=110&tab=2,4.4,"3424 Peachtree Road NE Suite 100 Atlanta, GA  30326 ",63,Steakhouse,$31 to $50,Buckhead,http://www.newyorkprime.com,nypatl1@bellsouth.net,(404) 846-0644,5.0 out of 5,"Extraordinary experience. The filet melts in your mouth. Service was fabulous, constantly referred to as Mr./Mrs. They have several booths which I would recommend requesting for a special occasion. We mentioned it was our anniversary and received a nice card and complimentary dessert.",11/3/12,http://www.pickgrapevine.com/wantmore8/new-york-prime-steakhouse-buckhead,new-york-prime-steakhouse-buckheadNikolai's Roof,http://www.opentable.com/nikolais-roof?scpref=110&tab=2,4.6,"Hilton Atlanta 255 Courtland Street, NE 30th Floor Atlanta, GA  30303",51,French,$31 to $50,Downtown,http://www.nikolaisroof.com,nikolaisroof@hilton.com,(404) 221-6362,5.0 out of 5,"This is my favorite restaurant in Atlanta! The food is delicious and ""plated"" beautifully, and the service is impeccable! Make sure you order the lamb entree... Not to be missed!!!",11/3/12,http://www.pickgrapevine.com/wantmore8/nikolais-roof,nikolais-roofNino's - Atlanta,http://www.opentable.com/ninos-atlanta?scpref=110&tab=2,4.2,"1931 Cheshire Bridge Atlanta, GA  30324 ",113,Italian,$30 and under,Midtown,http://www.NinosAtlanta.com,NinosAtlanta@gmail.com,(404) 874-6505,4.0 out of 5,"Nino's is an excellent restaurant. We had reservations and were immediately seated in a nice corner table for the 5 people in our group. The wait staff was courteous and attentive, we had plenty of bread, wine, and appetizers quickly. The main courses were delicious, especially the Pasta con carciofi e capesante and the Vitello gorgonzola. With two bottles of wine, dinner for 5 came to about $250, which is very reasonable for such an excellent night out. We're regulars at Nino's and of course we'll be back!",11/3/12,http://www.pickgrapevine.com/wantmore8/ninos-atlanta,ninos-atlantaNM Cafe at Neiman Marcus-Atlanta,http://www.opentable.com/nm-cafe-at-neiman-marcus-atlanta?scpref=110&tab=2,3.3,"3393 Peachtree Road NE Atlanta, GA  30306 ",4,American,$30 and under,Buckhead,http://www.neimanmarcus.com/restaurant,Steven_Waugh@neimanmarcus.com,(404) 279-5850,1.0 out of 5,"Really disappointing. NM cafe seems to have gone seriously downhill. The service was inattentive and the food was sub-standard. The she-crab soup was still good, but the salads and sandwiches were very poor.",10/1/12,http://www.pickgrapevine.com/wantmore8/nm-cafe-at-neiman-marcus-atlanta,nm-cafe-at-neiman-marcus-atlantano. 246,http://www.opentable.com/no-246?scpref=110&tab=2,4.2,"129 E. Ponce De Leon Ave. Decatur, GA  33030 ",227,Italian,$30 and under,Decatur,http://www.no246.com,info@no246.com,(678) 399-8246,5.0 out of 5,Excellent as always. Sat outside and the noise level was very tolerable!,11/2/12,http://www.pickgrapevine.com/wantmore8/no-246,no-246Noble Fare,http://www.opentable.com/noble-fare?scpref=110&tab=2,4.5,"321 Jefferson Street Savannah, GA  31401 ",74,Contemporary French,$31 to $50,Savannah,http://www.noblefare.com,jenny@noblefare.com,(912) 443-3210,5.0 out of 5,Awesome experience. My wife and I had a great time and the food was to die for. Would definitely recommend the duck for entree.,11/3/12,http://www.pickgrapevine.com/wantmore8/noble-fare,noble-fareNoche - Virginia Highlands,http://www.opentable.com/noche-virginia-highlands?scpref=110&tab=2,4,"1000 Virginia Ave. NE Atlanta, GA  30306 ",17,Tapas / Small Plates,$30 and under,Virginia Highland,http://h2sr.com,robert.tussey@h2sr.com,(404) 815-9155,5.0 out of 5,"I have celebrated my birthday at Noche- Virgina Highlands for the past two years! I have thoroughly enjoyed myself each time! The food was impeccable, the ambiance was perfect! I would definitely recommend this setting to my friends, strangers, anybody!!! I will return....I just won't wait so long until next time! :-)",8/31/12,http://www.pickgrapevine.com/wantmore8/noche-virginia-highlands,noche-virginia-highlandsNoche Brookhaven,http://www.opentable.com/noche-brookhaven?scpref=110&tab=2,4.1,"705 Town Blvd Suite 310 Atlanta, GA  30319 ",57,Tapas / Small Plates,$30 and under,Brookhaven,http://www.h2sr.com,sara.trinkwalder@h2sr.com,(404) 364-9448,4.0 out of 5,Food was good. A little overpriced on the beverages. Try and get outside,8/30/12,http://www.pickgrapevine.com/wantmore8/noche-brookhaven,noche-brookhavenOcean Prime - Atlanta,http://www.opentable.com/ocean-prime-atlanta?scpref=110&tab=2,4.4,"3102 Piedmont Rd. NE Atlanta, GA  30305 ",181,Seafood,$31 to $50,Buckhead,http://www.oceanprimeatlanta.com,opatlanta@cameronmitchell.com,(404) 846-0505,5.0 out of 5,Wonderful restaurant! The food was great and the portions were generous.,11/4/12,http://www.pickgrapevine.com/wantmore8/ocean-prime-atlanta,ocean-prime-atlantaOceanaire Seafood Room - Atlanta,http://www.opentable.com/oceanaire-seafood-room-atlanta?scpref=110&tab=2,4.2,"1100 Peachtree Street Atlanta, GA  30309 ",204,Seafood,$31 to $50,Midtown,http://www.theoceanaire.com,oaat@ldry.com,(404) 475-2277,3.0 out of 5,"Great fried oysters and grilled fish was good, but Grilled shrimp over cooked, Fried shrimp very over breaded...couldn't even taste the shrimp; Fries just OK; Fried cod was unimpressive; staff was very friendly, but was not knowledgeable/empowered (reflection on training/mgmt); Management did not engage with customers; Parking is $5/hr beyond first hour;",11/5/12,http://www.pickgrapevine.com/wantmore8/oceanaire-seafood-room-atlanta,oceanaire-seafood-room-atlantaThe Olde Pink House Restaurant,http://www.opentable.com/the-olde-pink-house-restaurant?scpref=110&tab=2,4.5,"23 Abercron St Savannah, GA  31401 ",682,Southern,$31 to $50,Savannah,,theoldepinkhouse@bellsouth.net,(912) 232-4286,5.0 out of 5,"Great experience! Food, staff and service were all top notch!",11/6/12,http://www.pickgrapevine.com/wantmore8/the-olde-pink-house-restaurant,the-olde-pink-house-restaurantOne Midtown Kitchen,http://www.opentable.com/one-midtown-kitchen?scpref=110&tab=2,4.3,"559 Dutch Valley Road Atlanta, GA  30324 ",235,American,$30 and under,Midtown,http://www.onemidtownkitchen.com,jmcdaniels@ctrxhs.com,(404) 892-4111,4.0 out of 5,Have not been disappointed on any of our visits. Probably our favorite find in the last year since moving to Atlanta.,11/5/12,http://www.pickgrapevine.com/wantmore8/one-midtown-kitchen,one-midtown-kitchenThe Optimist,http://www.opentable.com/the-optimist?scpref=110&tab=2,4.3,"914 Howell Mill Rd. Atlanta, GA  30318 ",570,Seafood,$31 to $50,Midtown,http://www.theoptimistrestaurant.com,www.info@theoptimistrestaurant.com,(404) 477-6260,4.0 out of 5,"Probably the best gumbo I have ever had. My wife ordered the scallops, but it didn't come any sides, i.e. vegetables, etc. kind of a bummer for a $28 plate. The food was delicious though. Would recommend.",11/6/12,http://www.pickgrapevine.com/wantmore8/the-optimist,the-optimistPacific Rim Bistro,http://www.opentable.com/pacific-rim-bistro?scpref=110&tab=2,3.9,"303 Peachtree Center Ave. Atlanta, GA  30303 ",34,Pan-Asian,$30 and under,Downtown,http://www.pacificrimbistro.com,info@pacificrimbistro.com,(404) 893-0018,5.0 out of 5,"Our waiter was a gem, and the food was delicious and attractively served. If I didn't live out of town, I definitely would go back often!",10/19/12,http://www.pickgrapevine.com/wantmore8/pacific-rim-bistro,pacific-rim-bistroPaizano's,http://www.opentable.com/paizanos?scpref=110&tab=2,3.8,"7 Jones Street Norcross, GA  30071 ",10,Italian,$30 and under,Norcross,http://www.paizanos.com,mrpaizanos@yahoo.com,(770) 300-0250,4.0 out of 5,"Our party of four enjoyed a Saturday night dinner of various dishes. We did not order any appetizers, but all had side salads, these amply sized, served cold and crisp. All entrees were pasta-based or had a pasta accompaniment, but the portion size of the protein in the pasta-based dish ordered by one of our women diners was noted as being too small.",10/27/12,http://www.pickgrapevine.com/wantmore8/paizanos,paizanosPalm Restaurant - Atlanta,http://www.opentable.com/palm-restaurant-atlanta?scpref=110&tab=2,4.2,"3391 Peachtree Road, NE At the Westin Buckhead Atlanta, GA  30326",210,Steakhouse,$31 to $50,Buckhead,http://www.thepalm.com/Atlanta,ngreen@thepalm.com,(404) 814-1955,5.0 out of 5,"We are regular visitors to the Palm in Buckhead and have been for many years. We know that the food will always be great and the people very accomodating. We were shopping at the Perimeter and in Buckhead and scheduled lunch at the Palm. It was the first time we had tried the Businessman's lunch and it was great. Good selections and more than you could eat for a great price. We are also 837 club members and have been since years ago when we lived in Tampa, Fl and went to the Palm there....same great service and food. We will be going to NY next month and plan to try the Palm One!!",11/2/12,http://www.pickgrapevine.com/wantmore8/palm-restaurant-atlanta,palm-restaurant-atlantaPampas Argentine Steakhouse,http://www.opentable.com/pampas-argentine-steakhouse?scpref=110&tab=2,4.6,"10970-A State Bridge Rd. Johns Creek, GA  30022 ",223,Steak,$31 to $50,Alpharetta,http://www.pampassteakhouse.com,info@pampassteakhouse.com,(678) 339-0029,3.0 out of 5,"Not a great place but a good place. However, comparing to other choices I would probably not go back here. A little expensive. Fried Lobster tail was made more like chicken fingers. Truffle Potatos were not very good. Mushrooms were the best thing we had. Staff was nice. Steaks were good but not great. Wine pour seemed a bit light compared to other places.",11/3/12,http://www.pickgrapevine.com/wantmore8/pampas-argentine-steakhouse,pampas-argentine-steakhousePark Cafe,http://www.opentable.com/park-cafe?scpref=110&tab=2,4.4,"3579 W. lawrenceville St Duluth, GA  30096 ",100,American,$30 and under,Duluth,http://www.parkcafeduluth.net,parkcafeduluth@gmail.com,(770) 476-2989,5.0 out of 5,"Park Cafн© was the perfect restaurant for entertaining my out-of-town guests, giving them a fusion of Southern taste with a kicked-up French bistro fare. From our concierge Aaron, who offered a wealth of wine expertise- to our server Adam, who was the perfect liaison between food courses. The most notable gem of the restaurant is, by far, the food. Chef Tiffany, the culinary artist behind our delectable menu, stopped by our table adding another special ambiance to the evening. Our courses ranged from the fried green tomato appetizer- to the Chefду»s special-rack of lamb дус ending in a delicious finish of sweet potato crнВme brнйlн©e. The entire evening was the perfect showcase to my out-of-town family of the very finest that Georgia has to offer.",10/13/12,http://www.pickgrapevine.com/wantmore8/park-cafe,park-cafePark Tavern,http://www.opentable.com/park-tavern?scpref=110&tab=2,3.6,"500 10th NE Atlanta, GA  30309 ",18,American,$30 and under,Midtown,http://www.parktavern.com,chris.parktavern@gmail.com,(404) 249-0001,4.0 out of 5,"Went for date night, enjoyed the ambiance sitting by the fireplace.",11/2/12,http://www.pickgrapevine.com/wantmore8/park-tavern,park-tavernParker's on Ponce,http://www.opentable.com/parkers-on-ponce?scpref=110&tab=2,4.1,"116 East Ponce de Leon Avenue Decatur, GA  30030 ",108,Steak,$30 and under,Decatur,http://www.parkersonponce.com,jt@parkersonponce.com,(404) 924-2230,4.0 out of 5,"My family visited Parker's to celebrate a recent accomplishment of mine. I thought the service was great. The manager or it may have been the owner came by our table to check on us--that was nice. I had the trout entree with I believe asparagus and mashed potatoes. The dish was good, my only complaint is there was a tad bit too much kosher/sea salt sprinkled on top of my dish, but not salty throughout the dish. Everyone else enjoyed their food (steak dish and shrimp and grits), but we all agreed our food was lukewarm versus hot, like we would have liked.",10/30/12,http://www.pickgrapevine.com/wantmore8/parkers-on-ponce,parkers-on-ponceParks Edge,http://www.opentable.com/parks-edge?scpref=110&tab=2,4,"913 Bernina Avenue NE Atlanta, GA  30307 ",196,Contemporary American,$30 and under,Inman Park,http://www.parksedgeatl.com,richard@parksedgeatl.com,(404) 584-7275,4.0 out of 5,"Food was great, service great! It was a ""little"" slow but would not keep me from returning. The atmosphere was not cozy enough to say it was romantic, don't drink so can't comment on the wine, bar... It was too cold to sit outside, but the outdoor seating looked very inviting. The food and service were VERY good and would entice me to return.",11/4/12,http://www.pickgrapevine.com/wantmore8/parks-edge,parks-edgePaschal's Restaurant,http://www.opentable.com/paschals-restaurant?scpref=110&tab=2,4,"180 Northside Drive, SW Atlanta, GA  30313 ",54,Southern,$30 and under,Downtown,http://www.paschalsatlanta.com,rclebert@paschalsatlanta.com,(404) 525-2023,4.0 out of 5,"Nice restaurant. There's a club next door that, when we arrived around 8:45pm, was EXTREMELY loud. But after sitting down for dinner, the music was not that noticeable. Food was good as was the service, albeit a bit slow. The food was a bit pricy given the dishes on the menu, but not too overpriced. We would return in the future.",9/28/12,http://www.pickgrapevine.com/wantmore8/paschals-restaurant,paschals-restaurantPasta da Pulcinella,http://www.opentable.com/pasta-da-pulcinella?scpref=110&tab=2,4.2,"1123 Peachtree Walk Atlanta, GA  30309 ",148,Italian,$30 and under,Midtown,http://www.pastadapulcinella.com,pastadapulcinella@yahoo.com,(404) 876-1114,4.0 out of 5,First dinner at Pasta da Pulcinella and a good one at that. My wife and I enjoyed our salads and entres. We enjoyed eating on the porch.,11/3/12,http://www.pickgrapevine.com/wantmore8/pasta-da-pulcinella,pasta-da-pulcinellaPaul's Restaurant,http://www.opentable.com/pauls-restaurant?scpref=110&tab=2,4.1,"10 Kings Circle Atlanta, GA  30305 ",66,"Global, International",$31 to $50,Buckhead,http://www.greatfoodinc.com,amanda@greatfoodinc.com,(404) 231-4113,5.0 out of 5,"Reliably excellent restaurant with great food and service. We were with friends celebrating a 45th wedding anniversary, and they brought us a special dessert which was really nice. Have eaten at this restaurant many times, and we always bring out-of-town guests here for a great neighborhood/local Atlanta experience.",11/2/12,http://www.pickgrapevine.com/wantmore8/pauls-restaurant,pauls-restaurantPeasant Bistro,http://www.opentable.com/peasant-bistro?scpref=110&tab=2,3.7,"250 Park Avenue West, Suite 104 Atlanta, GA  30313 ",64,French,$30 and under,Downtown,http://www.peasantatl.com,peasantatlanta@gmail.com,(404) 230-1724,4.0 out of 5,I was pleasantly surprised. The food was great and the ambiance was spotless.,11/4/12,http://www.pickgrapevine.com/wantmore8/peasant-bistro,peasant-bistro