Rinie's Kitchen & Wine Bar,http://www.opentable.com/rinies-kitchen-and-wine-bar?scpref=110&tab=2,4.6,"1320 Homestead Drive Lawton, OK  73505 ",9,Contemporary American,$30 and under,Lawton,http://www.rinieskitchenandwinebar.com,restaurant@rinieskitchenandwinebar.com,(580) 248-8100,5 / 5,It was my first visit to Rinie's and it was more than I expected! Besides amazing food and a great atmosphere the service made the visit worth every cent. My wife and I will defiantly be going back.,09/13/2012,http://www.pickgrapevine.com/wantmore5/rinies-kitchen-and-wine-bar,rinies-kitchen-and-wine-bar
Rococo Northpark,http://www.opentable.com/rococo-northpark?scpref=110&tab=2,4.5,"12252 North May Ave Oklahoma City, OK  73120 ",67,Italian,$30 and under,Oklahoma City,http://www.rococo-restaurant.com/,jasonbustamante@rococo-restaurant.com,(405) 212-4577,2 / 5,"Good for business lunch. Quiet, plenty of room.",10/22/2012,http://www.pickgrapevine.com/wantmore5/rococo-northpark,rococo-northpark
Rococo Restaurant and Fine Wine,http://www.opentable.com/rococo-restaurant-and-fine-wine?scpref=110&tab=2,4.6,"2824 North Pennsylvania Avenue Oklahoma City, OK  73107 ",49,Italian,$30 and under,Oklahoma City,http://www.rococo-restaurant.com,brucerinehart@rococo-restaurant.com,(405) 528-2824,4 / 5,"Rococo is a brilliant Oklahoma City fine dining establishment! The fresh fish & dry aged steaks are delicious. Service is great. We had Rib Steak with Demi-glacé & wine-reduction. Rib steaks were rich with flavor; the sauce enhanced the flavor. I enjoyed the fresh Sole with lemon, butter, and capers. My fish was a sybaritic delight! We finished with expresso, Sicilian Lemon-Ice, and an incredible Green Apple Rustic Cheesecake. Rococo is highly recommended dining in Oklahoma City!",10/04/2012,http://www.pickgrapevine.com/wantmore5/rococo-restaurant-and-fine-wine,rococo-restaurant-and-fine-wine
SAII Bistro,http://www.opentable.com/saii-bistro?scpref=110&tab=2,4.2,"6900 N. May Ave. Suite 7B Oklahoma City, OK  73116",54,Sushi,$30 and under,Oklahoma City,http://www.saiiasianbistro.com,saii@saiiasianbistro.com,(405) 702-7244,4 / 5,"Saii offers a nice selection of sushi. The only complaint is that the service can be a little slow but I guess it would not be a problem if you are in no rush. Overall, everything is delicious.",10/20/2012,http://www.pickgrapevine.com/wantmore5/saii-bistro,saii-bistro
Silks Restaurant,http://www.opentable.com/silks-restaurant?scpref=110&tab=2,4.0,"One Remington Place Oklahoma City, OK  73111 ",64,American,$30 and under,Oklahoma City,http://remingtonpark.com/Dining/Silks_Restaurant/,RESERVATIONS@REMINGTONPARK.COM,(405) 425-3280,5 / 5,Stuffed pork chop outstanding. Both servers were very attentive. The horses were not very cooperative but the restaurant was great.,10/20/2012,http://www.pickgrapevine.com/wantmore5/silks-restaurant,silks-restaurant
Smoke On Cherry Street,http://www.opentable.com/smoke-on-cherry-street?scpref=110&tab=2,4.4,"1542 E 15th Street Tulsa, OK  74120 ",104,American,$31 to $50,Tulsa,http://www.smoketusa.com,info@smoketulsa.com,(918) 949-4440,5 / 5,"We just experienced Smoke for the second time this week. Again, a wonderful experience. The restaurant was busy and full of energy, but we were greeted quickly and they had our reserved table ready. Excellent service and fabulous food. Our server was great at giving us suggestions to fit our tastes. We will definitely be repeat customers! Thanks, Smoke, for a great evening!",10/22/2012,http://www.pickgrapevine.com/wantmore5/smoke-on-cherry-street,smoke-on-cherry-street
Sonoma Bistro & Wine Bar,http://www.opentable.com/sonoma-bistro-and-wine-bar?scpref=110&tab=2,4.2,"3523 S. Peoria Tulsa, OK  74105 ",18,Californian,$30 and under,Tulsa,http://www.sonomatulsa.com/,tim.baker@thebrasserietulsa.com,(918) 747-9463,5 / 5,"We love Sonoma, it's usually where I go with girlfriends for a good dinner to catch-up. The food couldn't have been better. One of our dishes came out wrong and the staff was amazing and very apologetic even offering us 2 free desserts. I will definitely be back to Sonoma soon!!",10/03/2012,http://www.pickgrapevine.com/wantmore5/sonoma-bistro-and-wine-bar,sonoma-bistro-and-wine-bar
Sophabella's,http://www.opentable.com/sophabellas?scpref=110&tab=2,3.9,"7628 N. May Ave Oklahoma City, OK  73116 ",29,Italian,$30 and under,Oklahoma City,http://www.sophabellasrestaurant.com,sobbrazilbns@gmail.com,(405) 879-0100,4 / 5,"Great atmosphere and clientele. Will definitely go back. A bit on the high end for the food - the steak was pretty average for the 30+ price point, but my date loved hers, so what else really matters?The beer selection needs more on tap.",09/25/2012,http://www.pickgrapevine.com/wantmore5/sophabellas,sophabellas
Stella Modern Italian Cuisine,http://www.opentable.com/stella-modern-italian-cuisine?scpref=110&tab=2,4.2,"1201 N. Walker Oklahoma City, OK  73103 ",112,Italian,$30 and under,Oklahoma City,http://www.stellaokc.com,info@stellaokc.com,(405) 235-2200,4 / 5,I love the healthy food options they offer - like the roasted vegetables!!! MMM MM! I also was appreciative of the flexibility of changing and adding menu items.,10/21/2012,http://www.pickgrapevine.com/wantmore5/stella-modern-italian-cuisine,stella-modern-italian-cuisine
Sushi Neko,http://www.opentable.com/sushi-neko?scpref=110&tab=2,4.3,"4318 North Western Avenue Oklahoma City, OK  73118 ",61,Japanese,$30 and under,Oklahoma City,http://www.sushineko.com,info@sushineko.com,(405) 528-8862,3 / 5,Sushi rolls were coming apart. Fish was not that fresh/good.,10/20/2012,http://www.pickgrapevine.com/wantmore5/sushi-neko,sushi-neko
The Tavern on Brady,http://www.opentable.com/the-tavern-on-brady?scpref=110&tab=2,4.3,"201 North Main Street Tulsa, OK  74103 ",48,Contemporary American,$30 and under,Tulsa,http://taverntulsa.com,contact@bradytavern.com,(918) 949-9801,5 / 5,Great food! Everything we had was delicious. Service was wonderful. Hightly recommend!!,10/16/2012,http://www.pickgrapevine.com/wantmore5/the-tavern-on-brady,the-tavern-on-brady
Villa Ravenna Italian Restaurant,http://www.opentable.com/villa-ravenna-italian-restaurant?scpref=110&tab=2,4.8,"6526 A East 51St Street Tulsa, OK  74145 ",16,Italian,$31 to $50,Tulsa,http://www.villaravenna.com,sdorioli@gmail.com,(918) 270-2666,5 / 5,I had the largest shrimp that I have ever seen. They called it a Prawn and served only one. You read correctly. One shrimp with the head and shell attached. It was the size of a lobster and was wonderful. In fact we are going to be in Tulsa again this coming weekend for an OSU (GO POKES!) football game. Already have reservations to eat here again.,10/19/2012,http://www.pickgrapevine.com/wantmore5/villa-ravenna-italian-restaurant,villa-ravenna-italian-restaurant
West,http://www.opentable.com/west?scpref=110&tab=2,4.3,"6714 N. Western Ave Oklahoma City, OK  73116 ",90,Contemporary American,$30 and under,Oklahoma City,http://www.westbar.com,kristin@johnniesok.com,(405) 607-4072,2 / 5,"Food is average, waitress was attentive and friendly. This was our third attempt to see if the food had improved. When you spend over $100 on a friday or saturday night you should have great food. We have decided not to return to West. Unfortunate because we live close by and it's a great location.",10/12/2012,http://www.pickgrapevine.com/wantmore5/west,west
Whiskey Chicks,http://www.opentable.com/whiskey-chicks?scpref=110&tab=2,2.3,"115 East Reno Ave Suite B Oklahoma City, OK  73104",3,Contemporary American,$30 and under,Oklahoma City,http://www.whiskeychicksokc.com,kevindmccracken@gmail.com,(405) 228-0087,2 / 5,Food just wasn't was very good. I had the onion burger very done. Could be fun if a band is there.,08/11/2012,http://www.pickgrapevine.com/wantmore5/whiskey-chicks,whiskey-chicks
Wolfgang Puck Bistro,http://www.opentable.com/wolfgang-puck-bistro?scpref=110&tab=2,4.1,"3330 South Peoria Ave Tulsa, OK  74105 ",59,Contemporary American,$30 and under,Tulsa,http://www.wolfgangpuck.com/bistro,info@wpbistro.com,(918) 292-8585,4 / 5,Great food at a good price point. Service was exceptional. This is my 3rd visit and will definitely return.,10/20/2012,http://www.pickgrapevine.com/wantmore5/wolfgang-puck-bistro,wolfgang-puck-bistro
Yokozuna,http://www.opentable.com/yokozuna?scpref=110&tab=2,4.2,"309 E 2nd St Tulsa, OK  74120 ",45,Sushi,$30 and under,Tulsa,http://www.yokozunatulsa.com,matt@mcnellies.com,(918) 508-7676,5 / 5,Excellent experience. Food was so good. Hot mess rolls were amazing! Definitely going back.,10/06/2012,http://www.pickgrapevine.com/wantmore5/yokozuna,yokozuna
