Sekisui - St. Louis,http://www.opentable.com/sekisui-st-louis?scpref=110&tab=2,4.2,"3024 S Grand Blvd St. Louis, MO  63118 ",13,Japanese,$30 and under,South Grand,http://www.sekisuiusa.com,stlouis@sekisuiusa.com,(314) 772-0002,3 / 5,"We had a great time, but the company we were with helped with that. I was a little disappointed our waitress didn't seem to be able to do more than one thing at a time. We she asked for our drink orders, she did it one at a time. It seemed odd to us. The food was exceptional. We love sushi, and we did try new things and it was delicious! The server was not real attentive to us, leaving us be after drinks, and then waiting for our food, seemed to take longer than normal. It was our first visit at this restaurant, so not the best first impression. I try not to be too picky, realizing servers sometimes have 'off' days, but it could have been better. Food was fantastic though!",09/15/2012,http://www.pickgrapevine.com/wantmore5/sekisui-st-louis,sekisui-st-louis
Square One Brewery & Distillery,http://www.opentable.com/square-one-brewery-and-distillery?scpref=110&tab=2,4.3,"1727 Park Avenue St. Louis, MO  63104 ",50,Gastro Pub,$30 and under,Soulard / Benton Park,http://www.squareonebrewery.com,info@squareonebrewery.com,(314) 231-2537,4 / 5,Everything was great. Thank you.,10/05/2012,http://www.pickgrapevine.com/wantmore5/square-one-brewery-and-distillery,square-one-brewery-and-distillery
SqWires,http://www.opentable.com/sqwires?scpref=110&tab=2,3.9,"1415 S. 18th Street Saint Louis, MO  63104 ",49,Contemporary American,$30 and under,St. Louis,http://www.sqwires.com,info@sqwires.com,(314) 865-3522,3 / 5,"Normally, this is a great place to go on a Saturday night. But this past Saturday, the wait staff was uninterested and scatter brained when seating us, taking orders and serving us. Then there were at a rush to get us out the door. I guess I could accept that if their was a line waiting, but their were tables open. Prior to the live music , the overhead music was also too low for any ambiance or atmosphere to be created. It was almost odd how silent the room felt. The live musician did make things better, but that was close to 8:00.",10/20/2012,http://www.pickgrapevine.com/wantmore5/sqwires,sqwires
Sub Zero Vodka Bar,http://www.opentable.com/sub-zero-vodka-bar?scpref=110&tab=2,4.3,"308 N. Euclid Ave. St. Louis, MO  63108 ",61,Contemporary American,$30 and under,Central West End,http://www.subzerovodkabar.com,contact@subzerovodkabar.com,(314) 367-1200,4 / 5,"I always enjoy myself at Sub Zero. I started going for the drinks and now I go for the food as well! I went to celebrate a friend's birthday and was told upon my reservation confirmation that there is a charge, per person, to bring in your own dessert. Keep that in mind before you spend money on a nice cake or cupcakes.",10/06/2012,http://www.pickgrapevine.com/wantmore5/sub-zero-vodka-bar,sub-zero-vodka-bar
Table Three,http://www.opentable.com/table-three?scpref=110&tab=2,4.3,"16765 Main Street Wildwood, MO  63040 ",126,Contemporary American,$30 and under,Wildwood,http://table-three.com,bwilliams@table-three.com,(636) 458-4333,4 / 5,"We ate at Table Three for our 36 anniversary. We were seated in a private room which was very nice. Great service. Food was delicious. A few problems, food could have been hotter but taste for most items we ordered was great. Will recommend and will go back.",10/20/2012,http://www.pickgrapevine.com/wantmore5/table-three,table-three
The Tavern Kitchen and Bar,http://www.opentable.com/the-tavern-kitchen-and-bar?scpref=110&tab=2,4.6,"2961 Dougherty Ferry Rd. Suite 101 Saint Louis, MO  63122 ",262,Contemporary American,$30 and under,Kirkwood,http://tavernstl.com,info@tavernstl.com,(636) 825-0600,5 / 5,"Another evening with great food, excellent service and fun atmosphere. We love The Tavern. We celebrated our 30 yr olds birthday. He is a Chicago resident and Tavern rates right there with the Top Chicago restaurants he frequents!",10/20/2012,http://www.pickgrapevine.com/wantmore5/the-tavern-kitchen-and-bar,the-tavern-kitchen-and-bar
Three Kings Public House,http://www.opentable.com/three-kings-public-house?scpref=110&tab=2,4.1,"6307 Delmar Blvd Saint Louis, MO  63130 ",50,American,$30 and under,The Loop,http://www.threekingspub.com,ryan.pinkston@threekingspub.com,(314) 721-3355,4 / 5,I am in the restaurant business and appreciate a staff that strives to serve well and pay attention to detail. One of the things I look for is how the staff attends the table and these guys had the drinks full and were very efficient. They were attentive without being invasive. Good experience. It was early on a Sunday afternoon and that can sometimes be an inconsistent meal.,10/14/2012,http://www.pickgrapevine.com/wantmore5/three-kings-public-house,three-kings-public-house
Tony's - St. Louis,http://www.opentable.com/tonys-st-louis?scpref=110&tab=2,4.7,"410 Market St. St. Louis, MO  63102 ",58,Italian,$50 and over,St. Louis,http://tonysstlouis.com,tonysstlouis@gmail.com,(314) 231-7007,5 / 5,Still the best! They know how to do it so well!,10/18/2012,http://www.pickgrapevine.com/wantmore5/tonys-st-louis,tonys-st-louis
Tony's On Main,http://www.opentable.com/tonys-on-main?scpref=110&tab=2,4.3,"132 N Main St Saint Charles, MO  63301 ",135,American,$30 and under,St. Charles,http://tonysonmain.com,awalterstonys@yahoo.com,(636) 578-2978,5 / 5,New to town. First time there. Excellent experience. Would go back.,10/21/2012,http://www.pickgrapevine.com/wantmore5/tonys-on-main,tonys-on-main
Top of the Riverfront - Millennium Hotel,http://www.opentable.com/top-of-the-riverfront-millennium-hotel?scpref=110&tab=2,4.0,"200 South Fourth St St. Louis, MO  63102 ",218,American,$31 to $50,St. Louis,http://www.topoftheriverfrontstlouis.com,stl-sales@mill-usa.com,(314) 241-3191,4 / 5,"Great atmosphere for a romantic date night. The view was perfect especially because we made our reservations for right at sunset. I ordered the filet mignon, which was melt in your mouth delicious as were the sides. My boyfriend ordered the St.Louis peppercorn steak and he enjoyed it at first but said it was overpowering after a while of eating it. Parking was very limited though so we could not park at the milennium (the restaurant will validate you for parking if you park in their parking lot) but it was St. Louis on a saturday night, what can you expect?",10/20/2012,http://www.pickgrapevine.com/wantmore5/top-of-the-riverfront-millennium-hotel,top-of-the-riverfront-millennium-hotel
Trattoria Branica,http://www.opentable.com/trattoria-branica?scpref=110&tab=2,3.9,"10411 Clayton Rd Frontenac, MO  63131 ",12,Italian,$30 and under,Frontenac,http://www.branicafrontenac.com,info@branicafrontenac.com,(314) 432-8585,4 / 5,"The staff was first and foremost attentive and professional, but also had a ""real"" and fun side to them.",10/06/2012,http://www.pickgrapevine.com/wantmore5/trattoria-branica,trattoria-branica
Triumph Grill,http://www.opentable.com/triumph-grill?scpref=110&tab=2,4.0,"3419 Olive Street St. Louis, MO  63103 ",91,Contemporary American,$30 and under,St. Louis,http://www.triumphgrill.com,triumphgrill@gmail.com,(314) 446-1801,3 / 5,"Great service, food was ok but way too salty. Makes me wonder if the kitchen is masking or enhancing flavors. Calamari was interesting - thick and chewy. Not what we expected, prefer light and crunchy. Really appreciated the manner in which our server both made us feel comfortable and yet had use feed and paid within a tight theatre timeframe.",10/20/2012,http://www.pickgrapevine.com/wantmore5/triumph-grill,triumph-grill
Truffles - St. Louis,http://www.opentable.com/truffles?scpref=110&tab=2,4.2,"9202 Clayton Road St. Louis, MO  63124 ",56,Contemporary American,$31 to $50,Frontenac,http://www.todayattruffles.com,info@todayattruffles.com,(314) 567-9100,5 / 5,Always good and creative cuisine.,10/12/2012,http://www.pickgrapevine.com/wantmore5/truffles,truffles
Villa Farotto,http://www.opentable.com/villa-farotto?scpref=110&tab=2,4.0,"17417 Chesterfield Airport Road Chesterfield, MO  63005 ",60,Italian,$30 and under,Chesterfield,http://www.villafarotto.com,gerard@villafarotto.com,(636) 519-0048,1 / 5,"It started out with being given menus that were blank, No inserts at all .Our server, Shane then asked us to wait and order after the chef decided on his special for the night. It is now 5:25 p.m. 6:10 comes (no he has not checked onus ONCE) and here came Shane with the manager....announcing someone had dropped one of our dishes and they had to start over, offering a bottle of wine for our inconvenience. My son ordered a rib eye. I have never seen such a pathetic excuse for a steak, it was very thin and mostly fat. Not what you would expect from a fine restaurant.Then came the bill, and they charged us for the complimentary wine. The special evening turned into a disaster!",10/21/2012,http://www.pickgrapevine.com/wantmore5/villa-farotto,villa-farotto
Vin de Set,http://www.opentable.com/vin-de-set?scpref=110&tab=2,4.3,"2017 Chouteau Ave St. Louis, MO  63103 ",291,Provencal,$30 and under,Downtown,http://www.vindeset.com,info@vindeset.com,(314) 241-8989,3 / 5,"Beautiful building and great ambiance. The only complaint I would have is that we were squeezed upstairs with a birthday party. They weren't loud but it felt pretty tight. Other than that, the food and service was good. It was also a plus that they had the Cardinal's game playing at the bar, which we had a great view from upstairs.",10/19/2012,http://www.pickgrapevine.com/wantmore5/vin-de-set,vin-de-set
Vino Nadoz Bistro and Wine Bar,http://www.opentable.com/vino-nadoz-bistro-and-wine-bar?scpref=110&tab=2,4.0,"#16 The Boulevard St. Louis St. Louis, MO  63117 ",25,Contemporary American,$30 and under,Richmond Heights,http://www.vinonadozwinebar.com,info@vinonadoz.com,(314) 726-0400,2 / 5,"Normally one of our favorites, we had a disappointing outing. The squash soup had potential, but was served luke warm at best. The meals were uninspiring. The service was inattentive and we had to constant get the attention of our waiter. May have been a new chef or just a bad Saturday night. We've had at least 3 or 4 fantastic experiences prior.",10/13/2012,http://www.pickgrapevine.com/wantmore5/vino-nadoz-bistro-and-wine-bar,vino-nadoz-bistro-and-wine-bar
Vito's Sicilian Pizzeria & Ristorante,http://www.opentable.com/vitos-sicilian-pizzeria-and-ristorante?scpref=110&tab=2,4.0,"3515 Lindell Blvd. St. Louis, MO  63103 ",81,Italian,$30 and under,St. Louis,http://vitosstl.com,vitospizzeriastl@gmail.com,(314) 534-8486,2 / 5,close to the Fox which is good but food was average. had to ask for a steak knife to cut my spedini and veges,10/21/2012,http://www.pickgrapevine.com/wantmore5/vitos-sicilian-pizzeria-and-ristorante,vitos-sicilian-pizzeria-and-ristorante
Wild Flower Restaurant and Catering,http://www.opentable.com/wild-flower-restaurant-and-catering?scpref=110&tab=2,4.0,"4590 Laclede Ave. Saint Louis, MO  63108 ",72,Contemporary American,$30 and under,Central West End,http://www.WildFlowerSTL.com,info@wildflowerloft.com,(314) 367-9888,1 / 5,"The restaurant was extremely loud. The food was poor and service just adequate. The comment was made regarding slowness of service due to a wedding reception and only three cooks. Obviously, the wedding reception was planned and the management should have been ready for a Saturday night. I would not recommend to others or return.",09/22/2012,http://www.pickgrapevine.com/wantmore5/wild-flower-restaurant-and-catering,wild-flower-restaurant-and-catering
Wild Horse Grill,http://www.opentable.com/wild-horse-grill?scpref=110&tab=2,4.2,"101 Chesterfield Towne Center Chesterfield, MO  63005 ",82,American,$30 and under,Chesterfield,http://Wildhorsegrill.com,jimv@wildhorsegrill.com,(636) 532-8750,5 / 5,Fantastic fried chicken on Sundays!!!!,09/02/2012,http://www.pickgrapevine.com/wantmore5/wild-horse-grill,wild-horse-grill
