TJ's at The Jefferson Hotel,http://www.opentable.com/tjs-at-the-jefferson-hotel?scpref=111&tab=2,4.1,"101 West Franklin Street Richmond, VA  23220 ",71,American,$30 and under,Richmond,http://www.jeffersonhotel.com,tjsrestaurant@jeffersonhotel.com,(804) 649-4672,5.0 out of 5,My family and friends enjoyed our lunch at TJ's,01/05/2013,http://www.pickgrapevine.com/wantmore6/tjs-at-the-jefferson-hotel,tjs-at-the-jefferson-hotel
The Tobacco Company Restaurant,http://www.opentable.com/the-tobacco-company-restaurant?scpref=111&tab=2,4.3,"1201 East Cary Street Richmond, VA  23219 ",264,American,$31 to $50,Richmond,http://www.thetobaccocompany.com,marketing@thetobaccocompany.com,(804) 782-9555,3.0 out of 5,"Poor crab cakes. Very dry. No flavor.Prime Rib Steak, although advertised as 'the best', was outdone by Chile/Applebee's version.",02/13/2013,http://www.pickgrapevine.com/wantmore6/the-tobacco-company-restaurant,the-tobacco-company-restaurant
Todd Jurich's Bistro,http://www.opentable.com/todd-jurichs-bistro?scpref=111&tab=2,4.3,"150 West Main Street Suite 100 Norfolk, VA  23510 ",68,Contemporary American,$30 and under,Norfolk,http://www.toddjurichsbistro.com,tjbistro@cox.net,(757) 622-3210,5.0 out of 5,A favorite special occasion restaurant for us. Outstanding food and impecable service. One of the very best restaurants in Hampton Roads.,02/09/2013,http://www.pickgrapevine.com/wantmore6/todd-jurichs-bistro,todd-jurichs-bistro
TradeWinds Restaurant - Virginia Beach Resort Hotel - Virginia Beach,http://www.opentable.com/tradewinds-restaurant-virginia-beach-resort-hotel?scpref=111&tab=2,4.0,"2800 Shore Drive Virginia Beach, VA  23451 ",4,Seafood,$30 and under,Virginia Beach,http://www.tradewindsrestaurant.com,tradewinda@virginiabeachresort.com,(757) 481-9000 x20,5.0 out of 5,We went during restaurant week and enjoyed our visit. The food was excellent and the waiter was very attentive.We will return.,01/18/2013,http://www.pickgrapevine.com/wantmore6/tradewinds-restaurant-virginia-beach-resort-hotel,tradewinds-restaurant-virginia-beach-resort-hotel
Trilogy Bistro,http://www.opentable.com/trilogy-bistro?scpref=111&tab=2,4.3,"101 Granby Street Norfolk, VA  23510 ",76,Seafood,$30 and under,Norfolk,http://www.trilogynorfolk.com,fusion440@hotmail.com,(757) 961-0896,4.0 out of 5,The food was outstanding as well as the wait staff.,02/10/2013,http://www.pickgrapevine.com/wantmore6/trilogy-bistro,trilogy-bistro
Vintage Kitchen,http://www.opentable.com/vintage-kitchen?scpref=111&tab=2,4.3,"999 Waterside Drive Norfolk, VA  23510 ",51,American,$30 and under,Norfolk,http://www.vintage-kitchen.com,info@vintage-kitchen.com,(757) 625-3370,4.0 out of 5,I went for Restaurant Week. Great food and service. Interesting layout -- first floor.,01/21/2013,http://www.pickgrapevine.com/wantmore6/vintage-kitchen,vintage-kitchen
Vintage Tavern,http://www.opentable.com/vintage-tavern?scpref=111&tab=2,4.6,"1900 Governor's Pointe Drive Suffolk, VA  23436 ",115,American,$30 and under,Suffolk,http://www.vintagetavernvirginia.com,vintagetavernva@gmail.com,(757) 238-8808,5.0 out of 5,The best fine dining restaurant I have ever been. I have been 5 time now and The Vintage Tavern never dissapoints!,02/13/2013,http://www.pickgrapevine.com/wantmore6/vintage-tavern,vintage-tavern
Walker's Dam Grill,http://www.opentable.com/walkers-dam-grill?scpref=111&tab=2,4.0,"1428 Outpost Road Lanexa, VA  23089 ",6,Italian,$30 and under,Lanexa,http://www.rockahock.com/HiddenPages/WalkersDAMGrill.aspx,walkersdamgrill@gmail.com,(804) 966-8333,4.0 out of 5,"Really good Italian food - such a surprise out in the middle of nowhere! Wines by the glass were only $6.00 and the chianti was very good. Service was very good, in a downhome way - don't expect upscale! Ambiance is definitely NOT upscale, so don't go looking for that, and be happy with the food!",02/10/2013,http://www.pickgrapevine.com/wantmore6/walkers-dam-grill,walkers-dam-grill
The Water Grill - Richmond,http://www.opentable.com/the-water-grill?scpref=111&tab=2,4.4,"3411 West Cary Street Richmond, VA  23221 ",216,Seafood,$30 and under,Richmond,http://www.thewatergrill.com,contact@thewatergrill.com,(804) 353-3411,3.0 out of 5,"Food was just ""ok"". Crab legs were not good. Waitress was very friendly and attentive.",02/14/2013,http://www.pickgrapevine.com/wantmore6/the-water-grill,the-water-grill
Wild Wolf Brewing Company,http://www.opentable.com/wild-wolf-brewing-company?scpref=111&tab=2,4.1,"2461 Rockfish Valley Highway Nellysford, VA  22958 ",20,Gastro Pub,$30 and under,Nellysford,http://www.wildwolfbeer.com,askthewolf@wildwolfbeer.com,(434) 361-0088,5.0 out of 5,The 2 dinners we had were excellent and we'll be back soon,02/13/2013,http://www.pickgrapevine.com/wantmore6/wild-wolf-brewing-company,wild-wolf-brewing-company
Xtra's Cafe,http://www.opentable.com/xtras-cafe?scpref=111&tab=2,4.2,"3322-B W. Cary St. Richmond, VA  23221 ",29,Contemporary American,$30 and under,Richmond,http://www.XtrasCafe.com,xtra.moore@xtrascafe.com,(804) 355-0446,4.0 out of 5,"First visit to Xtra's but not my last. Great menu, food and service. Will see you again soon.",02/14/2013,http://www.pickgrapevine.com/wantmore6/xtras-cafe,xtras-cafe
Zia Marie,http://www.opentable.com/zia-marie?scpref=111&tab=2,4.3,"4497 Lookout Rd Virginia Beach, VA  23455 ",35,Italian,$30 and under,Virginia Beach,http://zia-marie.com,bill@zia-marie.com,(757) 460-0715,1.0 out of 5,"The food is excellent but the service was awful. We were there for over 2 hours, had to physically get up from table to track down the waitress to ask for check and then had to physically take the check to the cashier and stand in the way of other waitresses to get it paid so we could leave.",02/13/2013,http://www.pickgrapevine.com/wantmore6/zia-marie,zia-marie
Zinc - Charlottesville,http://www.opentable.com/zinc-charlottesville?scpref=111&tab=2,4.0,"420 W Main St Charlottesville, VA  22903 ",41,Contemporary American,$31 to $50,Charlottesville,http://www.comptoirzinc.com,zinc420@gmail.com,(434) 245-9462,4.0 out of 5,my duck was so undercooked i could not chew it so it needed to be reheated and in doing so the presenation suffered and the vegtables became soggy. Others enjoyed their meals thoroughly.,02/08/2013,http://www.pickgrapevine.com/wantmore6/zinc-charlottesville,zinc-charlottesville
Zoes Steak & Seafood,http://www.opentable.com/zoes-steak-and-seafood?scpref=111&tab=2,4.6,"713 19th Street Virginia Beach, VA  23451-4114 ",86,Contemporary American,$31 to $50,Virginia Beach,http://www.zoesvb.com,info@zoesvb.com,(757) 437-3636,5.0 out of 5,Went there for an early Valentine's Day dinner. Everyone associated with Zoe's was very nice. We enjoyed our 2nd visit as much as the first. Great place to go for a special dinner.Neil and Sharon,02/11/2013,http://www.pickgrapevine.com/wantmore6/zoes-steak-and-seafood,zoes-steak-and-seafood
