Gio's Ristorante and Bar,http://www.opentable.com/gios-ristorante-and-bar?scpref=110&tab=2,3.9,"701 Market Street Suite 100 Saint Louis, MO  63101",33,Italian,$30 and under,Downtown,http://giosdowntown.com,giosdowntown@att.net,(314) 241-2424,4 / 5,These guys were very accommodating for our large group with children. The food was great and reasonably priced.,10/20/2012,http://www.pickgrapevine.com/wantmore5/gios-ristorante-and-bar,gios-ristorante-and-bar
Grand Cru Steaks & Seafood,http://www.opentable.com/grand-cru-steaks-and-seafood?scpref=110&tab=2,4.7,"2600 S. Providence Columbia, MO  65203 ",3,Steakhouse,$30 and under,Columbia,http://www.grandcrusteaksandseafood.com,reservationscru@gmail.com,(573) 443-2600,5 / 5,We had to cancel - will reschedule in Dec.,10/15/2012,http://www.pickgrapevine.com/wantmore5/grand-cru-steaks-and-seafood,grand-cru-steaks-and-seafood
Grbic Restaurant,http://www.opentable.com/grbic-restaurant?scpref=110&tab=2,4.7,"4071 Keokuk Saint Louis, MO  63116 ",6,European,$30 and under,St. Louis,http://www.grbicrestaurant.com,grbicrest@sbcglobal.net,(314) 772-3100,5 / 5,Everything was great and Ermin was wonderful !,07/13/2012,http://www.pickgrapevine.com/wantmore5/grbic-restaurant,grbic-restaurant
Harvest,http://www.opentable.com/harvest-st-louis?scpref=110&tab=2,4.3,"1059 South Big Bend Blvd. St. Louis, MO  63117 ",166,American,$30 and under,Richmond Heights,http://www.harveststlouis.com,harvestrestaurant@att.net,(314) 645-3522,5 / 5,"Loved the food, great chef, love the layers of flavors throughout the dish...true cuisine...timing between courses perfect...",10/20/2012,http://www.pickgrapevine.com/wantmore5/harvest-st-louis,harvest-st-louis
Hendricks BBQ,http://www.opentable.com/hendricks-bbq?scpref=110&tab=2,3.6,"1200 S. Main St. Saint Charles, MO  63301 ",24,Barbecue,$30 and under,St. Charles,http://www.hendricksbbq.com,info@hendricksbbq.com,(636) 724-8600,4 / 5,I loved Hendricks. The decor was great and we really felt like we were at a rustic smokehouse. The food was great with many selections. We had The Whole Shebang. Which is a sample of all their BBQ meats with 4 sides. I found the BBQ and sauces very very good. The bar and drink list was different and fun. The lighting was good and there were TV's up by the bar that can be seen throughout the place so we got to watch the Cardinal game while we ate. It wasn't too loud and we also thought the seating was comfortable.,10/19/2012,http://www.pickgrapevine.com/wantmore5/hendricks-bbq,hendricks-bbq
Ibby's -  Washington University,http://www.opentable.com/ibbys-washington-university?scpref=110&tab=2,4.1,"6465 Forsyth Blvd St. Louis, MO  63130 ",28,Contemporary American,$30 and under,Clayton,http://ibbys.wustl.edu/,james.bolen@cafebonappetit.com,(314) 935-3940,4 / 5,"If you are older than 25 you will feel very old in this restaurant. All of the other diners were evidently Wash U students, mainly undergraduates, at least when we were there, a Friday night.",09/21/2012,http://www.pickgrapevine.com/wantmore5/ibbys-washington-university,ibbys-washington-university
J. Buck's - Clayton,http://www.opentable.com/j-bucks-clayton?scpref=110&tab=2,4.0,"101 South Hanley Road Clayton, MO  63105 ",45,American,$31 to $50,Clayton,http://www.jbucks.com,clayton@jbucks.com,(314) 725-4700,5 / 5,The service was excellent and the menu was great great. There was a lot of variety and something for everyone.,10/16/2012,http://www.pickgrapevine.com/wantmore5/j-bucks-clayton,j-bucks-clayton
J. Gilbert’s Wood-Fired Steaks & Seafood - West County Center,http://www.opentable.com/j-gilberts-wood-fired-steaks-and-seafood-west-county-center?scpref=110&tab=2,4.5,"17A West County Center Suite A102 Des Peres, MO  63131 ",219,Steak,$31 to $50,Des Peres,http://www.jgilberts.com,3828@jgilberts.com,(314) 965-4600,5 / 5,"I entertained customers. We all thoroughly enjoyed everything from drinks, wine, appetizers, through to desert. We all ordered different things and everything was great.",10/18/2012,http://www.pickgrapevine.com/wantmore5/j-gilberts-wood-fired-steaks-and-seafood-west-county-center,j-gilberts-wood-fired-steaks-and-seafood-west-county-center
Jim Edmonds 15 Steakhouse,http://www.opentable.com/jim-edmonds-15-steakhouse?scpref=110&tab=2,4.2,"1900 Locust Street Saint Louis, MO  63103 ",39,Steakhouse,$30 and under,St. Louis,http://www.15stl.com,mwinfield@15stl.com,(314) 588-8899,3 / 5,The food was very good but the service was only average. Most of our drinks (like a martini) came without garnishs which we were very surprised by. We were in a separate room but it was very noisy and really not a quiet experience like we had hoped. It was just not a great experience - only average and we won't return since it was only average but priced like it should have been better than that!,09/21/2012,http://www.pickgrapevine.com/wantmore5/jim-edmonds-15-steakhouse,jim-edmonds-15-steakhouse
Kota Wood Fire Grill,http://www.opentable.com/kota-wood-fire-grill?scpref=110&tab=2,3.5,"522 N. Grand Ave St. Louis, MO  63103 ",53,Seafood,$30 and under,Downtown,http://kotawoodfiregrill.com,matt@kotawoodfiregrill.com,(314) 535-5577,5 / 5,Nice to have a great restaurant on Grand Ave. Food was very good and they easily accommodated requests. Just wish the menu was bigger.,10/19/2012,http://www.pickgrapevine.com/wantmore5/kota-wood-fire-grill,kota-wood-fire-grill
Kreis' Restaurant,http://www.opentable.com/kreis-restaurant?scpref=110&tab=2,4.4,"535 South Lindbergh Blvd St. Louis, MO  63131 ",56,Steak,$31 to $50,Frontenac,http://kreisrestaurant.com,kreis@kreisrestaurant.com,(314) 993-0735,5 / 5,"Another excellent experience at this restaurant. Best steaks in St Louis. Not a place for a quiet dinner. Always packed, but service is excellent. Always go back for a great dinner.",10/17/2012,http://www.pickgrapevine.com/wantmore5/kreis-restaurant,kreis-restaurant
Layla Lebanese Restaurant,http://www.opentable.com/layla-lebanese-restaurant?scpref=110&tab=2,4.2,"4317 Manchester Saint Louis, MO  63110 ",5,Lebanese,$30 and under,The Grove,http://www.laylalebaneserestaurant.com,laylalebaneserestaurant@gmail.com,(314) 535-5500,4 / 5,"Good food and attentive service -- it's great to have a restaurant like this in the Grove. They make some pretty tasty hummus. Our party of eight wasn't sure about the belly dancer at first, but she turned out to have a great sense of humor and made this place really memorable. The kitchen might want to have a look at its baklava recipe, though. Light and flaky on the pastry is what's called for, guys.",09/28/2012,http://www.pickgrapevine.com/wantmore5/layla-lebanese-restaurant,layla-lebanese-restaurant
Little Country Gentleman,http://www.opentable.com/little-country-gentleman?scpref=110&tab=2,3.9,"8135 Maryland Avenue St. Louis, MO  63105 ",8,Contemporary French / American,$50 and over,Clayton,http://www.littlecountrygentleman.com,info@halfandhalfstl.com,(314) 725-0719,5 / 5,"This meal was outstanding. The wine pairings were especially superb. The sommelier and chef really understand the art of great food and great wine. The chef uses molecular gastronomy wisely and sparingly to enhance dishes. For example, creating pine nut dust that somehow melts in your mouth into a velvety consistency.",10/19/2012,http://www.pickgrapevine.com/wantmore5/little-country-gentleman,little-country-gentleman
Lola,http://www.opentable.com/lola?scpref=110&tab=2,3.5,"1330 Washington Ave 500 N 14th Street Saint Louis, MO  63103",79,American,$30 and under,Downtown,http://welovelola.com,loftlylola@gmail.com,(314) 621-7277,4 / 5,Go for the music and the atmosphere. Snack but dont dine,10/07/2012,http://www.pickgrapevine.com/wantmore5/lola,lola
Lorenzo's Trattoria,http://www.opentable.com/lorenzos-trattoria?scpref=110&tab=2,4.3,"1933 Edwards St. Saint Louis, MO  63110 ",176,Italian,$30 and under,The Hill,http://www.lorenzostrattoria.com/,lorenzostrattoria@sbcglobal.net,(314) 773-2223,5 / 5,Great place for a nice quiet inner in a neighborhood restaurant.,10/19/2012,http://www.pickgrapevine.com/wantmore5/lorenzos-trattoria,lorenzos-trattoria
Lucas Park Grille,http://www.opentable.com/lucas-park-grille?scpref=110&tab=2,4.3,"1234 Washington Ave St. Louis, MO  63103 ",46,Contemporary American,$30 and under,Downtown,http://www.lucasparkgrille.com,info@lucasparkgrille.com,(314) 241-7770,5 / 5,Wonderful meal. Quality and temperature of food was perfect.Best meal/dining experience I've had in a while,10/20/2012,http://www.pickgrapevine.com/wantmore5/lucas-park-grille,lucas-park-grille
Mad Tomato,http://www.opentable.com/mad-tomato?scpref=110&tab=2,4.2,"8000 Carondelet Saint Louis, MO  63105 ",55,Italian,$30 and under,St. Louis,http://madtomatostl.com,madtomato@charter.net,(314) 932-5733,4 / 5,"My husband and I had dinner with another couple here for my birthday. Good ambiance, a bit noisy but wasn't a distraction...it did seem a bit crowded as we were seated right by the pizza oven. The food was delicious - Toasted Ravioli of the Day was ricotta/red pepper and could definitely tell it was homemade. Pear Salad, Swallow's Nest, Pork Ragu and Scorze pasta were all unique and delicious. Pumpkin pudding with salted caramel whipped cream for dessert - perfect!",10/13/2012,http://www.pickgrapevine.com/wantmore5/mad-tomato,mad-tomato
Maggiano's - St. Louis,http://www.opentable.com/maggianos-st-louis?scpref=110&tab=2,4.4,"#2 The Boulevard St. Louis Richmond Heights, MO  63117 ",378,Italian,$30 and under,Richmond Heights,http://www.maggianos.com,st.louis.information@maggianos.com,(314) 824-2402,5 / 5,Wonderful as always! However we did complain about our cheesecake and the waiter did nothing about it. Disappointing.,10/20/2012,http://www.pickgrapevine.com/wantmore5/maggianos-st-louis,maggianos-st-louis
Mango Peruvian Restaurant,http://www.opentable.com/mango-peruvian-restaurant?scpref=110&tab=2,4.4,"1101 Lucas Ave. St. Louis, MO  63101 ",177,Peruvian,$30 and under,Downtown,http://www.mangoperu.com,info@mangoperu.com,(314) 621-9993,5 / 5,"First trip, as wonderful as expected. Everything was flavorful. Peruvian cuisine is not Mexican food, more Mediterranean in nature but with nice use of Peruvian peppers and seasoning combinations. Deft touch with sea scallops which is always a good test for a kitchen. My partner had grilled shrimp with a bowtie pasta that was fantastic, superbly seasoned. The national dessert, a spongecake like roll with a caramel sauce inside, is positively addicting. We will definitely be back.",09/01/2012,http://www.pickgrapevine.com/wantmore5/mango-peruvian-restaurant,mango-peruvian-restaurant
McCormick & Schmick's Seafood - St. Louis,http://www.opentable.com/mccormick-and-schmicks-seafood-st-louis?scpref=110&tab=2,4.1,"17 West County Center Des Peres, MO  63131 ",127,Seafood,$30 and under,Des Peres,http://www.mccormickandschmicks.com,mssl@ldry.com,(314) 835-1300,5 / 5,We were there early in the evening-on a Sunday- so there were lots of families there. Very nice ambiance- everyone working there seemed genuinely happy to be there. The food was fantastic- overall it was a great experience! Will definitely go back.,10/21/2012,http://www.pickgrapevine.com/wantmore5/mccormick-and-schmicks-seafood-st-louis,mccormick-and-schmicks-seafood-st-louis
The Melting Pot - University City,http://www.opentable.com/the-melting-pot-university-city?scpref=110&tab=2,4.6,"6683 Delmar Blvd. University City, MO  63130 ",176,Fondue,$31 to $50,University City,http://www.meltingpot.com/university-city/specials,meltingpotstl@yahoo.com,(314) 725-4141,5 / 5,We thoroughly enjoyed our meal.We appreciated that the restaurant owner was seating people and spoke to us a few times throughout our meal.The servers are extremely friendly and take care of you very well.The food was delicious!,10/20/2012,http://www.pickgrapevine.com/wantmore5/the-melting-pot-university-city,the-melting-pot-university-city
Mike Shannon's Steaks & Seafood,http://www.opentable.com/mike-shannons-steaks-and-seafood?scpref=110&tab=2,4.1,"620 Market Street St. Louis, MO  63102 ",227,Steakhouse,$50 and over,St. Louis,http://www.ShannonSteak.com,pats@shannonsteak.com,(314) 421-1540,3 / 5,"When you have to almost beg to get the water glass filled, you know you are in for a long dinner out. I don't know if our server got slammed with tables all at once or what, but our party of two seemed very low on his list. After taking our order, he then returned to say they might be out of what I had ordered, did I have a second choice. Then left. My husband asked which entree I thought I might be getting - we were left in suspense. While the food was good, it didn't match my expectation level for the place and its prices. Just goes to show that service makes all the difference (or at least a significant amount of difference).",10/20/2012,http://www.pickgrapevine.com/wantmore5/mike-shannons-steaks-and-seafood,mike-shannons-steaks-and-seafood
Milagro Modern Mexican,http://www.opentable.com/milagro-modern-mexican?scpref=110&tab=2,4.2,"20 Allen Ave Suite 130 Webster Groves, MO  63119 ",98,Mexican,$30 and under,Webster Groves,http://www.milagromodernmexican.com,milagromodernmexican@gmail.com,(314) 962-4300,5 / 5,One of the best meals I've had in St. Louis. I'll definitely be coming back!,10/12/2012,http://www.pickgrapevine.com/wantmore5/milagro-modern-mexican,milagro-modern-mexican
Modesto,http://www.opentable.com/modesto?scpref=110&tab=2,4.4,"5257 Shaw Avenue St. Louis, MO  63110 ",132,Spanish,$30 and under,The Hill,http://www.modestotapas.com,modesto-stl@sbcglobal.net,(314) 772-8272,2 / 5,"Modesto has everything going for it (great look, super service fresh locally sourced food), but they have to improve on the taste of their food. Cauliflower cooked in truffle should have at least a hint of that glourious truffle taste. The same goes for paella. I could not detect saffron and the dish while fresh and hot had little to no taste. I will definitly give Modesto another chance due to their great service, super ambiance and overall potential.",10/20/2012,http://www.pickgrapevine.com/wantmore5/modesto,modesto
Morton's The Steakhouse - St. Louis - Clayton,http://www.opentable.com/mortons-the-steakhouse-st-louis?scpref=110&tab=2,4.4,"7822 Bonhomme Avenue Clayton, MO  63105 ",70,Steak,$50 and over,Clayton,http://www.mortons.com,gm.mst@mortons.com,(314) 725-4008,5 / 5,This was our first time at Morton's and it was very delightful evening. The service and food were oustanding.,10/19/2012,http://www.pickgrapevine.com/wantmore5/mortons-the-steakhouse-st-louis,mortons-the-steakhouse-st-louis
Mosaic Restaurants-Des Peres,http://www.opentable.com/mosaic-restaurants-des-peres?scpref=110&tab=2,4.1,"11925 Manchester Road Des Peres, MO  63131 ",126,Tapas / Small Plates,$30 and under,Des Peres,http://www.enjoymosaic.com,events@mosaicrestaurants.com,(314) 394-2323,5 / 5,"Had an excellent dining experience on a busy Saturday night. The manager Shaun greeted us at the door. Mosaic's was energized and the kitchen was sending beautiful food at a great pace. Service was friendly and attentive without being intrusive. The soup sampler appetizer was a great way to try 3 different soups in proportionate serving sizes The butternut squash was so flavorful. A real interesting and special entree was the Roasted Bone Marrow; split bones with the richest, creamiest marrow to be spread on the accompanying bread. So Good!! The Missouri Organic Tenderloin was so tender and had a nice flavor. Presentation of all the food was enticing. I will be back and will highly recommend Mosaic's.",10/20/2012,http://www.pickgrapevine.com/wantmore5/mosaic-restaurants-des-peres,mosaic-restaurants-des-peres
Mosaic Restaurants-Downtown,http://www.opentable.com/mosaic-restaurants-downtown?scpref=110&tab=2,4.4,"1001 Washington Avenue St. Louis, MO  63101 ",89,Tapas / Small Plates,$30 and under,St. Louis,http://mosaicrestaurants.com,gregg@mosaicrestaurants.com,(314) 621-6001,5 / 5,Food was great and service was exceptional!,10/13/2012,http://www.pickgrapevine.com/wantmore5/mosaic-restaurants-downtown,mosaic-restaurants-downtown
Mother in Law House,http://www.opentable.com/mother-in-law-house?scpref=110&tab=2,4.1,"500 South Main St St. Charles, MO  63301 ",10,American,$30 and under,St. Charles,http://www.motherinlawhouse.com,bob@motherinlawhouse.com,(636) 946-9444,1 / 5,"I have been to this restaurant before and the service and food were excellant. When our group went this time the food was sub-standard, the celery salad dressing tasted and looked as though it had been watered down. The service was terrible. We had made reservations well in advance and we waited for approximately 30 minutes before our orders were taken. The young man said that he was trying to take care of 4 tables. We had reservations for the evening meal also but I cancelled them because of this poor service. I doubt that I will go back there again.",09/14/2012,http://www.pickgrapevine.com/wantmore5/mother-in-law-house,mother-in-law-house
Napoli 2,http://www.opentable.com/napoli-2?scpref=110&tab=2,4.5,"1054 Town &amp; Country Crossing Town and Country, MO  63017 ",141,Italian,$31 to $50,Chesterfield,http://napoli2.com/,info@napoli2.com,(636) 256-9998,5 / 5,"The evening was perfect! Our server was pleasant and knowledgeable. He was attentive, but not overly involved. We had many different servings and they were all appropriately paced. The food was served in a timely manner and was exceptional.",10/20/2012,http://www.pickgrapevine.com/wantmore5/napoli-2,napoli-2
Niche,http://www.opentable.com/niche?scpref=110&tab=2,4.6,"1831 Sidney Street St. Louis, MO  63104 ",217,American,$30 and under,Soulard / Benton Park,http://www.nichestlouis.com,info@Nichestlouis.com,(314) 773-7755,5 / 5,"We were dining at Niche for the first time, meeting our friend's new boyfriend. The food was excellent (terrific, amazing, original). The menu itself was a great conversation starter! Everything tasted fresh and delicious. Recommendations from our waitress were spot-on. Am definitely recommending Niche to friends and family for a special occassion or ""just because.""",10/05/2012,http://www.pickgrapevine.com/wantmore5/niche,niche
Nico,http://www.opentable.com/nico-saint-louis?scpref=110&tab=2,4.0,"6525 Delmar Boulevard Saint Louis, MO  63130 ",99,Mediterranean,$30 and under,The Loop,http://www.nicostl.com,nico@nicostl.com,(314) 727-0200,5 / 5,"The menu is very creative and the food is subtly, and complexly flavored. Highly recommend for a new and innovative dining experience. Portions are substantial, you will feel well fed after your meal. Very attentive wait staff.",10/13/2012,http://www.pickgrapevine.com/wantmore5/nico-saint-louis,nico-saint-louis
Oceano Bistro - Chesterfield,http://www.opentable.com/oceano-bistro-chesterfield?scpref=110&tab=2,4.1,"16125 Chesterfield Parkway West Chesterfield, MO  63017 ",134,Seafood,$30 and under,Chesterfield,http://www.Oceanobistro.com,Info@oceanobistro.com,(636) 536-9404,4 / 5,Food and service was very good.,10/20/2012,http://www.pickgrapevine.com/wantmore5/oceano-bistro-chesterfield,oceano-bistro-chesterfield
Porter's Steakhouse-Collinsville,http://www.opentable.com/porters-steakhouse?scpref=110&tab=2,4.4,"1000 Eastport plaza Collinsville, IL  62234 ",51,Steakhouse,$31 to $50,St. Louis,http://www.porterscollinsville.com,bjoseph@doubletreecollinsville.com,(618) 345-2400,5 / 5,"Porterhouse steak was outstanding, very flavorful. Service was very good, never had to ask for anything. Salad was huge, could maybe downsize it a little bit, but not a big deal there. The bread pudding also very good for dessert. Would definitely recommend this place for special occassions or just a night for a great steak.",10/19/2012,http://www.pickgrapevine.com/wantmore5/porters-steakhouse,porters-steakhouse
Prime 1000,http://www.opentable.com/prime-1000?scpref=110&tab=2,4.1,"1000 Washington Street St. Louis, MO  63101 ",77,Steak,$31 to $50,Downtown,http://www.prime1000.com,tom@prime1000.com,(314) 241-1000,5 / 5,"I will definately return to Prime 1000 and will recommend them. The ambiance is what you'd expect at an upscale, fine-dining restaurant but without being snobby or elitest, very comfortable. The decor has a nice modern feel, with interesting original art in the bar and dining room. While the side-dishes were very good, they weren't outstanding and the real ""star-of-the-show"" is, of course, the steak, which is extraordinary.",10/20/2012,http://www.pickgrapevine.com/wantmore5/prime-1000,prime-1000
Robust,http://www.opentable.com/robust?scpref=110&tab=2,4.4,"227 W. Lockwood Ave. Webster Groves, MO  63119 ",97,Tapas / Small Plates,$30 and under,Webster Groves,http://www.robustwinebar.com,info@robustwinebar.com,(314) 963-0033,5 / 5,"They have successfully combined dining with more formal wine tasting. Once you've found something you like, you can purchase their wines in their wine shop to take home.",10/19/2012,http://www.pickgrapevine.com/wantmore5/robust,robust
Room 38,http://www.opentable.com/room-38?scpref=110&tab=2,4.3,"38 N 8th St Columbia, MO  65201 ",3,Contemporary American,$30 and under,Columbia,http://room-38.com/wordpress/,info@room-38.com,(573) 449-3838,4 / 5,"GREAT FOOD,MORE OF A HOT SPOT BAR SCENE ENVIROMENT. i WOULD GO BACK AGAIN.",08/25/2012,http://www.pickgrapevine.com/wantmore5/room-38,room-38
Rosalita's Cantina,http://www.opentable.com/rosalitas-cantina?scpref=110&tab=2,3.8,"1237 Washington Ave. St. Louis, MO  63103 ",65,Mexican,$30 and under,Downtown,http://rosalitascantina.com,josh@rosalitascantina.com,(314) 621-2700,5 / 5,Great Food- Fast Service- Enjoyed the Cardinals Play Off Game while enjoying great drinks and food- a total home run!!!,10/18/2012,http://www.pickgrapevine.com/wantmore5/rosalitas-cantina,rosalitas-cantina
Ruth's Chris Steak House - Clayton,http://www.opentable.com/ruths-chris-steak-house-clayton?scpref=110&tab=2,4.6,"1 North Brentwood Suite 150 Clayton, MO  63105 ",39,Steakhouse,$50 and over,Clayton,http://www.ruthschris.com,gmstlouis@ruthschris.com,(314) 783-9900,4 / 5,Terrific quality food and spectacular service. Dining room is dated but still attractive in an old fashioned sense.,10/09/2012,http://www.pickgrapevine.com/wantmore5/ruths-chris-steak-house-clayton,ruths-chris-steak-house-clayton
Ruth's Chris Steak House - St. Louis,http://www.opentable.com/ruths-chris-steak-house-st-louis?scpref=110&tab=2,4.5,"315 Chestnut Street St. Louis, MO  63102 ",58,Steak,$50 and over,St. Louis,http://www.ruthschris.com,stlouis@ruthschris.us,(314) 259-3200,4 / 5,"We ate at the location in downtown St. Louis. It was a great experience. My 13 year old son took me, his mother out on his first date. It was such a wonderful occasion and we truly enjoyed the atmosphere and the food. My son stated the next day ""that the steak was really good"". Our waitress was nice and pleasant. We also got the opportunity to meet Charles Woodson of the Green Bay Packers. My son took a picture with him so he thought the experience was superb. I would recommend eating at this restaurant.",10/20/2012,http://www.pickgrapevine.com/wantmore5/ruths-chris-steak-house-st-louis,ruths-chris-steak-house-st-louis
Sanctuaria,http://www.opentable.com/sanctuaria?scpref=110&tab=2,4.3,"4198 Manchester Ave. St. Louis, MO  63110 ",85,Tapas / Small Plates,$30 and under,Central West End,http://www.sanctuariastl.com,wild@sanctuariastl.com,(314) 535-9700,5 / 5,"My husband and I are regulars at Sanctuaria and it never disappoints. We always take our out of town guests here and they love it. The atmosphere is great and the food is outstanding. It's so nice to be able to order so many different plates to share since everything is so delicious it is nice to sample a variety of things. The service is always great as well. It's great food without the fuss. The cocktails are also excellent. I'm never sure what I want and upon answering a few questions, they create a drink for me that is delicious! We highly recommend it!",10/20/2012,http://www.pickgrapevine.com/wantmore5/sanctuaria,sanctuaria
Scape American Bistro,http://www.opentable.com/scape-american-bistro?scpref=110&tab=2,4.4,"48 Maryland Plaza St. Louis, MO  63108 ",186,American,$30 and under,Central West End,http://www.scapestl.com,ekelly@scapestl.com,(314) 361-7227,5 / 5,"Awesome food, atmosphere, & fun.Can't wait to return!",10/20/2012,http://www.pickgrapevine.com/wantmore5/scape-american-bistro,scape-american-bistro
Scottish Arms,http://www.opentable.com/scottish-arms?scpref=110&tab=2,4.3,"6-8 S. Sarah St. Saint Louis, MO  63108 ",19,Scottish,$30 and under,Downtown,http://www.thescottisharms.com,nisbetally@gmail.com,(314) 535-0551,4 / 5,Overall a very positive dining experience. Had to send the flank steak back being a bit underdone for Medium but the end result was delicious. Service was good for the most part and the ambiance very amenable to quiet conversation. Was my first visit and plan on lunch there in the near future.,10/19/2012,http://www.pickgrapevine.com/wantmore5/scottish-arms,scottish-arms
