MOSAIC Restaurant,http://www.opentable.com/mosaic-restaurant?scpref=111&tab=2,4.0,"6229a River Road Richmond, VA  23229 ",137,Contemporary American,$30 and under,Richmond,http://www.mosaicedibles.com,richmond@mosaicedibles.com,(804) 288-7482,2.0 out of 5,I have been to Mosaic many times but this visit was very disappointing.,02/09/2013,http://www.pickgrapevine.com/wantmore6/mosaic-restaurant,mosaic-restaurant
Nawab Indian Cuisine - Newport News,http://www.opentable.com/nawab-indian-cuisine-newport-news?scpref=111&tab=2,4.3,"11712 Jefferson Avenue Newport News, VA  23606 ",6,Indian,$30 and under,Newport News,http://www.nawabonline.com,info@nawabonline.com,(757) 591-9200,5.0 out of 5,"We make regular trips to enjoy Indian cuisine, and Nawab never disappoints!",12/09/2012,http://www.pickgrapevine.com/wantmore6/nawab-indian-cuisine-newport-news,nawab-indian-cuisine-newport-news
Nawab Indian Cuisine - Norfolk,http://www.opentable.com/nawab-indian-cuisine-norfolk?scpref=111&tab=2,4.0,"888 N Military Hwy Norfolk, VA  23502 ",1,Indian,$30 and under,Norfolk,http://www.nawabonline.com,info@nawabonline.com,(757) 455-8080,4.0 out of 5,"nawab is a great place anytime. The food, service, and ambiance is always top notch.",11/22/2012,http://www.pickgrapevine.com/wantmore6/nawab-indian-cuisine-norfolk,nawab-indian-cuisine-norfolk
Nawab Indian Cuisine - Williamsburg,http://www.opentable.com/nawab-indian-cuisine-williamsburg?scpref=111&tab=2,4.4,"204 Monticello Avenue Williamsburg, VA  23185 ",7,Indian,$30 and under,Williamsburg,http://www.nawabonline.com,info@nawabonline.com,(757) 565-3200,5.0 out of 5,"""I love the relaxed feel, saver was polite and helpful. The food was Delicious .",12/31/2012,http://www.pickgrapevine.com/wantmore6/nawab-indian-cuisine-williamsburg,nawab-indian-cuisine-williamsburg
The Neighbors Place,http://www.opentable.com/the-neighbors-place?scpref=111&tab=2,4.3,"104 Paulette Circle Lynchburg, VA  24502 ",28,Contemporary American,$30 and under,Lynchburg,http://www.theneighborsplace.com,info@theneighborsplace.com,(434) 455-4300,5.0 out of 5,"We have been there many times. The food, service, special occasion's or anytime have always been a 5 star if not more experience. We booked my husband's 70th birthday and ""sweet heart""day there just last week.",02/14/2013,http://www.pickgrapevine.com/wantmore6/the-neighbors-place,the-neighbors-place
Norfolk Chop House,http://www.opentable.com/norfolk-chop-house?scpref=111&tab=2,4.4,"2314 Colonial Ave Norfolk, VA  23517 ",58,Steakhouse,$30 and under,Norfolk,http://www.norfolkchophouse.com,info@norfolkchophouse.com,(757) 627-1190,5.0 out of 5,"It was great. The waiter was a unprofessional by calling me nick name like ""guy, boss"" I am a chef and the food was great just the waiter was not up to par and also the waiter kept touching my guest and I every time he came to check on out foor or drinks.",02/13/2013,http://www.pickgrapevine.com/wantmore6/norfolk-chop-house,norfolk-chop-house
One Fish Two Fish,http://www.opentable.com/one-fish-two-fish?scpref=111&tab=2,4.5,"2109 West Great Neck Road  Suite 102 Virginia Beach, VA  23451",105,Seafood,$30 and under,Virginia Beach,http://www.onefish-twofish.com,mail@onefish-twofish.com,(757) 496-4350,5.0 out of 5,Great Place. The sun sets over the water here. Fantastic spot for a date at sunset...,02/14/2013,http://www.pickgrapevine.com/wantmore6/one-fish-two-fish,one-fish-two-fish
Opus 9 Steakhouse,http://www.opentable.com/opus-9-steakhouse?scpref=111&tab=2,4.4,"5143 Main St Williamsburg, VA  23188 ",200,Steakhouse,$31 to $50,Williamsburg,http://www.opus9steakhouse.com,reservations@opus9steakhouse.com,(757) 645-4779,5.0 out of 5,Excellent dining adventure! All aspects were what we expected. One of the best filets I've ever eaten. Wait staff was the best and very attentive. We'll be back.,02/13/2013,http://www.pickgrapevine.com/wantmore6/opus-9-steakhouse,opus-9-steakhouse
Otani Steak and Seafood,http://www.opentable.com/otani-steak-and-seafood?scpref=111&tab=2,4.1,"1532 Laskin Rd Virginia Beach, VA  23451 ",20,Japanese,$30 and under,Virginia Beach,http://www.otanigrill.com,kiho830@yahoo.com,(757) 425-0404,5.0 out of 5,"We enjoyed getting to know our ""food mates"" at our seating... Diner there is always not only about the food, but also the ""show"" that is part of the chef's routine! We had a great time!",02/13/2013,http://www.pickgrapevine.com/wantmore6/otani-steak-and-seafood,otani-steak-and-seafood
Pasha Mezze,http://www.opentable.com/pasha-mezze?scpref=111&tab=2,4.1,"340 W 22nd St Norfolk, VA  23517 ",21,Mediterranean,$30 and under,Norfolk,http://www.pashamezze.com,usapasha@mail.com,(757) 627-1318,5.0 out of 5,We move a lot and lived in the area about 4 years ago. We were fortunate enough to dine here several years ago and were happy to see they were still in the neighborhood. We introduced another couple to Pasha Mezze and they loved it as much as we did.,02/10/2013,http://www.pickgrapevine.com/wantmore6/pasha-mezze,pasha-mezze
"Passion, The Restaurant",http://www.opentable.com/passion-the-restaurant?scpref=111&tab=2,4.5,"1036 Volvo Parkway Ste 3 Chesapeake, VA  23320 ",83,Contemporary American,$30 and under,Chesapeake,http://www.passiontherestaurant.com,diane@passiontherestaurant.com,(757) 410-3975,4.0 out of 5,"The food and service were good, but it is over priced for the area.",02/14/2013,http://www.pickgrapevine.com/wantmore6/passion-the-restaurant,passion-the-restaurant
Pasture,http://www.opentable.com/pasture?scpref=111&tab=2,4.2,"416 E Grace St Richmond, VA  23219 ",83,Southern,$30 and under,Richmond,http://pastureva.com,Pasturerva@gmail.com,(804) 780-0416,4.0 out of 5,Great Food and Great cocktails!,02/11/2013,http://www.pickgrapevine.com/wantmore6/pasture,pasture
The Peacock's Pantry,http://www.opentable.com/the-peacocks-pantry?scpref=111&tab=2,5.0,"1731 West Main Street Richmond, VA  23220 ",3,Contemporary American,$30 and under,Richmond,http://www.peacockspantry.com,peacockspantry@aol.com,(804) 732-3333,3.0 out of 5,I think that the overall intention was well but the execution needed work the host made us wait for quite some time for an extremely inconvenient location when there was at least 3 empty tables so I had to refuse that table. Once seated my wife observed that all of the staff seemed nervous as if they weren't trained efficiently but although it took a long time for appetizers and the first course I think the waiter wasn't bad. I actually started to unwind until I observed the bartender passing out roses and gave every woman in the restaurant a rose except for my wife and since we were the only African Americans there it didn't take long for us to jump to conclusions since we all were paying the same amount. But the food came out well,02/14/2013,http://www.pickgrapevine.com/wantmore6/the-peacocks-pantry,the-peacocks-pantry
Portico Restaurant - Richmond,http://www.opentable.com/portico-restaurant-richmond?scpref=111&tab=2,4.3,"12506 River Road Richmond, VA  23238 ",141,Italian,$30 and under,Richmond,http://porticorichmond.com,porticodining@gmail.com,(804) 784-4800,4.0 out of 5,"Portico's indoor space is somewhat small with many tables, so it tends to be very noisy. I have been just twice, but on both occasions the food was good but not outstanding, and was served at near room temperature. The thing that makes this place special is its outdoor patio, and when I return I will only do so when weather permits outdoor seating.",02/14/2013,http://www.pickgrapevine.com/wantmore6/portico-restaurant-richmond,portico-restaurant-richmond
Preston's,http://www.opentable.com/prestons-blacksburg?scpref=111&tab=2,4.3,"901 Prices Fork Rd Blacksburg, VA  24061 ",58,Steakhouse,$31 to $50,Blacksburg,http://www.innatvirginiatech.com/dining_lounge/prestons_restaurant/,PrestonsRestaurant@vt.edu,(540) 231-0120,5.0 out of 5,Having candidate interviews whether Breakfast or Dinner in Preston's Restaurant was very enjoyable.,02/13/2013,http://www.pickgrapevine.com/wantmore6/prestons-blacksburg,prestons-blacksburg
Rappahannock,http://www.opentable.com/rappahannock?scpref=111&tab=2,4.1,"320 E. Grace St. Richmond, VA  23219 ",178,Seafood,$30 and under,Richmond,http://www.rroysters.com,reservations@rroysters.com,(804) 545-0565,5.0 out of 5,"What an amazing meal! I haven't been this excited about a dinner in a long time. Great assortment of fresh oysters, assorted wine list and knowledgeable wait staff.",02/14/2013,http://www.pickgrapevine.com/wantmore6/rappahannock,rappahannock
Regency Dining Room - The Hotel Roanoke & Conference Center,http://www.opentable.com/regency-dining-room-the-hotel-roanoke-and-conference-center?scpref=111&tab=2,4.4,"110 Shenandoah Ave NE Roanoke, VA  24016 ",36,Southern,$31 to $50,Roanoke,http://www.HotelRoanoke.com,dmcgettigan@hotelroanoke.com,(540) 985-5900,5.0 out of 5,They were very accommodating for our special occasion anniversary!,01/15/2013,http://www.pickgrapevine.com/wantmore6/regency-dining-room-the-hotel-roanoke-and-conference-center,regency-dining-room-the-hotel-roanoke-and-conference-center
Restaurant Pomme,http://www.opentable.com/restaurant-pomme?scpref=111&tab=2,4.6,"115 S Main St Gordonsville, VA  22942 ",75,French,$30 and under,Gordonsville,http://www.restaurant-pomme.com,pomme2@verizon.net,(540) 832-0130,5.0 out of 5,Have visited the Restaurant Pomme several times in the past five years. This is one of the best restaurants in the east. The food is always perfectly prepared. The taste is fantastic. The service is impecible. My wife and I always have a great evening when we dine at this restaurant!,02/13/2013,http://www.pickgrapevine.com/wantmore6/restaurant-pomme,restaurant-pomme
Rhett's River Grill and Raw Bar,http://www.opentable.com/rhetts-river-grill-and-raw-bar?scpref=111&tab=2,3.9,"2335 Seminole Trail Suite 100 Charlottesville, VA  22901",23,American,$30 and under,Charlottesville,http://www.rhettsrivergrill.com,rhett@rhettsrivergrill.com,(434) 974-7818,2.0 out of 5,"Ordered duck. It was almost raw. The server said ""that's the way the chef makes it"". I almost sent it back but didn't. I agree duck should not be overlooked but this was raw. You're better off at a Ruby Tuesday where the food is at least consistent.",02/08/2013,http://www.pickgrapevine.com/wantmore6/rhetts-river-grill-and-raw-bar,rhetts-river-grill-and-raw-bar
River Stone Chophouse,http://www.opentable.com/river-stone-chophouse?scpref=111&tab=2,4.4,"8032 Harbour View Boulevard Suffolk, VA  23435 ",97,Steakhouse,$50 and over,Suffolk,http://www.riverstonechophouse.com,riverstone@charter.net,(757) 638-7990,5.0 out of 5,Fine dining with the most accomadating service I have had in some time. My waiter was superb. The food was unparalleled. The entire expierence was sublime.,02/09/2013,http://www.pickgrapevine.com/wantmore6/river-stone-chophouse,river-stone-chophouse
River's Inn Restaurant,http://www.opentable.com/rivers-inn-restaurant?scpref=111&tab=2,3.9,"8109 Yacht Haven Rd Gloucester, VA  23062 ",22,Seafood,$30 and under,Gloucester,http://www.rivers-inn.com,riversinn@yryh.net,(804) 642-9942,1.0 out of 5,"I think the restaurant had an off night we were there. We have had great experiences there over the years but not on 14 Feb 2013. Our waitress did not take our order until 15 minutes into the evening, and that was for drinks. We had to ask for the wine we ordered 3 times. My wife's soup was warmish but not hot, but she wasn't about to chance the delay waiting for it to be warmed up. My wife's meal was cold when she finally got it, 45 minutes after the wine had made its way to our table. Desert never made it and neither did the bill. We calculated what we owed and I left a tip; I did lose some serious points with my wife on that issue. Two tables left while we were there, never made it past drinks. However, Sweet Frog was great!",02/14/2013,http://www.pickgrapevine.com/wantmore6/rivers-inn-restaurant,rivers-inn-restaurant
Riverwalk Restaurant,http://www.opentable.com/riverwalk-restaurant?scpref=111&tab=2,4.5,"323 Water Street Suite A-1 Yorktown, VA  23690 ",66,Seafood,$30 and under,Yorktown,http://www.riverwalkrestaurant.net,info@riverwalkrestaurant.net,(757) 875-1522,5.0 out of 5,"Excellent food, excellent service, excellent ambiance, excellent view",02/14/2013,http://www.pickgrapevine.com/wantmore6/riverwalk-restaurant,riverwalk-restaurant
Rockafeller's Restaurant,http://www.opentable.com/rockafellers-restaurant?scpref=111&tab=2,4.6,"308 Mediterranean Ave Virginia Beach, VA  23451 ",12,Seafood,$30 and under,Virginia Beach,http://www.rockafellers.com,info@rockafellers.com,(757) 422-5654,4.0 out of 5,Food didn't seem up to usual quality. I am guessing with it being restaurant week the kitchen may have been overwhelmed.Won't keep us from coming back.Service was great as usual!,01/20/2013,http://www.pickgrapevine.com/wantmore6/rockafellers-restaurant,rockafellers-restaurant
RumbleSeat Grill,http://www.opentable.com/rumbleseat-grill?scpref=111&tab=2,3.0,"12912 Plaza Dr Richmond, VA  23233 ",2,American,$30 and under,Richmond,http://www.rumbleseatgrill.com,info@rumbleseatgrill.com,(804) 784-2737,3.0 out of 5,"Nice place, the food was good, not great, if I had young kids it would be a regular stop. They've really brightened the place and it's very welcoming.",02/02/2013,http://www.pickgrapevine.com/wantmore6/rumbleseat-grill,rumbleseat-grill
Ruth's Chris Steak House - Richmond,http://www.opentable.com/ruths-chris-steak-house-richmond?scpref=111&tab=2,4.6,"11500 Huguenot Road Midlothian, VA  23113 ",82,Steak,$50 and over,Richmond,http://www.sizzlingsteak.com,richmond30@ruthschris.com,(804) 378-0600,5.0 out of 5,Ruth's Chris always does it right!,02/14/2013,http://www.pickgrapevine.com/wantmore6/ruths-chris-steak-house-richmond,ruths-chris-steak-house-richmond
Ruth's Chris Steak House - Virginia Beach,http://www.opentable.com/ruths-chris-steak-house-virginia-beach?scpref=111&tab=2,4.6,"205 Central Park Avenue Virginia Beach, VA  23462 ",74,Steak,$50 and over,Virginia Beach,http://www.sizzlingsteak.com,virginiabeach96@ruthschris.com,(757) 213-0747,5.0 out of 5,"Always outstanding food and service. Pricey, but you get what you pay for. I think the wine list is overpriced, but everything else is worth the price.",02/13/2013,http://www.pickgrapevine.com/wantmore6/ruths-chris-steak-house-virginia-beach,ruths-chris-steak-house-virginia-beach
Salacia - Prime Steak and Seafood,http://www.opentable.com/salacia-prime-steak-and-seafood?scpref=111&tab=2,4.5,"3001 Atlantic Ave Virginia Beach, VA  23451 ",47,Steak,$50 and over,Virginia Beach,http://www.salaciavb.com,nikolay_dimitrov@hiltonvb.com,(757) 213-3473,3.0 out of 5,"portions unecessarily small, presentation good, taste quality not",02/02/2013,http://www.pickgrapevine.com/wantmore6/salacia-prime-steak-and-seafood,salacia-prime-steak-and-seafood
Sam Miller's,http://www.opentable.com/sam-millers?scpref=111&tab=2,3.7,"1210 E.Cary St. Richmond, VA  23219 ",32,American,$30 and under,Richmond,http://www.sammillers.com,kristin@sammillers.com,(804) 644-5465,2.0 out of 5,A great place to have dinner !! Been there several times over the years.,02/14/2013,http://www.pickgrapevine.com/wantmore6/sam-millers,sam-millers
Schlesinger's Chop House,http://www.opentable.com/schlesingers-chop-house?scpref=111&tab=2,4.4,"1106 William Styron Square South Newport News, VA  23606 ",101,Steakhouse,$31 to $50,Newport News,http://www.schlesingerssteaks.com/,reservations@schlesingersteaks.com,(757) 599-4700,1.0 out of 5,"Scallop appetizer came with 3 scallops. Prime rib was served cold, then I sent it back. It was the most tasteless steak I have ever had. For the 120 dollar bill Ruth's chris is way better. I will never go back to this restaurant",02/02/2013,http://www.pickgrapevine.com/wantmore6/schlesingers-chop-house,schlesingers-chop-house
The Seafare of Williamsburg,http://www.opentable.com/the-seafare-of-williamsburg?scpref=111&tab=2,4.2,"1632 Richmond Road Williamsburg, VA  23185 ",56,Steakhouse,$31 to $50,Williamsburg,http://www.theseafare.com,marinos.sarantakos@hilton.com,(757) 229-0099,2.0 out of 5,"Average food quality. Service was spotty, but it was Valentine's day...",02/14/2013,http://www.pickgrapevine.com/wantmore6/the-seafare-of-williamsburg,the-seafare-of-williamsburg
Selba,http://www.opentable.com/selba?scpref=111&tab=2,4.2,"2416 West Cary Street Richmond, VA  23220 ",131,Contemporary American,$30 and under,Richmond,http://www.selbarichmond.com,fresh@selbarichmond.com,(804) 358-2229,2.0 out of 5,"Our experience at Selba would be described as mediocre at best. There was a long wait for any attention from our waiter. Then, the pace of things picked up but the service was never at all attentive or personable. The food was nothing I would ever return for. The portions were quite small. Both of our entrees arrived cold and were not attractively presented in the least. The taste was dull and uninspired. Others may like this restaurant but we think there are many better restaurants in Richmond than Selba.",02/16/2013,http://www.pickgrapevine.com/wantmore6/selba,selba
Shoemaker's Grille,http://www.opentable.com/shoemakers-fine-dining?scpref=111&tab=2,4.5,"1312 Commerce Street Lynchburg, VA  24504 ",93,American,$30 and under,Lynchburg,http://www.shoemakersdining.com,shoemakersmgr@gmail.com,(434) 455-1510,2.0 out of 5,We recommend Shoemaker's because of their food but be prepared for a long wait.,02/14/2013,http://www.pickgrapevine.com/wantmore6/shoemakers-fine-dining,shoemakers-fine-dining
Shula's 347 Grill - Roanoke,http://www.opentable.com/shulas-347-grill-roanoke?scpref=111&tab=2,3.9,"2801 Hershberger Rd, NW Roanoke, VA  24017 ",29,Steak,$31 to $50,Roanoke,http://www.shulas347roanoke.com,katie.camper@sheratonroanoke.com,(540) 366-5220,4.0 out of 5,Enjoyed the food and dessert was wonderful,02/14/2013,http://www.pickgrapevine.com/wantmore6/shulas-347-grill-roanoke,shulas-347-grill-roanoke
Shula's 347 Grill at the Marriott Norfolk Waterside,http://www.opentable.com/shulas-347-grill-at-the-marriott-norfolk-waterside?scpref=111&tab=2,4.4,"235 East Main Street Norfolk, VA  23510 ",29,Steak,$31 to $50,Norfolk,http://www.donshula.com/shulas-347-grill-norfolk,desbenshade@marriottnorfolk.com,(757) 282-6347,5.0 out of 5,This was a good experience. The staff were very friendly and knowledgable. I believe they helped to make my husband's birthday a great one.,01/30/2013,http://www.pickgrapevine.com/wantmore6/shulas-347-grill-at-the-marriott-norfolk-waterside,shulas-347-grill-at-the-marriott-norfolk-waterside
Shula's Steak House - Hilton Richmond Hotel & Spa,http://www.opentable.com/shulas-steak-house-hilton-richmond-hotel-and-spa?scpref=111&tab=2,4.1,"12042 West Broad Street Richmond, VA  23233 ",36,Steak,$50 and over,Richmond,http://www.donshula.com/locations.php?l=1&restid=174,info@shulasrichmond.com,(804) 565-7000,2.0 out of 5,"Overall, the value was far below the cost.",02/13/2013,http://www.pickgrapevine.com/wantmore6/shulas-steak-house-hilton-richmond-hotel-and-spa,shulas-steak-house-hilton-richmond-hotel-and-spa
Sonoma Wine Bar & Bistro - Virginia Beach,http://www.opentable.com/sonoma-wine-bar-and-bistro?scpref=111&tab=2,4.5,"189 Central Park Avenue Virginia Beach, VA  23462 ",47,Fusion / Eclectic,$30 and under,Virginia Beach,http://www.sonomatowncenter.com,kati@sonomatowncenter.com,(757) 490-9463,5.0 out of 5,"Fabulous food, outstanding service & lovely, lovely setting.",02/14/2013,http://www.pickgrapevine.com/wantmore6/sonoma-wine-bar-and-bistro,sonoma-wine-bar-and-bistro
Southern Inn Restaurant,http://www.opentable.com/southern-inn-restaurant?scpref=111&tab=2,4.5,"37 South Main Street Lexington, VA  24450 ",77,Contemporary American,$30 and under,Lexington,http://www.southerninn.com,info@southerninn.com,(540) 463-3612,5.0 out of 5,What an outstanding place!!! Great meal!!! Great Staff. Great night! Thank you!!!,02/14/2013,http://www.pickgrapevine.com/wantmore6/southern-inn-restaurant,southern-inn-restaurant
Steinhilber's Restaurant,http://www.opentable.com/steinhilbers-restaurant?scpref=111&tab=2,4.4,"653 Thalia Road Virginia Beach, VA  23452 ",152,Seafood,$31 to $50,Virginia Beach,http://www.steinys.com,reservations@steinys.com,(757) 340-1156,5.0 out of 5,"This restaurant has been around since the 1930's, and while some of the decor was a little outdated, the dedication to service and good food is probably a big factor in why it is still around and successful. The food was excellent, the wait staff very attentive and sincere about the meal and our experience. I had the fried shrimp as an appetizer and plan to have them as a meal the next time. Some of the best shrimp I've ever had! Can't wait to come back when its warmer and enjoy a drink on the deck looking over the inlet.",02/14/2013,http://www.pickgrapevine.com/wantmore6/steinhilbers-restaurant,steinhilbers-restaurant
Surf Club Ocean Grille - Wyndham Oceanfront,http://www.opentable.com/surf-club-ocean-grille-wyndham-oceanfront?scpref=111&tab=2,3.8,"5700 Atlantic Ave Virginia Beach, VA  23451 ",4,Seafood,$30 and under,Virginia Beach,http://www.surfclubvabeach.com,reservations@surfclubvabeach.com,(757) 425-5699,5.0 out of 5,"Went back for dinner. Again, I have to say the best view ever. Watched the sun set as we ate our dinner. The complimentary bread was amazing, none of us can stop thinking about it even while we had our main meal. My porkchops are in my all time top 3 of pork chops I've ever had. Also, was told the crab cake sandwich topped with a fried gren tomatoes was amazing and the angus burger was decent. The fries were unexpectedly addicting. Super thin shoestrings with awesome seasoning. Went on a Saturday night and still was only two other tables eating dinner. A hidden secret that needs to be discovered by all!",02/09/2013,http://www.pickgrapevine.com/wantmore6/surf-club-ocean-grille-wyndham-oceanfront,surf-club-ocean-grille-wyndham-oceanfront
Swan Terrace - Founder's Inn,http://www.opentable.com/swan-terrace-founders-inn?scpref=111&tab=2,4.4,"5641 Indian River Road Virginia Beach, VA  23464 ",40,Contemporary American,$30 and under,Virginia Beach,http://www.foundersinn.com,swan.terrace@foundersinn.com,(757) 366-5777,5.0 out of 5,The Swan Terrace proved to be one of the best sit down dining establishment for a date night in Virginia Beach. From the moment you enter the facility the staff welcomes you and provide the best service.,02/14/2013,http://www.pickgrapevine.com/wantmore6/swan-terrace-founders-inn,swan-terrace-founders-inn
Table 50,http://www.opentable.com/table-50?scpref=111&tab=2,4.3,"309 Market St Roanoke, VA  24011 ",79,Contemporary American,$31 to $50,Roanoke,http://www.table50roanoke.com,restaurant@table50roanoke.com,(540) 904-2350,4.0 out of 5,"The food was very good, with unique spices, sauces, and presentation. Some unusual options (like duck and side items). Service was also great. My only complaint was that the seating on the wall (a giant bench) was not comfortable and was far too low to the table (and I'm 6' tall).",02/14/2013,http://www.pickgrapevine.com/wantmore6/table-50,table-50
Tarrant's Cafe,http://www.opentable.com/tarrants-cafe?scpref=111&tab=2,4.2,"1 West Broad St. Richmond, VA  23220 ",261,American,$30 and under,Richmond,http://www.tarrantscaferva.com,tarrantscafe@gmail.com,(804) 225-0035,4.0 out of 5,"We took a friend to Tarrant's for her birthday and had a very nice experience overall. The only slight disappointment was my entree, the seafood platter, which consisted of a crab cake, broiled fish, scallops and shrimp. It was good, but not great and certainly not what I expected from a $30 entree. Everyone else loved what they ordered. I tried my friend's shrimp and grits and wished that I had ordered it too. Monday nights are half-priced glasses of wine, which was a nice surprise. The service and atmosphere were good and combined with the food made for a very lovely evening for us all.",02/11/2013,http://www.pickgrapevine.com/wantmore6/tarrants-cafe,tarrants-cafe
Tempo,http://www.opentable.com/tempo-charlottesville?scpref=111&tab=2,3.6,"117 5th Street SE Charlottesville, VA  22902 ",15,Contemporary American,$30 and under,Charlottesville,http://www.tempocville.com,tempocville@gmail.com,(434) 244-0217,3.0 out of 5,My wife ordered the Sherwood Farm Angus Cut and really enjoyed it.,02/08/2013,http://www.pickgrapevine.com/wantmore6/tempo-charlottesville,tempo-charlottesville
Ten,http://www.opentable.com/ten?scpref=111&tab=2,4.4,"120 B. East Main Street Charlottesville, VA  22902 ",57,Japanese,$31 to $50,Charlottesville,http://www.ten-sushi.com,zac@ten-sushi.com,(434) 295-6691,3.0 out of 5,Food was good; place was was good and cozy.,02/09/2013,http://www.pickgrapevine.com/wantmore6/ten,ten
Terrapin Restaurant,http://www.opentable.com/terrapin-restaurant?scpref=111&tab=2,4.8,"3102 Holly Rd Suite 514 Virginia Beach, VA  23451 ",82,Contemporary American,$31 to $50,Virginia Beach,http://terrapinvirginiabeach.com/default.aspx,info@terrapinvirginiabeach.com,(757) 321-6688,5.0 out of 5,"My wife and I come here for special occasions because we consider Terrapin the best restaurant in VB. From the friendly greeting to the attentive service, we were treated very well. The wonderful flavors in the food are supported by the healthy, local ingredients. A great place to celebrate.",02/12/2013,http://www.pickgrapevine.com/wantmore6/terrapin-restaurant,terrapin-restaurant
Thirty 7 North Restaurant & Bar,http://www.opentable.com/thirty-7-north-restaurant-and-bar?scpref=111&tab=2,4.3,"2105 W Great Neck Rd Virginia Beach, VA  23451 ",75,American,$30 and under,Virginia Beach,http://thirty7north.com,management@thirty7north.com,(757) 412-0203,5.0 out of 5,"Food, service, and ambiance were all great. Hostess was friendly and efficient. We will return.",02/14/2013,http://www.pickgrapevine.com/wantmore6/thirty-7-north-restaurant-and-bar,thirty-7-north-restaurant-and-bar
