name,url,rating,address,total reviews,cuisine,price,neighborhood,website,email,phone,review rating,review description,review dine date
35 Steaks + Martinis,http://www.opentable.com/35-steaks-and-martinis?scpref=109&tab=2,3.9,"4455 Paradise Road Las Vegas, NV  89169 ",42,Steakhouse,$50 and over,Hard Rock Hotel,http://www.hardrockhotel.com/#/dine/35-steaks-martinis/,groupdining@hrhvegas.com,(702) 693-4092,3.9 / 5,"Really terrific staff...bartenders were great, waitstaff was excellent! Food was perfectly prepared! Delicious!",07/20/2012
Addiction at Rumor Vegas Boutique Resort,http://www.opentable.com/addiction-at-rumor-vegas-boutique-resort?scpref=109&tab=2,3.2,"455 East Harmon Avenue Las Vegas, NV  89147 ",16,Contemporary American,$30 and under,Near the Strip,http://www.rumorvegas.com/addiction/,info@rumorvegas.com,(702) 369-5400,3.2 / 5,"It's amazing Addiction is not more popular. Small but cozy, Addiction is tucked in the corner of Rumor Boutique Hotel's lobby, overlooking the courtyard and pool. You get the feeling of dining in a Palm Springs or Miami resort -- no clanging slot machines or obnoxious music. The menu is mostly made of interesting takes on comfort food, served tapas-style. The service is attentive, relaxed and friendly. And because of its ""hidden"" nature, getting a table is as easy as walking right in.",06/29/2012
Agave - Las Vegas,http://www.opentable.com/agave-las-vegas?scpref=109&tab=2,3.7,"10820 W. Charleston Blvd Las Vegas, NV  89135 ",29,Contemporary Mexican,$30 and under,Summerlin,http://www.agavelasvegas.com,agave@mcrestaurants.com,(702) 214-3500,3.7 / 5,"We frequent Agave often. This trip, friends from Canada were visiting and they were my guests. We had an absolutely delightful lunch - trying several appetizers and sharing them. The guacamole with chiptloes is always my favorite, but for the first time, we tried the fajitas (shrimp and chicken). The best fajitas I ever tasted. Our waiter was Francisco and I hope next trip he will be there. I will ask for him.",07/19/2012
Alizé at the Top of the Palms Casino Resort,http://www.opentable.com/alize-at-the-top-of-the-palms-casino-resort?scpref=109&tab=2,4.4,"4321 W Flamingo Road Las Vegas, NV  89103 ",114,French,$50 and over,The Palms Hotel & Casino,http://www.alizelv.com,info@alizelv.com,(702) 951-7000,4.4 / 5,"Great setting and service. Food was very good as well. Pricey, ideal for a special occassion.",07/12/2012
America Restaurant - NYNY Hotel and Casino,http://www.opentable.com/america-restaurant-nyny-hotel-and-casino?scpref=109&tab=2,3.2,"3790 Las Vegas Blvd South Las Vegas, NV  89109 ",21,American,$30 and under,New York New York Hotel & Casino,http://www.arkvegas.com/restaurants_america.htm,"",(702) 740-6451,3.2 / 5,Horrible service! Food was late on several occassions and the service was horrible!,07/05/2012
Andre's at the Monte Carlo Resort & Casino,http://www.opentable.com/andres-at-the-monte-carlo-resort-and-casino?scpref=109&tab=2,4.5,"3770 Las Vegas Blvd South Las Vegas, NV  89109 ",60,French,$50 and over,Monte Carlo Hotel & Casino,http://www.andrelv.com,infomc@andrelv.com,(702) 798-7151,4.5 / 5,Went to dinner with a group for my birthday. The seared fois was amazing and the stuffed lobster is my favorite entree. Server was very professional. As always Tanya made sure that we were content and well taken care of thru out the night. She continues to go above and beyond every time I done there. There are a lot of options in Vegas but I always continue to take my guest to Andres where I know it will be a memorable experience! Almost forgot... These busser have the best attention to detail that I have ever seen! Thank you to the whole staff!!,07/08/2012
Annie's Gourmet Italian,http://www.opentable.com/annies-gourmet-italian?scpref=109&tab=2,4.0,"1716 W Horizon Ridge Pkwy Suite 100 Henderson, NV  89012",18,Italian,$30 and under,Henderson,http://]www.anniesgourmetitalian.com/,annie@anniesgourmetitalian.com,(702) 254-3663,4 / 5,There were some very odd tasting dishes for an Italian restaurant. Eggplant Parmigiana unusual taste & my sons dish was in a white sauce that was way too creamy.,06/29/2012
Aquaknox,http://www.opentable.com/aqua-knox?scpref=109&tab=2,4.2,"3355 South Las Vegas Blvd. Las Vegas, NV  89109 ",136,Seafood,$31 to $50,The Venetian and Palazzo,http://www.Aquaknox.net,lasvegassales@tavistockerestaurants.com,(702) 414-3772,4.3 / 5,"Service was terrific, Waiter was very friendly - liked him. Food was wonderful. Thank you for our anniversary surprise.",07/16/2012
Artisan Hotel Boutiques’ Mood Restaurant,http://www.opentable.com/artisan-hotel-boutiques-mood-restaurant?scpref=109&tab=2,3.3,"1501 West Sahara Avenue Las Vegas, NV  89102 ",9,American,$30 and under,Near the Strip,http://www.artisanhotel.com,dining@artisanhotel.com,(702) 214-4000,3.3 / 5,"We are locals and love this hotel. We love the bar and the ambiance of the bar. We've wanted to try the restaurant for a long time. Sadly, we won't go back here to eat. I will say that the bread basket was really good.",06/15/2012
Aureole - Las Vegas,http://www.opentable.com/aureole-las-vegas?scpref=109&tab=2,4.1,"3950 Las Vegas Blvd. Las Vegas, NV  89119 ",141,American,$31 to $50,Mandalay Bay Resort,http://www.charliepalmer.com,"",(702) 632-7401,4.1 / 5,"This was a beautiful restaurant with very good service, but because you're pretty much forced into ordering one of their prix fixe menus, you end up spending a huge amount of money. This may be one of the priciest restaurants in Las Vegas and we were not concerned about the price, but it was surprising that there weren't more options to eat less. We were a party of 7 and I didn't hear anyone raving over their food although nobody complained either. This is a true ""dining"" restaurant and as such, they gave you a true fine dining experience. I'm glad I went because I always wanted to try it, and I'm glad I did.",07/20/2012
B and B Ristorante,http://www.opentable.com/b-and-b-ristorante?scpref=109&tab=2,4.3,"3355 Las Vegas Blvd South The Venetian Resort Hotel and Casino Las Vegas, NV  89109",226,Italian,$50 and over,The Venetian and Palazzo,http://www.bandbristorante.com,info@bandbristorante.com,(702) 266-9977,4.3 / 5,"Beautiful restaurant, service was outstanding. We had the 5 course tasting dinner and the food was quite good. It did not blow me away however and for the outrageous prices that we paid for dinner I should have been blown away. Very good but far too expensive considering we ate at other 5 start Las Vegas restaurants on our trip and the prices did not come close to this",07/17/2012
B.B. King's Blues Club - Las Vegas,http://www.opentable.com/bb-kings-blues-club-las-vegas?scpref=109&tab=2,3.9,"3400 Las Vegas Blvd. Las Vegas, NV  89109 ",148,Southern,$30 and under,Las Vegas,http://www.bbkingclubs.com/index.php?page=lvhome,lasvegassales@bbkingclubs.com,(702) 242-5465,3.9 / 5,Great music and service. Food was good.,07/18/2012
Bacio - Tropicana Las Vegas,http://www.opentable.com/bacio-tropicana-las-vegas?scpref=109&tab=2,3.9,"3801 Las Vegas Blvd South Las Vegas, NV  89109 ",97,Italian,$30 and under,The Tropicana,http://www.troplv.com/dining/bacio,pbishop@troplv.com,(702) 739-2222,3.9 / 5,"We had a wonderful dining experience at Bacio. The waitstaff was attentive and helpful without being intrusive. There are some fine selections on the menu at reasonable prices but we decided to go with the fixed price menu. This menu also had great options and all three courses, appetizer, entree and desert were full size portions. The only issue some people may have is some of the tables are open to the concourse, where hotel guests pass by. The noise wasn't bothersome but you do sacrifice privacy. I would summarize our experience as excellent service and food at a reasonable price. We do recommend Bacio and would dine here on future trips to Las Vegas.",07/18/2012
Baja Miguel's - South Point Casino,http://www.opentable.com/baja-miguels-south-point-casino?scpref=109&tab=2,4.1,"9777 Las Vegas Blvd South Las Vegas, NV  89183 ",19,Mexican,$30 and under,South Point Casino,http://www.southpointcasino.com/dining/baja-miguels.php,bajamiguels@southpointcasino.com,(702) 797-8075,4.1 / 5,"As always, generous portions of quality food at generous prices.",07/21/2012
Bar and Lounge Table Reservations - Cosmopolitan,http://www.opentable.com/bar-and-lounge-table-reservations-cosmopolitan?scpref=109&tab=2,5.0,"3708 Las Vegas Blvd South Las Vegas, NV  89109 ",1,Bar / Lounge / Bottle Service,$31 to $50,Cosmopolitan of Las Vegas,http://www.cosmopolitanlasvegas.com/experience/lounges-and-bars.aspx,"",(877) 893-2001,1.5 / 5,This reservation was unnecessary. There was no host and we sat where ever we wanted. It was mid-week during a slow month. You might need a reservation on a busy weekend or holiday.,03/06/2012
Barcelona Tapas & Bar,http://www.opentable.com/barcelona-tapas-and-bar?scpref=109&tab=2,4.0,"10690 Southern Highlands Pkwy Las Vegas, NV  89141 ",8,Spanish,$30 and under,South Las Vegas,http://www.BarcelonaTapas-Bar.com,barcelonatapasbar@hotmail.com,(702) 483-5764,4 / 5,"A great place to experience a variety of dishes, reasonably priced. Good wines.",05/13/2012
The Barrymore - Las Vegas,http://www.opentable.com/the-barrymore-las-vegas?scpref=109&tab=2,4.4,"99 Convention Center Drive Las Vegas, NV  89109 ",112,American,$30 and under,The Strip,http://www.barrymorelv.com,info@barrymorelv.com,(702) 407-5303,4.4 / 5,Great Meal and overall experience off the strip in Vegas. Better value than most strip restaurants.,07/18/2012
Bartolotta Ristorante Di Mare - Wynn Las Vegas,http://www.opentable.com/bartolotta-ristorante-di-mare-wynn-las-vegas?scpref=109&tab=2,4.1,"3131 Las Vegas Boulevard South Las Vegas, NV  89109 ",93,Italian,$50 and over,Wynn Las Vegas and Encore,http://www.wynnlasvegas.com/dining/bartolotta,"",(702) 770-3305,4.1 / 5,Outstanding in every way. We did the tasting menu and it was truly wonderful,07/19/2012
Beach Cafe - Tropicana Las Vegas,http://www.opentable.com/beach-cafe-tropicana-las-vegas?scpref=109&tab=2,4.0,"3801 Las Vegas Blvd South Las Vegas, NV  89109 ",40,"Global, International",$31 to $50,The Tropicana,http://www.nikkibeachlasvegas.com,"",(702) 739-2636,4 / 5,"Very good about having reservations. Staff was friendly and accommodating. Food was so-so. My 12 year old cousin had chicken tenders that were ok. I had the grilled chicken sandwich, and didn't realize it had a chipotle mayo on it. It came on texas toast that was soaking wet from the mayo on both sides, and it didn't have lettuce/tomato/onion like the waiter said it would. They were great about quickly fixing the problem, but the chicken was dry and rubbery. Nice staff, and nice view of the outside grounds, but I wouldn't go back for the food.",07/17/2012
Benihana – LVH – Las Vegas Hotel & Casino,http://www.opentable.com/benihana-lvh-las-vegas-hotel-and-casino?scpref=109&tab=2,4.3,"3000 Paradise Road Las Vegas, NV  89109 ",104,Japanese,$30 and under,LVH – Las Vegas Hotel & Casino,http://www.thelvh.com/Hotel/dining/finedining/benihana,Benihana@THELVH.com,(702) 732-5755,4.3 / 5,Our chef was a lot of fun and very engaging,07/17/2012
Beso Steakhouse - Las Vegas,http://www.opentable.com/beso-steakhouse-las-vegas?scpref=109&tab=2,4.1,"3720 S. Las Vegas Blvd. #260 Las Vegas, NV  89109 ",98,Steakhouse,$50 and over,The Strip,http://besolasvegas.com,beso@besolasvegas.com,(702) 254-2376,4.1 / 5,"Our dinner experience was really great. We saw they ad oysters on the menu but didn't have Oysters Rockefeller, we asked the waiter and he asked the chef and the chef agreed to make them. Well I have to tell yoiu they were probably the best we have ever had. A definate reccommend on any trip to Vegas.",07/21/2012
Billy Bob's Steak House & Saloon,http://www.opentable.com/billy-bobs-steak-house-and-saloon?scpref=109&tab=2,4.5,"5111 Boulder Hwy Las Vegas, NV  89122-6001 ",4,Steakhouse,$30 and under,Las Vegas,http://www.samstownlv.com/dine/billy-bobs-steak-house-and-saloon,lindamccormick@boydgaming.com,(702) 456-7777,4.7 / 5,Billy Bob's is awlays my favorite when visiting Las Vegas! It's a hidden gem with their 24-oz bone-in rib eye steak. The food quantity and quality are great! Also try the double pork chop! And be sure to finish your meal with the foot long eclair dessert!,06/23/2012
Biscayne - Tropicana Las Vegas,http://www.opentable.com/biscayne-tropicana-las-vegas?scpref=109&tab=2,4.3,"3801 Las Vegas Blvd South Las Vegas, NV  89109 ",87,Steak,$31 to $50,The Tropicana,http://www.troplv.com/dining/biscayne,pbishop@troplv.com,(702) 739-2222,4.3 / 5,"Overall, the food and service was very good and we would go back. The steaks were seasoned and cooked nicely. The kobe slider appetizer was very good. The short rib mac & cheese bites were interesting to try and were good, but probably once was enough.",07/21/2012
Blue Ribbon Sushi Bar & Grill - The Cosmopolitan of Las Vegas,http://www.opentable.com/blue-ribbon-sushi-bar-and-grill-the-cosmopolitan-of-las-vegas?scpref=109&tab=2,3.9,"3708 Las Vegas Blvd South Las Vegas, NV  89109 ",113,Asian,$50 and over,Cosmopolitan of Las Vegas,http://www.cosmopolitanlasvegas.com/taste/restaurant-collection/blue-ribbon-sushi-bar-grill.aspx,"",(877) 893-2001,3.9 / 5,"What a great find! We loved the food and the ambience. Particularly noteworthy was the lobster dish, outstanding taste and value. We are going back!",07/19/2012
Bootlegger Bistro,http://www.opentable.com/bootlegger-bistro?scpref=109&tab=2,4.4,"7700 Las Vegas Blvd Las Vegas, NV  89123 ",52,Italian,$30 and under,Near the Strip,http://www.bootleggerlasvegas.com,events@bootleggerlasvegas.com,(702) 736-4939,4.4 / 5,"Great service! Loved the piano player-he could play everything and anything by memory. A few too many screaming brats who could have been isolated by themselves in a place further away from the piano. However, overall a good dining experience based in good cuisine!",07/13/2012
Border Grill - Las Vegas,http://www.opentable.com/border-grill-las-vegas?scpref=109&tab=2,4.0,"3950 Las Vegas Blvd South Las Vegas, NV  89119 ",161,Mexican,$30 and under,Mandalay Bay Resort,http://www.bordergrill.com,"",(702) 632-7403,4 / 5,"We arrived a few minutes prior to our reservation, so while we waited in the bar the hostess graciously set up a table for us on the patio, overlooking the pool. Our waitress explained the specials of the day, and then gave us time to look over the menu. I picked an item that looked appealing; she then advised that the chef had made changes to the dish, both of which were ok for me. When it arrived, I was glad the changes had been made. My boyfriend asked for help with the entree choices, and again the waitress made suggestions - not based on the price, but on what type of meat he liked. Overall, a very satisfying experience. Although there were families with young children on the patio it was not annoying or loud.",06/23/2012
BOTERO – Encore at Wynn Las Vegas,http://www.opentable.com/botero-encore-at-wynn-las-vegas?scpref=109&tab=2,4.4,"3131 Las Vegas Blvd. South Las Vegas, NV  89109 ",67,Steak,$50 and over,Wynn Las Vegas and Encore,http://www.wynnlasvegas.com,dining@wynnlasvegas.com,(702) 770-5310,4.4 / 5,Lovely venue and attentive staff make this worth every penny!,07/15/2012
BOTTLES + BURGERS by Double Helix,http://www.opentable.com/bottles-and-burgers-by-double-helix?scpref=109&tab=2,3.6,"440 S. Rampart at Tivoli Village Las Vegas, NV  89145 ",21,American,$30 and under,Summerlin,http://Tivolivillage.doublehelixwine.com,doublehelixwine@yahoo.com,(702) 735-9463,3.6 / 5,"Really surprised that the hostess actually checked me in. When I walked in she had a bit of attitude and didn't really care what name was on the reservation,as she grabbed menus and walked back without even looking at the computer. Besides that the waiter and bartender were very much on top of things, they made the experience better. loved the milk shakes and the burgers were pretty delicious to, I would recommend for more of a lunch outing rather then dinner.",07/11/2012
Bouchon at The Venetian,http://www.opentable.com/bouchon-at-the-venetian?scpref=109&tab=2,4.2,"3355 Las Vegas Blvd South Las Vegas, NV  89109 ",486,French,$31 to $50,The Venetian and Palazzo,http://www.bouchonbistro.com,"",(702) 414-6200,4.2 / 5,"Had a Friday, 8:15p reservation, were seated right away upon arriving. Nice decore, service was attentive, but had trouble getting timely drink service later in night as restaurant got busier. Was also very loud when restaurant was full, had difficult time having a conversation at our 2 person table. Food was very good, had Veal Chateaubriand (which was very good) and the Gnocchi à la Parisienne (which seemed overly salty, but still good). For dessert the Île Flottante (meringue with vanilla crème anglaise) was terrific. Nice wine list and drink menu. Pricey, but definitely worth going.",07/20/2012
Brand - Monte Carlo,http://www.opentable.com/brand-monte-carlo?scpref=109&tab=2,4.3,"Monte Carlo Hotel &amp; Casino 3770 Las Vegas Blvd. South Las Vegas, NV  89109",63,Steakhouse,$31 to $50,Monte Carlo Hotel & Casino,http://www.lightgroup.com/las-vegas-restaurant-brand/,webvip@lightlv.com,(702) 730-6700,4.2 / 5,"The food was amazing! Our waitress Alex provided excellent customer service, and the rest of the staff was great! Even though it's right off the casino floor, the outside noise didn't bother us and the music wasn't too loud either.",07/13/2012
Broadway Burger Bar and Grill,http://www.opentable.com/broadway-burger-bar-and-grill?scpref=109&tab=2,4.0,"3790 Las Vegas Blvd. South Las Vegas, NV  89109 ",8,Burgers,$30 and under,New York New York Hotel & Casino,http://www.arkvegas.com,"",(702) 740-6540,4 / 5,"Good burgers, but service was okay.",07/09/2012
Buca di Beppo - Excalibur Las Vegas,http://www.opentable.com/buca-di-beppo-excalibur-las-vegas?scpref=109&tab=2,3.8,"3850 Las Vegas Blvd. South Las Vegas, NV  89109 ",36,Italian,$30 and under,Excalibur,http://www.bucadibeppo.com,excalibur@bucainc.com,(702) 795-1010,3.8 / 5,Not impressed with the hostess. No smile and in rush to seat us which was odd because we had such an early reservation there was very few patrons waiting and eating. Our watitress was good overall!,07/05/2012
Buca di Beppo - Las Vegas,http://www.opentable.com/buca-di-beppo-las-vegas?scpref=109&tab=2,4.1,"412 East Flamingo Road Las Vegas, NV  89169 ",74,Italian,$30 and under,Las Vegas,http://www.bucadibeppo.com,lasvegas@bucadibeppo.com,(702) 866-2867,4.1 / 5,"Simply enjoyable... good food, service and friendly staff. It pays to pre-order for scheduled dining party.",07/12/2012
Buca di Beppo - Summerlin,http://www.opentable.com/buca-di-beppo-summerlin?scpref=109&tab=2,4.3,"7690 West Lake Mead Boulevard Las Vegas, NV  89128 ",56,Italian,$30 and under,Summerlin,http://www.bucadibeppo.com,summerlin@bucadibeppo.com,(702) 363-6524,4.3 / 5,"Always a good experience. The staff is accommodating, friendly, and on top of their game. Nice casual atmosphere.",07/08/2012
Canal Street - Orleans Hotel & Casino,http://www.opentable.com/canal-street-orleans-hotel-and-casino?scpref=109&tab=2,4.8,"4500 West Tropicana Avenue Las Vegas, NV  89103 ",9,American,$31 to $50,The Orleans Hotel & Casino,http://www.orleanscasino.com/dining/canal-street,joanmowczan@boydgaming.com,(702) 365-7550,4.8 / 5,My guest and I both had Osso Bucco and it was delicious. Our waitress was very friendly and seemed to know the wine list by heart! We will definitely return.,05/30/2012
Canaletto,http://www.opentable.com/canaletto?scpref=109&tab=2,4.1,"3377 Las Vegas Blvd. Suite 2440 Las Vegas, NV  89109",170,Italian,$31 to $50,The Venetian and Palazzo,http://www.ilfornaio.com,kmendez@ilfo.com,(702) 733-0070,4.1 / 5,"We were recommended to Canaletto because we were going to the Phantom. The waiter was hard to understand, and not seeming Italian in a charming way. My fiancee ordered the duck special, and was informed some time later that they had sold out. He reordered, and when our entrees came we had a tenderloin and a sea bass....on the exact same garnish. Approximately 16 oz of sauteed spinach under both cuts. I usually expect a little more creativity.",07/17/2012
Capital Grille - Las Vegas,http://www.opentable.com/capital-grille-las-vegas?scpref=109&tab=2,4.3,"3200 Las Vegas Blvd South, Suite 3300 Fashion Show Mall Las Vegas, NV  89109",84,Steakhouse,$50 and over,Fashion Show Mall,http://www.thecapitalgrille.com,LasVegas@tcgdine.com,(702) 932-6631,4.4 / 5,Was a very good place to eat. The cost was comparibale to other nice restaurants in the Vegas area. $$,07/18/2012
Carlos 'N Charlie's @ The Flamingo,http://www.opentable.com/carlos-n-charlies-at-the-flamingo?scpref=109&tab=2,3.1,"3555 Las Vegas Boulevard South Las Vegas, NV  89109 ",13,Mexican,$30 and under,The Strip,http://www.carlosandcharlies.com/vegas/index.htm,julie@cncharlies.com,(702) 522-9254,3.1 / 5,"Way too loud and the food was mediocre at best. We were there in the afternoon and seated outside. If you don't mind yelling when having a conversation, this is place for you.",06/16/2012
The Carmel Room - Rampart Casino,http://www.opentable.com/the-carmel-room-rampart-casino?scpref=109&tab=2,4.5,"221 N Rampart Blvd Las Vegas, NV  89145 ",92,Steakhouse,$31 to $50,Summerlin,http://www.rampartcasino.com/carmel.htm,tjanjua@canneryresorts.com,(702) 507-5955,4.5 / 5,Servers were personable and very attentive. Rather pricey restaurant for a local establishment.,07/21/2012
CarneVino Italian Steakhouse - Palazzo Hotel,http://www.opentable.com/carnevino-italian-steakhouse-palazzo-hotel?scpref=109&tab=2,4.3,"3325 Las Vegas Boulevard South Palazzo Hotel and Casino Las Vegas, NV  89109",307,Steakhouse,$50 and over,The Venetian and Palazzo,http://www.carnevino.com,noreply@carnevino.com,(702) 789-4141,4.3 / 5,Best steakhouse restaurant in LV!The bar tenders (Cooper and ??sorry) were amazing! True drink mixologists extrordanaire! They even allowed me the priviledge of sampling a few spirits to educcate my palate such as Buddha's Hand Vodka and Mertelli. Their suggestions for dinner were spot on! The steak tartare is the best in the US. The Colorado lamb chops were pretty amazing!Thank You!!!!!!!!!!!!!!!,07/21/2012
Carve - Eastside Cannery Hotel & Casino,http://www.opentable.com/carve-eastside-cannery-hotel-and-casino?scpref=109&tab=2,4.5,"5255 Boulder Hwy Las Vegas, NV  89122 ",47,Steakhouse,$31 to $50,Las Vegas,http://eastsidecannery.com/index.php?option=com_content&view=article&id=142&Itemid=1089,"",(702) 856-5464,4.5 / 5,"Food was excellent, Prime Rib was exceptional, waiter was outstanding",07/05/2012
Casa di Amore,http://www.opentable.com/casa-di-amore?scpref=109&tab=2,4.5,"2850 East Tropicana Ave Las Vegas, NV  89121 ",108,Italian,$30 and under,Near the Strip,http://www.casadiamore.com,casadiamorelv@gmail.com,(702) 433-4967,4.5 / 5,"Best no frills Italian food in Vegas I've found thus far. Everything was moderately priced, delicious, delicious, delicious (from apps to dessert)and a well priced and complimentary wine list. Service was excellent and well grounded. The Live music is just an atmospheric bonus as Frank Devito kept us in stiches, catered to guest song requests and played classics (you mother can appreciate- a lot of Sinatra). Hands down a great time, and a trip down nostalgic lane.",06/29/2012
Central Michel Richard - Caesars Palace,http://www.opentable.com/central-michel-richard-caesars-palace?scpref=109&tab=2,3.4,"3570 Las Vegas Blvd South Las Vegas, NV  89109 ",26,American,$31 to $50,Caesars Palace,http://www.centrallv.com,reservations@centrallv.com,(702) 650-5921,3.4 / 5,The food was better than average and they had a great selection of draft beers. The restaurant is off to the side of the hotel lobby and made an interesting location to people watch if you sit at the bar.,07/17/2012
Charlie Palmer Steak Las Vegas,http://www.opentable.com/charlie-palmer-steak-las-vegas?scpref=109&tab=2,4.2,"3960 Las Vegas Blvd. South Las Vegas, NV  89119 ",79,Steakhouse,$31 to $50,Four Seasons Hotel,http://www.charliepalmer.com,reservations@charliepalmer.com,(702) 632-5120,4.2 / 5,"The service was outstanding. We went with the cut of the week menu. The asparagus risotto was very bland. The soup, corn chowder with bacon, shrimp, potatoes was awesome! Veal Delmonico was good to great; wife's was stringy, mine was not. Dessert was very good.",07/11/2012
Chart House Restaurant - Golden Nugget - Las Vegas,http://www.opentable.com/chart-house-restaurant-golden-nugget?scpref=109&tab=2,4.4,"129 East Fremont Street Golden Nugget Las Vegas, NV  89101",140,Seafood,$31 to $50,The Golden Nugget Hotel & Casino,http://www.chart-house.com,chlv@ldry.com,(702) 386-8364,4.4 / 5,"I think the server forgot about us after we ordered appetizers. We were done eating the apps before we were asked for our meal order. This was lunchtime. Otherwise, everything was very good.",07/17/2012
China Grill - Las Vegas,http://www.opentable.com/china-grill-las-vegas?scpref=109&tab=2,3.8,"3950 Las Vegas Blvd. South Las Vegas, NV  89119 ",43,Asian,$31 to $50,Mandalay Bay Resort,http://www.chinagrillmgt.com,ustewart@mandalaybay.com,(702) 632-7404,3.8 / 5,Was ready to pass after reading all the negative feedback on open table. But out dinner at the china grill was great. Still delicious. Bannanas in a box is the best thing ever,07/13/2012
