name,url,rating,address,total reviews,cuisine,price,neighborhood,website,email,phone,review rating,review description,review dine date
Koi Restaurant and Lounge,http://www.opentable.com/koi-restaurant-and-lounge?scpref=109&tab=2,4.0,"3667 Las Vegas Blvd. South (Planet Hollywood Resort) Las Vegas, NV  89109",77,Japanese,$31 to $50,Planet Hollywood Resort & Casino,http://www.KoiRestaurant.com,vegas@koirestaurant.com,(702) 454-4555,4 / 5,First time to this location. Wasn't as busy as expected but the service was great. I am lookig forward to bringing more friends and having a great time.,07/19/2012
Kokomos - Mirage,http://www.opentable.com/kokomos-mirage?scpref=109&tab=2,4.0,"Mirage Hotel &amp; Casino 3400 Las Vegas Blvd South Las Vegas, NV  89109",121,Steakhouse,$50 and over,Mirage Hotel & Casino,http://www.mirage.com/restaurants/kokomos.aspx,ccabrera@mirage.com,(866) 339-4566,3.9 / 5,Average food. Average service. Not worth tte money - $ 100 per person with no drinks.,07/19/2012
Kona Grill - Las Vegas,http://www.opentable.com/kona-grill-las-vegas?scpref=109&tab=2,4.0,"750 S. Rampart Boulevard Fashion Village at Boca Park Las Vegas, NV  89145",24,Contemporary American,$30 and under,Summerlin,http://www.konagrill.com,lasvegas@konagrill.com,(702) 547-5552,4 / 5,"no brunch !!!! I reserved with open table based on the sunday brunch promotion that open table advertised. the fact is, kona grill does not offer a sunday brunch !!!",06/24/2012
La Scala,http://www.opentable.com/la-scala-las-vegas?scpref=109&tab=2,4.5,"1020 E Desert Inn Rd. Las Vegas, NV  89109 ",35,Italian,$30 and under,Las Vegas,http://www.lascalarestaurant.net,pampamiallc@hotmail.com,(702) 699-9980,4.5 / 5,We had a group of 6 people and everyone enjoyed the restaurant and the food.,07/16/2012
Lakeside - Wynn Las Vegas,http://www.opentable.com/lakeside-wynn-las-vegas?scpref=109&tab=2,4.2,"3131 Las Vegas Blvd. South Las Vegas, NV  89109 ",52,Seafood,$50 and over,Wynn Las Vegas and Encore,http://www.wynnlasvegas.com,dining@wynnlasvegas.com,(702) 770-3310,4.2 / 5,"This was our first time dining at Lakeside. The ambience, service, and food was amazing.",07/18/2012
Lavo,http://www.opentable.com/lavo?scpref=109&tab=2,4.3,"3325 Las Vegas Boulevard South Las Vegas, NV  89109 ",320,Italian,$31 to $50,The Venetian and Palazzo,http://www.lavolv.com,"",(702) 791-1800,4.3 / 5,"if you come to Las Vegas your ""night out"" should be at LAVO!! Amazing food, amazing service, amazing location!!! Love this place recommend it to everyone!!",07/17/2012
Lawry's The Prime Rib - Las Vegas,http://www.opentable.com/lawrys-the-prime-rib-las-vegas?scpref=109&tab=2,4.6,"4043 Howard Hughes Parkway Las Vegas, NV  89109 ",412,Prime Rib,$31 to $50,Near the Strip,http://www.LawrysOnline.com,LasVegasReservations@LawrysOnline.com,(702) 893-2223,4.6 / 5,"A great place to celebrate a special occasion. The staff were attentive and courteous. The entire meal was scrumptous - the salad, the prime rib, and the veggies. Will recommend to friends and go back again.",07/15/2012
Little Buddha Restaurant Sushi Bar & Lounge,http://www.opentable.com/little-buddha-restaurant-sushi-bar-and-lounge?scpref=109&tab=2,3.8,"4321 West Flamingo  Rd Las Vegas, NV  89103 ",30,Asian,$31 to $50,The Palms Hotel & Casino,http://www.LittleBuddhaLasVegas.com,littlebuddhareservations@palms.com,(702) 942-7778,3.8 / 5,Went for a nice dinner and received bad service. The waiting staff keep stopping by trying to take out plates and the up sale food and drinks. We felt rushed and didn't enjoy our time. Tables with large groups were there before us and after us. Didn't enjoy it.,07/14/2012
Lucio Ristorante,http://www.opentable.com/lucio-ristorante?scpref=109&tab=2,4.0,"5900 W. Flamingo Road Las Vegas, NV  89103 ",22,Italian,$30 and under,Las Vegas,http://www.lucioristorante.com,picozzil@aol.com,(702) 207-1008,4 / 5,"There was a private party going on so that perhaps affected the service but no excuse for putting in the entree order along with the salads which meant both arrived at the same time. Also, when bread brought to table, no butter or oil or cheeese to go with it.",06/10/2012
Lupo by Wolfgang,http://www.opentable.com/lupo-by-wolfgang?scpref=109&tab=2,3.9,"3950 Las Vegas Boulevard, South Las Vegas, NV  89119 ",95,Italian,$31 to $50,Mandalay Bay Resort,http://www.wolfgangpuck.com/restaurants/finedining/lupo/lasvegas/,"",(702) 740-5522,3.9 / 5,Lupo is always terrific. Jonny Pacheco and his staff do it right every time.,07/14/2012
Maggiano's - Las Vegas,http://www.opentable.com/maggianos-las-vegas?scpref=109&tab=2,4.3,"3200 Las Vegas Blvd. South, Fashion Show Mall    Las Vegas, NV  89109 ",413,Italian,$30 and under,Las Vegas,http://www.maggianos.com,lasvegas.information@maggianos.com,(702) 732-2550,4.3 / 5,"We've been to this Maggiano's several times and it's always consistent with the food, service and friendliness. Will be going back again next Sat. and looking forward to another Great meal...",07/21/2012
Mandarin Bar - Mandarin Oriental Las Vegas,http://www.opentable.com/mandarin-bar-mandarin-oriental-las-vegas?scpref=109&tab=2,4.1,"3752 Las Vegas Blvd S Las Vegas, NV  89158 ",34,Bar / Lounge / Bottle Service,$30 and under,The Strip,http://www.mandarinoriental.com/lasvegas/dining/mandarin_bar/,Molas-mandarinbar@mohg.com,(888) 881-9367,4.1 / 5,"Very cool, yummy, exPENsive drinks. I had the Spicy Cucumber cocktail for $18 but loved it and got to enjoy it while facing the best view of the strip. Also had a spice cake cupcake that was awesome to look at and eat. There are very good mocktails too if you're not in the mood for drinking.",07/17/2012
Marche Bacchus,http://www.opentable.com/marche-bacchus?scpref=109&tab=2,4.4,"2620 Regatta Drive Suite 106 Las Vegas, NV  89128",130,French,$30 and under,Summerlin,http://www.marchebacchus.com,nfo@marchebacchus.com,(702) 804-8008,4.4 / 5,"Had a wonderful time. Great food, music, atmosphere. I would recommend this place to many of my friends.",07/04/2012
Marrakech Moroccan Restaurant,http://www.opentable.com/marrakech-moroccan-restaurant?scpref=109&tab=2,4.4,"3900 Paradise Road, Suite Y Las Vegas, NV  89169 ",118,Moroccan,$31 to $50,Near the Strip,http://www.marrakechvegas.com,customerservice@marrakechvegas.com,(702) 737-5611,4.4 / 5,"It was completely dead from 8pm (when we arrived) to 10:30pm when we left on a Friday night...like only 3 other tables in the whole place in 2.5 hours...we wanted to go there to see live entertainment..in 2.5 hours there was about 8 mins. of belly dancing.Food was ok, would def. recommend going across the street to Firefly instead.",07/20/2012
Marssa at Westin Lake Las Vegas Resort & Spa,http://www.opentable.com/marssa-at-westin-lake-las-vegas-resort-and-spa?scpref=109&tab=2,4.4,"101 MonteLago Blvd Henderson, NV  89011 ",17,Asian,$31 to $50,Lake Las Vegas,http://www.starwoodhotels.com/westin/property/dining/index.html?propertyID=3786&language=en_US,"",(702) 567-6125,4.5 / 5,"Fabulous restaurant. Been here many, many times and they never disappoint. Chef Fuji and Kaz continuously serves the bestsushi and the hot food by June is the best. We tried the Opaka paka and it was delicious.Will go back",07/07/2012
Mastro's Ocean Club - Las Vegas,http://www.opentable.com/mastros-ocean-club-las-vegas?scpref=109&tab=2,4.5,"3720 Las Vegas Blvd. South, Suite 244 Las Vegas, NV  89109 ",308,Seafood,$50 and over,The Strip,http://www.mastrosrestaurants.com,lasvegas@mastrosrestaurants.com,(702) 798-7115,4.5 / 5,This was the perfect place to treat my girlfriends for some fine dining!,07/20/2012
Max Brenner  - Las Vegas,http://www.opentable.com/max-brenner-las-vegas?scpref=109&tab=2,4.1,"3500 Las Vegas Blvd Las Vegas, NV  89109 ",125,American,$30 and under,Caesars Palace,http://www.maxbrenner.com,"",(702) 462-8790,4.1 / 5,Great burgers and chocolate fondue.. Service is a bit below average,07/15/2012
McCormick & Schmick's Seafood - Las Vegas,http://www.opentable.com/mccormick-and-schmicks-seafood-las-vegas?scpref=109&tab=2,4.0,"335 Hughes Center Drive Las Vegas, NV  89169 ",142,Seafood,$31 to $50,Near the Strip,http://www.McCormickandSchmicks.com,mslv@ldry.com,(702) 836-9000,4 / 5,The smoke alarm went off when we were there. Food was good.,07/17/2012
Michael Mina - Bellagio,http://www.opentable.com/michael-mina-bellagio?scpref=109&tab=2,4.5,"Bellagio Hotel &amp; Casino 3600 Las Vegas Blvd South Las Vegas, NV  89109",146,American,$50 and over,Bellagio Hotel & Casino,http://www.bellagio.com/michaelmina,jpagani@bellagioresort.com,(702) 693-8199,4.5 / 5,Had the tasting menu. It was excellent. Taste and portion size were perfect,07/12/2012
Michael's - South Point Casino,http://www.opentable.com/michaels-south-point-casino?scpref=109&tab=2,4.8,"9777 Las Vegas Boulevard South Las Vegas, NV  89183 ",59,Continental,$50 and over,South Point Casino,http://www.southpointcasino.com/dining/michaels.php,"",(702) 796-7111,4.9 / 5,"Wonderful restaurant, less than desirable location .. atmosphere a positive PLUS .. and so outrageously expensive that the prices are almost insulting. Anyway ... two small salads to begin our dinner .. $50.00+. Because I was unwilling to secure a night job after our meal, we elected to share an entree. And even though is was my girlfriends birthday, (yes, the restaurant was informed) .. we took a PASS on the desert cart. Best to you ..",07/19/2012
Michoacan Gourmet Mexican Restaurant,http://www.opentable.com/michoacan-gourmet-mexican-restaurant?scpref=109&tab=2,4.4,"7870 W Tropical Pkwy Las Vegas, NV  89149-4568 ",11,Mexican,$30 and under,Summerlin,http://www.michoacanlv.com,compadre@michoacanlv.com,(702) 385-4636,4.2 / 5,"When a restaurant is packed and the service level exceeds expectation, you know you've found a great place... the food was delicious, of course!",07/22/2012
Mint Indian Bistro,http://www.opentable.com/mint-indian-bistro?scpref=109&tab=2,4.0,"730 East Flamingo Road Las Vegas, NV  89119 ",34,Indian,$30 and under,Near the Strip,http://mintbistro.com,"",(702) 894-9334,4 / 5,"My husband and I went here to celebrate our anniversary. From the moment we walked in, we felt we had discovered a hidden gem: tucked away in a non-descript strip mall was this magical restaurant! First of all, the service was impeccable, and every employee we interacted with took the time to wish us a happy anniversary. But the real star was the food; anyone who is passionate about organic food knows that great organic food at a reasonable price can be a challenge to find. I would recommend Mint Indian Bistro to anyone!!",06/30/2012
Mix - Las Vegas,http://www.opentable.com/mix-las-vegas?scpref=109&tab=2,4.1,"3950 Las Vegas Blvd South Las Vegas, NV  89119 ",110,French American,$50 and over,Mandalay Bay Resort,http://www.mandalaybay.com/dining/signature-restaurants/mix.aspx,mix@mandalaybay.com,(702) 632-9500,4.1 / 5,"The food and service were absolutely fantastic, as was the view. Our reservation was at 7, and there was NOONE in there. It did pick up by 8, but it was a little strange, and our voices echoed through the place. The other issue was the expense. It was very, very expensive. I think open table said something like $50/pp. It was more like $100/pp. I have no regrets--the meal truly was fantastic.",06/24/2012
Mizumi - Wynn Las Vegas,http://www.opentable.com/mizumi-wynn-las-vegas?scpref=109&tab=2,4.2,"3131 Las Vegas Boulevard South Las Vegas, NV  89109 ",10,Japanese,$50 and over,Wynn Las Vegas and Encore,"",opentable@wynnlasvegas.com,(702) 770-3320,4.2 / 5,"This restaurant is gorgeous! We had a lovely table beside the waterfall and it was spectacular! Then the food....beautifully presented and delicious, Out waiters were excellent....attending to every detail. This is a special place for very special dinners! Can't wait to go again!",07/13/2012
Mon Ami Gabi - Las Vegas - Main Dining Room,http://www.opentable.com/mon-ami-gabi-las-vegas-main-dining-room?scpref=109&tab=2,4.3,"3655 Las Vegas Blvd. South Las Vegas, NV  89109 ",1322,French,$31 to $50,Paris Hotel and Casino,http://www.monamigabi.com,monamivegasparties@leye.com,(702) 944-4224,4.3 / 5,"Food was fabulous, service excellent a great place to celebrate birthdays",07/21/2012
Morels French Steakhouse & Bistro - Las Vegas,http://www.opentable.com/morels-french-steakhouse-and-bistro?scpref=109&tab=2,3.9,"3325 Las Vegas Boulevard South Las Vegas, NV  89109 ",86,Steakhouse,$31 to $50,The Venetian and Palazzo,http://www.palazzolasvegas.com/morels.aspx,ghales@mcchgroup.com,(702) 607-6333,3.9 / 5,"WE WERE A PARTY OF 5 AND ENJOYED THE COMPANY VERY MUCH, WE ENJOYED SO MUCH WE WENT FOR BREAKFAST THE NEXT MORNING!!! WE WERE STAYING IN THE PALAZZO HOTEL, BEAUTIFUL",07/06/2012
Morton's The Steakhouse - Las Vegas,http://www.opentable.com/mortons-the-steakhouse-las-vegas?scpref=109&tab=2,4.3,"400 East Flamingo Road Las Vegas, NV  89169 ",136,Steak,$50 and over,Near the Strip,http://www.mortons.com,"",(702) 893-0703,4.3 / 5,Party of 4 and everyone enjoyed their dinner,07/14/2012
MOzen - Mandarin Oriental Las Vegas,http://www.opentable.com/mozen-mandarin-oriental?scpref=109&tab=2,4.1,"3752 Las Vegas Blvd S Las Vegas, NV  89158 ",41,Asian,$50 and over,The Strip,http://www.mandarinoriental.com/lasvegas/dining/mozen_bistro/,Molas-mozen@mohg.com,(888) 881-9367,4.1 / 5,"The Bento Box Dinner, a selection of 6 small plates from a very large list of Asian dishes was excellent. The atmosphere is elegant but relaxed and the service excellent. Just what you would expect from a Mandarin Oriental restaurant.",07/05/2012
Mundo Restaurant,http://www.opentable.com/mundo-restaurant?scpref=109&tab=2,4.2,"495 S Grand Central Pkwy Suite A116 Las Vegas, NV  89106 ",177,Mexican,$30 and under,Downtown,http://www.mundolasvegas.com,mundo@mundolasvegas.com,(702) 270-4400,4.2 / 5,Overpriced for Mexican cuisine. Good tasting but not exceptional.,07/20/2012
N9NE Steakhouse Las Vegas,http://www.opentable.com/n9ne-steakhouse-las-vegas?scpref=109&tab=2,4.3,"4321 West Flamingo Road Las Vegas, NV  89103 ",227,Steakhouse,$50 and over,The Palms Hotel & Casino,http://www.n9negroup.com,9steakhouse@9groupvegas.com,(702) 933-9900,4.3 / 5,"Was good, but nothing spectacular as far as Vegas Dining goes. The 'amuse bouche' was tunafish salad on crackers... like I make my 3 year old for snacks. The scallops were enormous and perfectly cooked.",07/21/2012
Nine Fine Irishmen - New York New York,http://www.opentable.com/nine-fine-irishmen-new-york-new-york?scpref=109&tab=2,4.1,"New York New York hotel &amp; Casino 3790 Las Vegas Blvd. South Las Vegas, NV  89109",53,Irish,$31 to $50,New York New York Hotel & Casino,http://www.newyorknewyork.com/restaurants/nine-fine-ir,"",(702) 740-6463,4.1 / 5,"great food and service, have live bands at night, would definetly recomend for couples or groups",06/01/2012
Nobu Las Vegas,http://www.opentable.com/nobu-las-vegas?scpref=109&tab=2,4.4,"Hard Rock Hotel, 4455 Paradise Road Las Vegas, NV  89169 ",244,Japanese,$50 and over,Hard Rock Hotel,http://www.noburestaurants.com/lasvegas,nobulasvegas@earthlink.net,(702) 693-5090,4.4 / 5,Server was funny and attentive.Food was amahzing- a little on the oversalted end but fish was Fresh and everything was great tasting.Be prepared to spend quite a bit for small portions.,07/16/2012
NOVE Italiano,http://www.opentable.com/nove-italiano?scpref=109&tab=2,4.0,"Palms Casino Resort 4321 W. Flamingo Rd. Palms Hotel Las Vegas, NV  89103",125,Italian,$31 to $50,The Palms Hotel & Casino,http://www.noveitaliano.net,nove@9groupvegas.com,(702) 942-6800,4.1 / 5,"My filet was well-done when I had requested medium so I sent it back since I'm not paying $55 for something I didn't order. The worst part is the fact that they came back and told me that the chef said it was actually cooked to a perfect medium so the lighting must have been bad in the dining area. I don't think I've ever felt so insulted in a restaurant in my life. On the plus side they did bring me a new steak that, of course, was cooked medium-rare but at that point my date was half done eating her bland chicken dish and we had a show to go to...",07/14/2012
Onda - Mirage,http://www.opentable.com/onda-mirage?scpref=109&tab=2,3.8,"Mirage Hotel &amp; Casino 3400 Las Vegas Blvd South Las Vegas, NV  89109",86,Italian,$31 to $50,Mirage Hotel & Casino,http://www.mirage.com/restaurants/onda-ristorante.aspx,kmadsen@mirage.com,(866) 339-4566,3.7 / 5,The pasta tatsted like rubber and the bacon was hard to chew. and the sauce for the bread was to hard to eat. the menu was not in englsih so I had no real idea what i was ordering.,07/14/2012
Opa Restaurant,http://www.opentable.com/opa-restaurant?scpref=109&tab=2,4.9,"2550 S. Rainbow Blvd Las Vegas, NV  89146 ",9,Greek,$30 and under,The Strip,http://www.opalasvegas.com,oparestaurant@aol.com,(702) 876-3737,4.9 / 5,"Good Greek food in Las Vegas has been difficult find, but this is one with authentic ambiance and food. The adorable waitress was efficient, knowledgable and willing to make suggestions.Our guest had never eaten Greek food before, so the sampler was a great choice. It consisted of dolmades, roast leg of lamb, meatballs, mousaka, gigantes, potatoes and vegetables. A great way to experience tastes of Greek food. Other foods sampled included flaming Saganaki, Greek salad, vegetarian combo, and grilled chicken breast served with lemoned potatoes and vegetables.A very nice meal was enjoyed by all. I believe that there is music played on certain nights, but the weeknight we were there there was no music, thus it was a nice quiet dinner.",06/20/2012
Opus Too,http://www.opentable.com/opus-too?scpref=109&tab=2,4.2,"2350 Corporate Circle, 2nd Floor Henderson, NV  89074 ",24,"Global, International",$30 and under,Henderson,http://www.opustoo.com,opustoo@aii.edu,(702) 992-8500,4.2 / 5,"Would help if the wait staff speak louder when the music is up.Uncovering of plates not coordinated and one of the 5 meals was not hot. All in my party like coming; of course we like the price, too. Staff missed offering coffee with dessert. We take into account that everyone is learning....we'll be back!",07/17/2012
Origin India Las Vegas,http://www.opentable.com/rest_profile.aspx?rid=81097&scpref=109&tab=2,4.5,"4480 Paradise Rd. Las Vegas, NV  89169 ",12,Indian,$30 and under,Las Vegas,http://www.originindiarestaurant.com,info@originindiarestaurant.com,(702) 734-6342,4.5 / 5,"I am a huge fan of Indian food. I have eaten at some of the top rated Indian restaurants in NYC and London. Origins is now at the top of my list. There were three of us and we each ordered something different. Each dishes flavors were so unique. Lamb, chicken and fish were each done perfectly. The fish melted in your mouth. The lamb was succulent and the chicken divine. Our waiter, Abel, provided us with superb service and recommendations.The next time I am back in Las Vegas I am going here the first night so that I can go the second night too. It is that good.",04/12/2012
Oscar's Steakhouse - Las Vegas,http://www.opentable.com/oscars-steakhouse-las-vegas?scpref=109&tab=2,4.2,"1 S. Main St Las Vegas, NV  89101 ",277,Steakhouse,$50 and over,Downtown,http://oscarslv.com,oscars@playlv.com,(702) 386-7227,4.2 / 5,"Just outstanding! Celebrated my husband's special birthday there and made a whole ""mob"" theme. Visited the mob museum and then dinner at Oscar's Steakhouse. The dinner was the icing on the cake. Good menu choices and great food. Our waiter and bus person were wonderful and everyone was very attentive including the broads. Had a great view of Fremont Street which added to the fun. We will be back!",07/21/2012
Otto Las Vegas,http://www.opentable.com/otto-las-vegas?scpref=109&tab=2,4.1,"3355 Las Vegas Blvd South The Venetian Resort Hotel Casino Las Vegas, NV  89109",121,Italian,$31 to $50,The Venetian and Palazzo,http://www.ottopizzeria.com/VEGAS/home.cfm,info@ottopizzeria-lv.com,(702) 677-3390,4.1 / 5,"Fabulous atmosphere, food was delicious and service was superb!",07/18/2012
Overlook Grill - The Cosmopolitan of Las Vegas,http://www.opentable.com/overlook-grill-the-cosmopolitan-of-las-vegas?scpref=109&tab=2,3.6,"3708 Las Vegas Blvd South Las Vegas, NV  89109 ",14,American,$30 and under,Cosmopolitan of Las Vegas,http://www.cosmopolitanlasvegas.com/taste/restaurant-collection/over-look-grill.aspx,"",(877) 893-2003,3.6 / 5,We had a great lunch and there were 13 of us. Manager and server did a great job,06/29/2012
Oyster Bay Seafood and Wine Bar,http://www.opentable.com/oyster-bay-seafood-and-wine-bar?scpref=109&tab=2,3.2,"3663 Las Vegas Blvd South Suite 560 Las Vegas, NV  89109",15,Seafood,$30 and under,Planet Hollywood Resort & Casino,"",oysterbayseafood@yahoo.com,(702) 794-2929,3.2 / 5,Nice place with decent selection of seafood and pastas.,05/19/2012
Palm Restaurant - Las Vegas,http://www.opentable.com/palm-restaurant-las-vegas?scpref=109&tab=2,4.5,"3500 Las Vegas Blvd. South Las Vegas, NV  89109 ",367,Steakhouse,$31 to $50,Caesars Palace,http://www.thepalm.com/Las-Vegas,lclose@thepalm.com,(702) 732-7256,4.5 / 5,"I have dined at The Palm in Dallas once a week for years and several other cities when out of town it is my favorite restaurant. That said the Palm in Las Vegas is the best. They got me a corner booth as requested and our server recommended a great bottle of wine which was very good, then my wife and I split the tomatoes and mozzarella which was very good and larger than I have had. My wife ordered the swordfish and our waiter recommended it blackened and she loved it. I ordered the filet medium rare and it was perfect. I had the half and half as a side and the onion strings were crispy and the cottage fries which my mother swears by were delicious. We skipped dessert because we were headed to Garth Brooks. Outstanding cant wait to return.",07/21/2012
Pampas Las Vegas,http://www.opentable.com/pampas-las-vegas?scpref=109&tab=2,3.5,"3663 Las Vegas Blvd South #610 Las Vegas, NV  89109 ",72,Brazilian Steakhouse,$30 and under,Planet Hollywood Resort & Casino,http://www.pampasusa.com,pampaslasvegas@pampasusa.com,(702) 737-4748,3.6 / 5,Having been to a Brazilian style restaurant before I had very high hopes. My wife had never been to one. She was very wow'd with the amount of food and just how good it was. Awesome choices of food and the service was just right.,07/15/2012
Pamplemousse Le Restaurant,http://www.opentable.com/pamplemousse-le-restaurant?scpref=109&tab=2,4.3,"400 E. Sahara Avenue Las Vegas, NV  89104 ",42,French,$31 to $50,Near the Strip,http://www.pamplemousserestaurant.com,pamplemousse.lv@hotmail.com,(702) 733-2066,4.3 / 5,This is one of my favorite restaurants in Las Vegas. The food is wonderful and the waiters are friendly with great personalities! The vibe is calm and cozy. Great for date nights.,07/13/2012
Panevino Ristorante,http://www.opentable.com/panevino-ristorante?scpref=109&tab=2,4.6,"246 Via Antonia Ave Las Vegas, NV  89119-3527 ",36,Italian,$31 to $50,South Las Vegas,http://www.panevinolasvegas.com,mark@panevinolasvegas.com,(702) 222-2400,4.6 / 5,Awesome experience..... well recommended to everyone!! You will definitely love it as much as my husband and I did.,07/20/2012
PBR Rock Bar & Grill,http://www.opentable.com/pbr-rock-bar-and-grill?scpref=109&tab=2,3.9,"3663 Las Vegas Blvd S. #730 Las Vegas, NV  89109 ",16,American,$30 and under,Planet Hollywood Resort & Casino,http://www.pbrrockbar.com/,"",(702) 750-1685,3.9 / 5,"I work as a concierge at the Green Valley Ranch Resort in Henderson, NV (20 minutes from the Las Vegas ""Strip""). I use Open Table to make restaurant reservations on a pretty consistant basis. I use my point redempion checks to experience different dining locations so I may make recommendations to my guests. I made reservations through Open Table for 5:30pm on July 8th at PBR Bar & Grill for my girlfriend and myself. It's a casual place and the service and food was fine but when I wanted to pay with a $50 Open Table check I was told (by my server and the manager)it was not accepted there. It was my understanding that those checks are good at ANY participating restaurants. Is there any reason why this happened? Thank you.",07/08/2012
Petra Greek Taverna,http://www.opentable.com/petra-greek-taverna?scpref=109&tab=2,4.1,"440 S Rampart Blvd #180 Las Vegas, NV  89145",51,Greek,$30 and under,Summerlin,http://www.petragreektaverna.com/,info@petrataverna.com,(702) 534-0200,4.1 / 5,Very good value. Not a large selection menu but good food at fair prices.,07/20/2012
Picasso - Bellagio,http://www.opentable.com/picasso-bellagio?scpref=109&tab=2,4.6,"3600 Las Vegas Blvd S Las Vegas, NV  89109 ",170,Contemporary French,$50 and over,Bellagio Hotel & Casino,http://www.bellagio.com/picasso,kmoloney@bellagioresort.com,(702) 693-8105,4.6 / 5,The food and service was fabulous! First class service!,07/02/2012
Pinot Brasserie,http://www.opentable.com/pinot-brasserie?scpref=109&tab=2,4.3,"3355 Las Vegas Blvd. So. Las Vegas, NV  89113 ",48,French,$31 to $50,The Venetian and Palazzo,http://www.patinagroup.com/pinotBrasserie,lasvegas@patinagroup.com,(702) 414-8888,4.2 / 5,"This was our second visit to Pinot Brasserie and we were extremely disappointed in the food and the assist staff. The waitress, herself was very personable and was well trained. She was not supported in any way by the secondary staff, who were abrupt in placing food, had a very bothered attitude toward us. They had to be asked to place knives and forks on the table, the appeared only once and never returned. The restaurant secondary staff were undertrained and need instruction in how to approach and serve diners. The food was average, the chicken was tasteless and not well seasoned, the steak was average, the creamed spinach was also average and was just the usual vegetable. When we return to Las Vegas we will not be returning.",07/19/2012
