name,url,rating,address,total reviews,cuisine,price,neighborhood,website,email,phone,review rating,review description,review dine date
China Poblano - The Cosmopolitan of Las Vegas,http://www.opentable.com/china-poblano-the-cosmopolitan-of-las-vegas?scpref=109&tab=2,3.9,"3708 Las Vegas Blvd South Las Vegas, NV  89109 ",147,Chinese,$30 and under,Cosmopolitan of Las Vegas,http://www.chinapoblano.com,info@chinapoblano.com,(877) 893-2001,3.9 / 5,Had a few good dishes but most of them were disappointing. There was a noodle dish that has mushrooms and bok choy in it that tasted only like vinegar. The hot and sour soup was also all vinegar and no spice. The chips did not seem fresh and the salsa was probably from a jar. The chicken soup (caldo something) was very good. If I go again I'll stick with that and maybe a few tacos.,07/17/2012
Cili,http://www.opentable.com/cili?scpref=109&tab=2,4.8,"5160 Las Vegas Blvd., South Las Vegas, NV  89109 ",14,American,$31 to $50,Bali Hai Golf Club,http://www.cili.com,webmaster@waltersgolf.com,(702) 856-1000,4.7 / 5,This is the best lobster salad on the planet....a lovely view of the golf course too! Our waiter was most attentive! If you are looking for a great place for the ladies to lunch this is it!,07/16/2012
Circo - Bellagio,http://www.opentable.com/circo-bellagio?scpref=109&tab=2,4.3,"Bellagio Hotel &amp; Casino 3600 Las Vegas Blvd South Las Vegas, NV  89109",177,Italian,$31 to $50,Bellagio Hotel & Casino,http://www.bellagio.com/circo,fforlini@bellagioresort.com,(702) 693-8150,4.4 / 5,"My first time there,and it met my expectations.I will definitely go back for other special occasions.",07/15/2012
Comme Ca - The Cosmopolitan of Las Vegas,http://www.opentable.com/comme-ca-the-cosmopolitan-of-las-vegas?scpref=109&tab=2,3.8,"3708 Las Vegas Blvd South Las Vegas, NV  89109 ",169,French,$31 to $50,Cosmopolitan of Las Vegas,http://www.cosmopolitanlasvegas.com/taste/restaurant-collection/comme-ca.aspx,"",(702) 698-7910,3.8 / 5,"The Lobster Thermidor was masterful. A real treat. Other items were good, but the Lobster is what will bring me back. Great views, friendly service.",07/17/2012
Cortez Room - Gold Coast Hotel & Casino,http://www.opentable.com/cortez-room-gold-coast-hotel-and-casino?scpref=109&tab=2,3.3,"4000 West Flamingo Road Las Vegas, NV  89103 ",7,Steakhouse,$30 and under,Gold Coast Hotel & Casino,http://www.goldcoastcasino.com/dining/cortez-room,"",(800) 331-5334,3.3 / 5,should not put family with loud kids near other tables,06/25/2012
The Country Club - Wynn Las Vegas,http://www.opentable.com/the-country-club-wynn-las-vegas?scpref=109&tab=2,4.7,"3131 Las Vegas Boulevard South Las Vegas, NV  89109 ",43,Steakhouse,$31 to $50,Wynn Las Vegas and Encore,"",opentable@wynnlasvegas.com,(702) 770-3315,4.7 / 5,This place is the best kept secret in LV!,07/19/2012
CUT at The Palazzo Las Vegas,http://www.opentable.com/cut-at-the-palazzo-las-vegas?scpref=109&tab=2,4.5,"3325 Las Vegas Boulevard South Las Vegas, NV  89109 ",326,Steakhouse,$50 and over,The Venetian and Palazzo,http://www.wolfgangpuck.com/restaurants/finedining/cut/lasvegas/,"",(702) 607-6300,4.5 / 5,"The Cut has definitely made my top 3 as far as restsurants and steaks go. Overall, I couldn't rank this place anything but an A+. They start off by bringing you an ipad with information and a slideshow of cocktails you could choose from. We then ordered their crab and shrimp cocktail plate for appetizer, which is incredible. For the main course, my boyfriend got the trio of steaks which included the 3 different kinds of kobe... AMAZING. each one melted in your mouth. I got the Indian spiced short ribs, which had to have neen one of my all time best short rib plates. We got their fries and mushrooms on the side. Also both outstanding. For dessert we got their banana cream pie... nothing else compares. You MUST get this. Will go back!!!!",07/20/2012
D.O.C.G. - The Cosmopolitan of Las Vegas,http://www.opentable.com/docg-the-cosmopolitan-of-las-vegas?scpref=109&tab=2,3.9,"3708 Las Vegas Blvd South Las Vegas, NV  89109 ",144,Italian,$30 and under,Cosmopolitan of Las Vegas,http://www.cosmopolitanlasvegas.com/pdf/menu/DOCG0512.pdf,"",(702) 698-7920,3.9 / 5,"This is one of my favorite Italian restaurants. Everything is the freshest most delicious fare. Imaginative and very varied menu. The food is simply amazing here no matter what you order. Scott Conant does it again! The only drawback is the noise level which is a big factor if you want to engage in conversation. It borders on ear splitting at times when the place is packed, which is most of the time.",07/19/2012
Dal Toro,http://www.opentable.com/dal-toro?scpref=109&tab=2,3.8,"3325 Las Vegas Blvd South Las Vegas, NV  89109 ",47,Italian,$31 to $50,The Venetian and Palazzo,http://www.daltoro.com,reservations@daltoro.com,(702) 437-9800,3.8 / 5,"Always have great service and quality food. We like the added bonus of viewing the new cars added to the showroom each time we go, both classic and exotic.They are very accommodating about requests and if the weather is right you can view the fireworks from the TI hotel across the street. Inside, there are great booths and tables and even a private wine room that seats up to 10. Always a fun place.",07/16/2012
Del Frisco's Double Eagle Steak House - Las Vegas,http://www.opentable.com/del-friscos-double-eagle-steak-house-las-vegas?scpref=109&tab=2,4.7,"3925 Paradise Rd. Las Vegas, NV  89169 ",270,Steakhouse,$50 and over,Near the Strip,http://delfriscos.com ,"",(702) 796-0063,4.7 / 5,"good food, over eager servers made us want to eat and run.",07/19/2012
Delmonico Steakhouse,http://www.opentable.com/delmonico-steakhouse?scpref=109&tab=2,4.6,"The Venetian Resort Hotel &amp; Casino 3355 Las Vegas Blvd, South Las Vegas, NV  89109",532,Steakhouse,$50 and over,The Venetian and Palazzo,http://www.emerils.com,"",(702) 414-3737,4.6 / 5,"Remarkable experience from the servcice ,food and all overall.I've dined here 3 times, once with a group of friends,I've brought my young children several years ago who are now teenagers and remember it and Saturday ,I spent a romantic evening with my spouse.",07/21/2012
Diablo’s Cantina - Monte Carlo,http://www.opentable.com/diablos-cantina-monte-carlo?scpref=109&tab=2,3.4,"Monte Carlo Hotel &amp; Casino 3770 Las Vegas Blvd. South Las Vegas, NV  89109",40,Mexican,$30 and under,Monte Carlo Hotel & Casino,http://www.lightgroup.com/las-vegas-restaurant-diablos/,diabloscantina@montecarlo.com,(702) 730-7979,3.4 / 5,"Worst service EVER! I don't think I've had such a distant wistress. For example when we asked for water and we finally got it, it was set to the far edge of the table, it was almost wierd. I ordered a strawberry margarita and it had zero alcohol in it and I sure don't remember ordering a virgin one. Complete waste of time and money!!!!!",07/13/2012
DJT,http://www.opentable.com/djt?scpref=109&tab=2,3.9,"2000 Fashion Show Drive Las Vegas, NV  89109 ",18,Contemporary American,$31 to $50,Trump International Hotel,http://trumplasvegashotel.com,djtlv@trumphotels.com,(702) 476-7358,3.9 / 5,Was not particularly impressed. Menu was limited. They were out of the filet minion and we had to settle for the rib eye (which was excellent). Pasta was average. But the salmon was great as well. They have dumped the fixed price menu. So likely to be more expensive now. Overall given the choices available in Vegas I would not say there is anything standout about this place.,07/04/2012
Don Vito's Italian - South Point Casino,http://www.opentable.com/don-vitos-italian-south-point-casino?scpref=109&tab=2,4.3,"9777 Las Vegas Boulevard South Las Vegas, NV  89183 ",120,Italian,$31 to $50,South Point Casino,http://www.southpointcasino.com/dining/don-vitos.php,"",(702) 797-8075,4.3 / 5,I've Ben multiple times but this last time ruined it for me.,07/19/2012
Eiffel Tower,http://www.opentable.com/eiffel-tower?scpref=109&tab=2,4.5,"3655 Las Vegas Blvd. South Las Vegas, NV  89109 ",623,French,$50 and over,Paris Hotel and Casino,http://www.eiffeltowerrestaurant.com,eiffeltower@leye.com,(702) 948-6937,4.5 / 5,"I recently took my daughter to Las Vegas for the first time. I wanted to take her for a special dinner on our last night there, a friend recommended the Eiffel Tower Restaurant. The view was incredible!! The food was first class. I will recommend it to everyone I talk too.",07/21/2012
El Segundo Sol,http://www.opentable.com/el-segundo-sol?scpref=109&tab=2,3.7,"3200 Las Vegas Blvd South Las Vegas, NV  89109 ",50,Mexican,$30 and under,Fashion Show Mall,http://www.elsegundosol.com,leye149@leye.com,(702) 258-1211,3.8 / 5,"The food was definitely a notch above your average Mexican restaurant. The grilled vegetables were especially good, and so was the tableside guacamole. Those who got the pulled pork said pineapple was listed as a main ingredient on the menu, but was not detected in the dish. If you're there in the hot weather, there are misters which help to keep you cool.",06/16/2012
Emeril's New Orleans Fish House,http://www.opentable.com/emerils-new-orleans-fish-house?scpref=109&tab=2,4.0,"MGM Grand Hotel 3799 Las Vegas Blvd, South Las Vegas, NV  89109",226,Seafood,$31 to $50,MGM Grand Hotel & Casino,http://www.emerils.com/emerilsnofishhouse,"",(702) 891-7374,4 / 5,It was great bam the food was great,07/15/2012
ENVY The Steakhouse at The Renaissance Las Vegas,http://www.opentable.com/envy-the-steakhouse-at-the-renaissance-las-vegas?scpref=109&tab=2,4.3,"3400 Paradise Rd. Las Vegas, NV  89169 ",90,Steakhouse,$31 to $50,The Renaissance,http://www.envysteakhouse.com,ryan.wolf@interstatehotels.com,(702) 784-5700,4.3 / 5,Third time here and each time service and food quality have gone down,07/19/2012
Ferraro's Restaurant & Wine Bar,http://www.opentable.com/ferraros-restaurant-and-wine-bar?scpref=109&tab=2,4.4,"4480 Paradise Rd, Ste 100 Las Vegas, NV  89169 ",118,Italian,$31 to $50,Near the Strip,http://www.ferraroslasvegas.com,ferraros@ferraroslasvegas.com,(702) 364-5300,4.4 / 5,"Been going to Ferraro's since before it relocated. We've never ever had a bad meal or bad experience of any kind. It was our 32nd Anniversary and we chose to celebrate it here. That day's Chef's special included Dover Sole, a favorite of Diane's. In fact, she had been hoping it would be on the menu. Done perfectly and deboned at the table. I ordered the 8 oz filet which was cooked exactly as I ordered. And ... it really was Prime quality. I commented that it was either the best or second best I had in these past several years. We shared a half bottle of Cabernet with dinner. To top it off, they brought us an excellent slice of Tiramisu, unrequested and at no charge, for us to share for our Anniversary.All in all, the evening was splendid",07/11/2012
Fiamma - MGM Grand,http://www.opentable.com/fiamma-mgm-grand?scpref=109&tab=2,4.1,"MGM Grand Hotel &amp; Casino 3799 Las Vegas Blvd South Las Vegas, NV  89109",128,Italian,$30 and under,MGM Grand Hotel & Casino,http://www.mgmgrand.com/restaurants/fiamma-italian-restaurant-bar.aspx,"",(702) 891-7600,4.1 / 5,"Bad service, bad food, not worth it.",07/10/2012
Fin - Mirage,http://www.opentable.com/fin-mirage?scpref=109&tab=2,4.0,"Mirage Hotel &amp; Casino 3400 Las Vegas Blvd South Las Vegas, NV  89109",31,Chinese,$31 to $50,Mirage Hotel & Casino,http://www.mirage.com/restaurants/fin.aspx,cshin@mirage.com,(702) 791-7353,4 / 5,I went to dinner on a Saturday night with a friend. We were seated promptly but our waiter didn't come until we flagged down someone. He let us know he couldn't find our waiter but would take our order and give it to her once she was found. The manager came to our table to apologize and picked up our soups. Two different waiters tried to take my wine glass before I ordered any. The food was good but not worth sitting through the sub par service. I don't think I'll be going back.,07/14/2012
Firefly on Paradise,http://www.opentable.com/firefly-on-paradise?scpref=109&tab=2,4.4,"3900 Paradise Rd, Suite A Las Vegas, NV  89109 ",125,Tapas / Small Plates,$30 and under,Near the Strip,http://www.fireflylv.com,john@fireflylv.com,(702) 369-3971,4.4 / 5,"Excellent tapas, sangria and ambience. Firefly is an great spot for couples and large groups. Plates are infer 10$ and the sangria and mojitos are wonderful! It is located off-strip about a mile from Bally's. We were there with another couple. Check was about 125$ for the table. The Ambience will remind you of the great Cuban cafes of Miami or Tampa. Bottom line - the tapas and sangria were as good as those I enjoyed in Barcelona. 'Nuff said.",07/19/2012
Firefly Tapas Kitchen & Bar Henderson,http://www.opentable.com/firefly-tapas-kitchen-and-bar-henderson?scpref=109&tab=2,4.4,"11261 S Eastern Ave Henderson, NV  89052 ",45,Tapas / Small Plates,$30 and under,Henderson,http://www.fireflylv.com,"",(702) 778-1400,4.4 / 5,Enjoyed tasting different smaller things.,06/14/2012
Firefly Tapas Kitchen & Bar West Sahara,http://www.opentable.com/firefly-tapas-kitchen-and-bar-west-sahara?scpref=109&tab=2,4.4,"9560 W Sahara Ave Las Vegas, NV  89117 ",65,Tapas / Small Plates,$30 and under,Summerlin,http://www.fireflylv.com,dan@fireflylv.com,(702) 834-3814,4.5 / 5,"We come here every time we are in Vegas. If you love Tapas, you will have a lot of fun with the variety of choices. The Sangria is tasty as well. Vibrant atmosphere and we have always had great service.",07/17/2012
First Food & Bar,http://www.opentable.com/first-food-and-bar?scpref=109&tab=2,3.7,"3327 Las Vegas Blvd South Las Vegas, NV  89109 ",56,Contemporary American,$30 and under,The Venetian and Palazzo,http://www.firstfoodandbar.com,"",(702) 607-3478,3.7 / 5,Rachel was great and kept checking in on us.,06/24/2012
Fix - Bellagio,http://www.opentable.com/fix-bellagio?scpref=109&tab=2,4.0,"3600 Las Vegas Blvd S Las Vegas, NV  89109 ",59,Contemporary American,$31 to $50,Bellagio Hotel & Casino,http://www.bellagio.com/fix,apittard@lightlv.com,(702) 693-8400,4 / 5,This was one of my top five (5) meals. I was with my two nephews who thought the food was great.,06/25/2012
Flame Steakhouse - El Cortez Hotel & Casino,http://www.opentable.com/flame-steakhouse-el-cortez-hotel-and-casino?scpref=109&tab=2,4.3,"600 East Fremont Las Vegas, NV  89101 ",77,Steakhouse,$31 to $50,Downtown,http://www.ecvegas.com/dining.php,"",(702) 385-5200,4.3 / 5,Love the quiet and no children.,07/14/2012
Fleming's Prime Steakhouse & Wine Bar - Las Vegas,http://www.opentable.com/flemings-prime-steakhouse-and-wine-bar-las-vegas?scpref=109&tab=2,4.4,"8721 West Charleston Blvd. Las Vegas, NV  89117 ",43,Steak,$31 to $50,Summerlin,http://www.flemingssteakhouse.com/Summerlin,summerlin@flemingssteakhouse.com,(702) 838-4774,4.5 / 5,They were very accommodating when one of us wanted to have an entree prepared like one of their appetizers -- i.e. sliced filet with shiitake risotto rather than whole filet with potatoes. The steaks themselves were good but not outstanding. Las Vegas has so many steakhouses that it's hard to compete.,07/20/2012
Fleur by Hubert Keller - Las Vegas,http://www.opentable.com/fleur-by-hubert-keller-las-vegas?scpref=109&tab=2,4.1,"3950 Las Vegas Blvd Las Vegas, NV  89119 ",114,Tapas / Small Plates,$50 and over,Mandalay Bay Resort,http://mandalaybay.com/dining/fleurdelys.aspx,"",(702) 632-9400,4.1 / 5,too dark to read the menus. Dishes were hit or miss.,07/21/2012
Gallagher's Steakhouse,http://www.opentable.com/gallaghers-steakhouse-las-vegas?scpref=109&tab=2,4.2,"3790 Las Vegas Blvd. South Las Vegas, NV  89109 ",233,Steakhouse,$50 and over,New York New York Hotel & Casino,http://www.arkvegas.com,brisao@arkvegas.com,(702) 740-6450,4.2 / 5,"The ribeye was ok. It was cooked perfect to rare, but lacked any real flavor, also the marbling was mainly tissue.",07/20/2012
Garden of the Dragon - LVH – Las Vegas Hotel & Casino,http://www.opentable.com/garden-of-the-dragon-lvh-las-vegas-hotel-and-casino?scpref=109&tab=2,3.0,"3000 Paradise Road Las Vegas, NV  89109 ",1,Chinese,$31 to $50,LVH – Las Vegas Hotel & Casino,http://www.thelvh.com/Hotel/dining/finedining/dragon,GardenoftheDragon@thelvh.com,(702) 732-5755,3 / 5,"clicked on 5 stars but won not take. the staff is always friendly, maitr d is very nice and food great, service is fast or leisure",03/23/2012
Garduno's,http://www.opentable.com/gardunos?scpref=109&tab=2,3.6,"4321 W. Flamingo Rd. Las Vegas, NV  89103 ",48,Mexican,$30 and under,The Palms Hotel & Casino,http://www.palms.com/eat_drink_2_3.php,"",(702) 942-7777 x6294,3.6 / 5,Food was good and the back half of the restaurant looks out over the pool.,07/20/2012
Garfield's,http://www.opentable.com/garfields?scpref=109&tab=2,4.0,"2620 Regatta Drive Las Vegas, NV  89128 ",34,American,$30 and under,Las Vegas,http://garfieldslasvegas.com/,garfieldsrestaurant@lakesuites.com,(702) 925-8333,4 / 5,"Every time we've been to Garfield's, the food has been outstanding. Incredible flavors and beautiful presentation. We love being able to sit outside and enjoy a view that makes you feel like you're anywhere but Las Vegas. The quiet, unhurried atmosphere is perfect.",07/06/2012
Giada's Italian Cucina,http://www.opentable.com/giadas-italian-cucina?scpref=109&tab=2,4.0,"2540 Anthem Village Drive #100 Henderson, NV  89052",13,Italian,$30 and under,Henderson,http://www.giadasitaliancucina.com/,daniel@giadasitaliancucina.com,(702) 462-9830,4 / 5,"Finding a good restaurant not affliated with the ""Las Vegas Strip"" is wonderful. It was such a pleasure to dine at Giada's. Warm friendly servers an attentive owner and a great meal all added up to a very nice experience. We will return.",07/06/2012
Golden Steer Steakhouse,http://www.opentable.com/golden-steer-steakhouse?scpref=109&tab=2,4.1,"308 West Sahra Las Vegas, NV  89102 ",122,Steakhouse,$31 to $50,Near the Strip,http://www.goldensteersteakhouselv.com,goldensteerlv@yahoo.com,(702) 384-4470,4.1 / 5,Always a treat to visit everytime I am in Vegas. My favorite steakhouse.,07/19/2012
Gonzalez Y Gonzalez - NYNY Hotel,http://www.opentable.com/gonzalez-y-gonzalez-nyny-hotel?scpref=109&tab=2,3.8,"3790 Las Vegas Blvd South, Suite 11 Las Vegas, NV  89109 ",19,Mexican,$30 and under,New York New York Hotel & Casino,http://www.arkvegas.com/restaurants_gonzalez.htm,"",(702) 740-6455,3.8 / 5,"I live in an area of the U.S. that has very good Mexican food, and while my expectations were not incredibly high for GyG, I still left a bit disappointed. The salsa with chips was good. We tried the enchiladas which were a bit tame on the heat side; would love more heat. My wife's chile rellenos were nothing but breading-- she was pretty disappointed when she finished and the plate was full of the breading. We both like crispy rellenos. The waiter was very inattentive, never filled waters, only came around after the meal was over. Might be a good place for lunch while on the strip, but go elsewhere for dinner.",07/09/2012
Grotto,http://www.opentable.com/grotto-las-vegas?scpref=109&tab=2,4.1,"129 E. Fremont Street The Golden Nugget Hotel and Casino Las Vegas, NV  89101",49,Italian,$31 to $50,The Golden Nugget Hotel & Casino,http://www.grottohouston.com/,grlv@ldry.com,(702) 386-8341,4.1 / 5,Such a great place to eat. We go here every year with our kids.,07/15/2012
The Henry - The Cosmopolitan of Las Vegas,http://www.opentable.com/the-henry-the-cosmopolitan-of-las-vegas?scpref=109&tab=2,3.8,"3708 Las Vegas Blvd South Las Vegas, NV  89109 ",55,American,$30 and under,Cosmopolitan of Las Vegas,http://www.cosmopolitanlasvegas.com/taste/restaurant-collection/the-henry.aspx,"",(877) 893-2001,3.8 / 5,"The staff weren't very attentive, and main course of salmon was over salted. The crab cake was good, but that was about the only positive note. From the good reviews I had read, I was disappointed in both the food and experience.",07/11/2012
Herbs and Rye,http://www.opentable.com/herbs-and-rye?scpref=109&tab=2,4.1,"3713 W Sahara Ave. Las Vegas, NV  89102 ",36,Steak,$30 and under,Near the Strip,http://www.herbsandrye.com,nmendoza@herbsandrye.com,(702) 982-8036,4.1 / 5,"Don't let the outside of this place fool you... THE FOOD IS AWESOME! Now we are not exactly ""young folks"" so when we walked to a very dark and a bit loud eating/bar area - my wife and her mother were a bit taken aback, and not sure where I was bringing them! After a bit of resistance at first, which our server RONNIE did a fantastic job of handling - we settled into a nice booth in front of a magnificent bar playing ratpack movies. I tried one of the many creative cocktails which are neatly presented in their menu. Happy hour offered some REAL BARGAINS on delicious and juicy steaks! And the Wedge Salad was one of the best and biggest I have ever enjoyed! If you are looking for a fun and festive eating experience... this fits the bill.",07/21/2012
Hofbrauhaus - Las Vegas,http://www.opentable.com/hofbrauhaus?scpref=109&tab=2,4.1,"4510 Paradise Rd Las Vegas, NV  89169 ",214,German,$30 and under,Near the Strip,http://www.hofbrauhauslasvegas.com,"",(702) 853-2337,4.1 / 5,We had a great time and our server was terrific! We had a spontaneous Birthday dinner and the band played Happy Birthday and everyone sang- it was wonderful! Thank you for such a great experience!,07/02/2012
Holsteins - The Cosmopolitan of Las Vegas,http://www.opentable.com/holsteins-the-cosmopolitan-of-las-vegas?scpref=109&tab=2,4.0,"3708 Las Vegas Blvd South Las Vegas, NV  89109 ",81,American,$30 and under,Cosmopolitan of Las Vegas,http://www.holsteinslv.com,info@holsteinslv.com,(702) 698-7940,4 / 5,Food was good and server was very knowledgeable of menu.,07/13/2012
Il Fornaio - Las Vegas,http://www.opentable.com/il-fornaio-las-vegas?scpref=109&tab=2,4.1,"3790 S. Las Vegas Blvd. Las Vegas, NV  89103 ",36,Italian,$31 to $50,New York New York Hotel & Casino,http://ilfornaio.com/nyny,nyny@ilfo.com,(702) 650-6500,4.1 / 5,We never fail to visit Il Fornaio when traveling to Vegas. Food and service are consistently very good.,07/12/2012
Il Mulino New York - Las Vegas,http://www.opentable.com/il-mulino-new-york-las-vegas?scpref=109&tab=2,4.5,"3500 South Las Vegas Blvd Forum Shops, Caesars Palace Las Vegas, NV  89109",197,Italian,$50 and over,Caesars Palace,http://www.ilmulino.com,"",(702) 492-6000,4.5 / 5,"We were surprised that the first service of Pellegrino Water was on our bill at 16.00 per bottle. We were not told at service? Everyone was very disappointed. Every starter was that was ordered was to perfection. However, be careful we were served more than what was ordered. My husband ordered a special and we were not given market price. That entree was a whole fish prep in rock salt. The bill $62.00. Overpriced and would have not ordered. One veal entree was overcooked and gritty. A poultry entree was dark meat and dry. The desserts rocked.",07/11/2012
India Palace - Las Vegas,http://www.opentable.com/india-palace-las-vegas?scpref=109&tab=2,4.0,"505 E Twain Ave Las Vegas, NV  89109 ",19,Indian,$30 and under,Near the Strip,http://www.indiapalacelv.com,rschima@mac.com,(702) 796-4177,4 / 5,"Not so friendly or put together staff, took 15min for me to get my ice tea( just a regular ice tea...) When the food did come out it was amazing. Waiters never stopped by to check on us.",07/12/2012
Jaleo - The Cosmopolitan of Las Vegas,http://www.opentable.com/jaleo-the-cosmopolitan-of-las-vegas?scpref=109&tab=2,4.2,"3708 Las Vegas Blvd South Las Vegas, NV  89109 ",401,Spanish,$31 to $50,Cosmopolitan of Las Vegas,http://www.jaleo.com,lasvegas@jaleo.com,(702) 698-7950,4.2 / 5,It's a really fun place to go with excellent service and excellent food. Recommend going with a group... It's a bit too loud if you want to spend an intimate night with a date or a friend.,07/21/2012
Jasmine - Bellagio,http://www.opentable.com/jasmine-bellagio?scpref=109&tab=2,4.2,"3600 Las Vegas Blvd S. Las Vegas, NV  89109 ",103,Chinese,$31 to $50,Bellagio Hotel & Casino,http://www.bellagio.com/jasmine,mszczepans@bellagioresort.com,(702) 693-8166,4.2 / 5,Beautiful Bellagio fountain show seeing.,07/19/2012
"Joe's Seafood, Prime Steak & Stone Crab - Las Vegas",http://www.opentable.com/joes-seafood-prime-steak-and-stone-crab-las-vegas?scpref=109&tab=2,4.5,"3500 Las Vegas Blvd South Las Vegas, NV  89109 ",704,Seafood,$50 and over,Caesars Palace,http://www.joes.net,joesvegas@leye.com,(702) 792-9222,4.5 / 5,"The menu is great for sea food lovers and you can't deny the quality of the crab, lobster and oysters. Unfortunately despite reserving a table for 8.30 we were hurried through our chosen courses within an hour, the service was extremely forced and our waiter although attentive, his small talk was not sincere and he failed to explain the menu to us even though we advised that it was our first time at the restaurant, we overheard other waiters going in to great detail to assist other diners. Great food but sadly the service was very poor and hasn't created a great first impression Joes.",07/20/2012
Kabuki Japanese Restaurant - Las Vegas,http://www.opentable.com/kabuki-japanese-restaurant-las-vegas?scpref=109&tab=2,3.9,"6605 Las Vegas Blvd South #147 Las Vegas, NV  89119",15,Japanese,$30 and under,South Las Vegas,http://www.lasvegaskabuki.com,lasvegas@kabukirestaurants.com,(702) 896-7440,3.9 / 5,"The best Sushi in Vegas, better than sushi Samba.",05/31/2012
Kabuki Japanese Restaurant - Summerlin,http://www.opentable.com/kabuki-japanese-restaurant-summerlin?scpref=109&tab=2,4.2,"400 S. Rampart Blvd. #190 Las Vegas, NV  89145",14,Japanese,$30 and under,Summerlin,http://www.kabukirestaurants.com,summerlin@kabukirestaurants.com,(702) 685-7779,4.2 / 5,Very nice restaurant. Great service and they met our reservation requirements. Prices are reasonable.,07/15/2012
